screening_id,pmid,title,abstract,year,journal,doi,sources,source_count,decision,exclusion_reason,corneal_layer,priority_level,screening_notes
PUBMED_0646,36989713,Successful restoration of corneal surface integrity with a tissue-engineered allogeneic implant in severe keratitis patients.,"OBJECTIVES: Corneal diseases are among the main causes of blindness, with approximately 4.6 and 23 million patients worldwide suffering from bilateral and unilateral corneal blindness, respectively. The standard treatment for severe corneal diseases is corneal transplantation. However, relevant disadvantages, particularly in high-risk conditions, have focused the attention on the search for alternatives. METHODS: We report interim findings of a phase I-II clinical study evaluating the safety and preliminary efficacy of a tissue-engineered corneal substitute composed of a nanostructured fibrin-agarose biocompatible scaffold combined with allogeneic corneal epithelial and stromal cells (NANOULCOR). 5 subjects (5 eyes) suffering from trophic corneal ulcers refractory to conventional treatments, who combined stromal degradation or fibrosis and limbal stem cell deficiency, were included and treated with this allogeneic anterior corneal substitute. RESULTS: The implant completely covered the corneal surface, and ocular surface inflammation decreased following surgery. Only four adverse reactions were registered, and none of them were severe. No detachment, ulcer relapse nor surgical re-interventions were registered after 2 years of follow-up. No signs of graft rejection, local infection or corneal neovascularization were observed either. Efficacy was measured as a significant postoperative improvement in terms of the eye complication grading scales. Anterior segment optical coherence tomography images revealed a more homogeneous and stable ocular surface, with complete scaffold degradation occurring within 3-12 weeks after surgery. CONCLUSIONS: Our findings suggest that the surgical application of this allogeneic anterior human corneal substitute is feasible and safe, showing partial efficacy in the restoration of the corneal surface.",2023,Biomedicine & pharmacotherapy = Biomedecine & pharmacotherapie,10.1016/j.biopha.2023.114612,A3_epithelium_limbus;B3_stroma,2,Include,,multiple_layers,High,"Corrected include: title/abstract indicates corneal tissue engineering, biomaterial/scaffold, engineered construct, decellularized matrix, cell sheet, stem-cell construct, or regeneration/reconstruction relevance."
PUBMED_0647,37014650,On the Mechanical Roles of Glycosaminoglycans in the Tensile Properties of Porcine Corneal Stroma.,"PURPOSE: The cornea is primarily composed of collagen fibrils that are embedded in a ground substance rich in proteoglycans and other glycoproteins. It is known that glycosaminoglycan (GAG) side chains of proteoglycans form anti-parallel duplexes between collagen fibrils. The present work was done in order to investigate the mechanical function of GAGs in defining the tensile properties of porcine corneal stroma. METHODS: Porcine corneal stromal strips dissected from the nasal-temporal direction were divided into control, buffer-treated, and enzyme-treated groups. The samples in the control group were used immediately after dissection. However, the buffer-treated and enzyme-treated samples were, respectively, incubated for 18 hours at 37°C in a buffer solution made up of 100-mM sodium acetate at pH 6.0 or in an enzyme solution containing keratanase II. The Blyscan assay was used to quantify the total GAG content and assess GAG depletion in the samples treated with the enzyme and buffer solutions. Uniaxial tensile tests were also performed to determine the effect of GAG removal on mechanical properties of the cornea. RESULTS: The GAG content in enzyme-treated samples was significantly lower than that of the normal and buffer-treated specimens (P < 0.05). Moreover, GAG-depleted strips showed significantly softer mechanical responses in comparison with the control and buffer samples (P < 0.05). CONCLUSIONS: Removing GAGs from the corneal extracellular matrix led to significant tensile property reduction; supporting the hypothesis that there exists a strong correlation between the GAG content and mechanical properties of the corneal stroma.",2023,Investigative ophthalmology & visual science,10.1167/iovs.64.4.3,B3_stroma,1,Uncertain,,stroma,Low,"Corrected uncertain: may support biological, optical, animal-model, or mechanical benchmarking background, but not clearly a tissue-engineered material or construct."
PUBMED_0648,37019117,Digital light processing-bioprinted poly-NAGA-GelMA-based hydrogel lenticule for precise refractive errors correction.,"Refractive disorder is the most prevalent cause of visual impairment worldwide. While treatment of refractive errors can bring improvement to quality of life and socio-economic benefits, there is a need for individualization, precision, convenience, and safety with the chosen method. Herein, we propose using pre-designed refractive lenticules based on poly-NAGA-GelMA (PNG) bio-inks photo-initiated by digital light processing (DLP)-bioprinting for correcting refractive errors. DLP-bioprinting allows PNG lenticules to have individualized physical dimensions with precision achievable to 10µm (μm). Material characteristics of PNG lenticules in tests included optical and biomechanical stability, biomimetical swelling and hydrophilic capability, nutritional and visual functionality, supporting its suitability as stromal implants. Cytocompatibility distinguished by morphology and function of corneal epithelial, stromal, and endothelial cells on PNG lenticules suggested firm adhesion, over 90% viability, phenotypic maintenance instead of excessive keratocyte-myofibroblast transformation.In-vitroimmune response analyzed by illumina RNA sequencing in human peripheral blood mononuclear cells indicated that PNG lenticules activated type-2 immunity, facilitating tissue regeneration and suppressing inflammation.In-vivoperformance assessed using intrastromal keratoplasty models in New Zealand white rabbits illustrated that implantation of PNG lenticules maintained stable optical pathway, induced controlled stromal bio-integration and regeneration, avoided complications such as stromal melt, interface scarring, etc, but exerted no adverse effects on the host. Postoperative follow-up examination on intraocular pressure, corneal sensitivity, and tear production remained unaffected by surgery up to 1-month post-implantation of PNG lenticules. DLP-bioprinted PNG lenticule is a bio-safe and functionally effective stromal implants with customizable physical dimensions, providing potential therapeutic strategies in correction of refractive errors.",2023,Biofabrication,10.1088/1758-5090/accaab,A3_epithelium_limbus;B3_stroma;D3_full_thickness_multilayer,3,Include,,multiple_layers,High,"Corrected include: title/abstract indicates corneal tissue engineering, biomaterial/scaffold, engineered construct, decellularized matrix, cell sheet, stem-cell construct, or regeneration/reconstruction relevance."
PUBMED_0649,37023465,In Vitro Profiling of the Extracellular Matrix and Integrins Expressed by Human Corneal Endothelial Cells Cultured on Silk Fibroin-Based Matrices.,"Developing a scaffold for culturing human corneal endothelial (HCE) cells is crucial as an alternative cell therapeutic approach to bridge the growing gap between the demand and availability of healthy donor corneas for transplantation. Silk films are promising substrates for the culture of these cells; however, their tensile strength is several-fold greater than the native basement membrane which can possibly influence the dynamics of cell-matrix interaction and the extracellular matrix (ECM) secreted by the cells in long-term culture. In our current study, we assessed the secretion of ECM and the expression of integrins by the HCE cells on Philosamia ricini (PR) and Antheraea assamensis (AA) silk films and fibronectin-collagen (FNC)-coated plastic dishes to understand the cell-ECM interaction in long-term culture. The expression of ECM proteins (collagens 1, 4, 8, and 12, laminin, and fibronectin) on silk was comparable to that on the native tissue. The thicknesses of collagen 8 and laminin at 30 days on both PR (4.78 ± 0.55 and 5.53 ± 0.51 μm, respectively) and AA (4.66 ± 0.72 and 5.71 ± 0.61 μm, respectively) were comparable with those of the native tissue (4.4 ± 0.63 and 5.28 ± 0.72 μm, respectively). The integrin expression by the cells on the silk films was also comparable to that on the native tissue, except for α3 whose fluorescence intensity was significantly higher on PR (p ≤ 0.01) and AA (p ≤ 0.001), compared to that on the native tissue. This study shows that the higher tensile strength of the silk films does not alter the ECM secretion or cell phenotype in long-term culture, confirming the suitability of using this material for engineering the HCE cells for transplantation.",2023,ACS biomaterials science & engineering,10.1021/acsbiomaterials.2c01566,C4_endothelium,1,Include,,endothelium,Medium,"Corrected include: title/abstract indicates corneal tissue engineering, biomaterial/scaffold, engineered construct, decellularized matrix, cell sheet, stem-cell construct, or regeneration/reconstruction relevance."
PUBMED_0650,37034263,Development of stromal differentiation patterns in heterotypical models of artificial corneas generated by tissue engineering.,"Purpose: We carried out a histological characterization analysis of the stromal layer of human heterotypic cornea substitutes generated with extra-corneal cells to determine their putative usefulness in tissue engineering. Methods: Human bioartificial corneas were generated using nanostructured fibrin-agarose biomaterials with corneal stromal cells immersed within. To generate heterotypical corneas, umbilical cord Wharton's jelly stem cells (HWJSC) were cultured on the surface of the stromal substitutes to obtain an epithelial-like layer. These bioartificial corneas were compared with control native human corneas and with orthotypical corneas generated with human corneal epithelial cells on top of the stromal substitute. Both the corneal stroma and the basement membrane were analyzed using histological, histochemical and immunohistochemical methods in samples kept in culture and grafted in vivo for 12 months in the rabbit cornea. Results: Our results showed that the stroma of the bioartificial corneas kept ex vivo showed very low levels of fibrillar and non-fibrillar components of the tissue extracellular matrix. However, in vivo implantation resulted in a significant increase of the contents of collagen, proteoglycans, decorin, keratocan and lumican in the corneal stroma, showing higher levels of maturation and spatial organization of these components. Heterotypical corneas grafted in vivo for 12 months showed significantly higher contents of collagen fibers, proteoglycans and keratocan. When the basement membrane was analyzed, we found that all corneas grafted in vivo showed intense PAS signal and higher contents of nidogen-1, although the levels found in human native corneas was not reached, and a rudimentary basement membrane was observed using transmission electron microscopy. At the epithelial level, HWJSC used to generate an epithelial-like layer in ex vivo corneas were mostly negative for p63, whereas orthotypical corneas and heterotypical corneas grafted in vivo were positive. Conclusion: These results support the possibility of generating bioengineered artificial corneas using non-corneal HWJSC. Although heterotypical corneas were not completely biomimetic to the native human corneas, especially ex vivo, in vivo grafted corneas demonstrated to be highly biocompatible, and the animal cornea became properly differentiated at the stroma and basement membrane compartments. These findings open the door to the future clinical use of these bioartificial corneas.",2023,Frontiers in bioengineering and biotechnology,10.3389/fbioe.2023.1124995,A3_epithelium_limbus,1,Include,,multiple_layers,Medium,"Corrected include: title/abstract indicates corneal tissue engineering, biomaterial/scaffold, engineered construct, decellularized matrix, cell sheet, stem-cell construct, or regeneration/reconstruction relevance."
PUBMED_0651,37043981,Biaxial hyperelastic and anisotropic behaviors of the corneal anterior central stroma along the preferential fibril orientations. Part II: Quantitative computational analysis of mechanical response of stromal components.,"To study the hyperelastic and anisotropic behaviors of the central anterior stroma for patients with myopia, 40 corneal stromal specimens extracted after small incision lenticule extraction (SMILE) surgery were used in the biaxial extension test along two preferential fibril orientations. An improved collagen fibril crimping constitutive model with a specific physical meaning was proposed to analyze the hyperelasticity and anisotropy of the stroma. The effective elastic modulus of the two families of preferentially oriented collagen fibrils and the stiffness of the non-collagenous matrix along all three directions were compared according to the specific physical meaning of the parameters. Anisotropic behavior was found in the hyperelastic properties of the corneal anterior central stroma in the preferential fibril orientations. The stiffness of non-collagenous matrix is significantly larger in the optical axis direction than in the nasal-temporal (NT) and superior-inferior (SI) directions. Moreover, individual differences between males and females slightly impact on hyperelastic and anisotropic behaviors. The differences of these behaviors were significant in the comparison of the left and right eyes. These results have a guiding significance for the accurate design of surgical plans for refractive surgery according to a patient's condition and have a driving value for the further exploration of the biomechanical properties of the whole cornea.",2023,Journal of the mechanical behavior of biomedical materials,10.1016/j.jmbbm.2023.105802,B3_stroma,1,Uncertain,,stroma,Low,"Corrected uncertain: may support biological, optical, animal-model, or mechanical benchmarking background, but not clearly a tissue-engineered material or construct."
PUBMED_0652,37056274,MiRNA 24-3p-rich exosomes functionalized DEGMA-modified hyaluronic acid hydrogels for corneal epithelial healing.,"The damage of corneal epithelium may lead to the formation of irreversible corneal opacities and even blindness. The migration rate of corneal epithelial cells directly affects corneal repair. Here, we explored ocu-microRNA 24-3p (miRNA 24-3p) that can promote rabbit corneal epithelial cells migration and cornea repair. Exosomes, an excellent transport carrier, were exacted from adipose derived mesenchymal stem cells for loading with miRNA 24-3p to prepare miRNA 24-3p-rich exosomes (Exos-miRNA 24-3p). It can accelerate corneal epithelial migration in vitro and in vivo. For application in cornea alkali burns, we further modified hyaluronic acid with di(ethylene glycol) monomethyl ether methacrylate (DEGMA) to obtain a thermosensitive hydrogel, also reported a thermosensitive DEGMA-modified hyaluronic acid hydrogel (THH) for the controlled release of Exos-miRNA 24-3p. It formed a highly uniform and clear thin layer on the ocular surface to resist clearance from blinking and extended the drug-ocular-epithelium contact time. The use of THH-3/Exos-miRNA 24-3p for 28 days after alkali burn injury accelerated corneal epithelial defect healing and epithelial maturation. It also reduced corneal stromal fibrosis and macrophage activation. MiRNA 24-3p-rich exosomes functionalized DEGMA-modified hyaluronic acid hydrogel as a multilevel delivery strategy has a potential use for cell-free therapy of corneal epithelial regeneration.",2023,Bioactive materials,10.1016/j.bioactmat.2022.07.011,A3_epithelium_limbus;B3_stroma,2,Include,,multiple_layers,High,"Corrected include: title/abstract indicates corneal tissue engineering, biomaterial/scaffold, engineered construct, decellularized matrix, cell sheet, stem-cell construct, or regeneration/reconstruction relevance."
PUBMED_0653,37059215,Luteolin ameliorates cornea stromal collagen degradation and inflammatory damage in rats with corneal alkali burn.,"Corneal alkali burn (AB) is a blindness-causing ocular trauma commonly seen in clinics. An excessive inflammatory reaction and stromal collagen degradation contribute to corneal pathological damage. Luteolin (LUT) has been studied for its anti-inflammatory effects. In this study, the effect of LUT on cornea stromal collagen degradation and inflammatory damage in rats with corneal alkali burn was investigated. After corneal alkali burn, rats were randomly assigned to the AB group and AB + LUT group and received an injection of saline and LUT (200 mg/kg) once daily. Subsequently, corneal opacity, epithelial defects, inflammation and neovascularization (NV) were observed and recorded on Days 1, 2, 3, 7 and 14 post-injury. The concentration of LUT in ocular surface tissues and anterior chamber, as well as the levels of collagen degradation, inflammatory cytokines, matrix metalloproteinases (MMPs) and their activity in the cornea were detected. Human corneal fibroblasts (HCFs) were co-cultured with interleukin (IL)-1β and LUT. Cell proliferation and apoptosis were assessed by CCK-8 assay and flow cytometry respectively. Measurement of hydroxyproline (HYP) in culture supernatants was used to quantify the amount of collagen degradation. Plasmin activity was also assessed. ELISA or real-time PCR was used to detect the production of matrix metalloproteinases (MMPs), IL-8, IL-6 and monocyte chemotactic protein (MCP)-1. Furthermore, the immunoblot method was used to assess the phosphorylation of mitogen-activated protein kinases (MAPKs), transforming growth factor-β-activated kinase (TAK)-1, activator protein-1 (AP-1) and inhibitory protein IκB-α. At last, immunofluorescence staining helped to develop nuclear factor (NF)-κB. LUT was detectable in ocular tissues and anterior chamber after intraperitoneal injection. An intraperitoneal injection of LUT ameliorated alkali burn-elicited corneal opacity, corneal epithelial defects, collagen degradation, NV, and the infiltration of inflammatory cells. The mRNA expressions of IL-1β, IL-6, MCP-1, vascular endothelial growth factor (VEGF)-A, and MMPs in corneal tissue were downregulated by LUT intervention. And its administration reduced the protein levels of IL-1β, collagenases, and MMP activity. Furthermore, in vitro study showed that LUT inhibited IL-1β-induced type I collagen degradation and the release of inflammatory cytokines and chemokines by corneal stromal fibroblasts. LUT also inhibited the IL-1β-induced activation of TAK-1, mitogen-activated protein kinase (MAPK), c-Jun, and NF-κB signaling pathways in these cells. Our results demonstrate that LUT inhibited alkali burn-stimulated collagen breakdown and corneal inflammation, most likely by attenuating the IL-1β signaling pathway. LUT may therefore prove to be of clinical value for treating corneal alkali burns.",2023,Experimental eye research,10.1016/j.exer.2023.109466,B3_stroma,1,Uncertain,,multiple_layers,Low,"Corrected uncertain: may support biological, optical, animal-model, or mechanical benchmarking background, but not clearly a tissue-engineered material or construct."
PUBMED_0654,37068490,Stiffness-dependent dynamic effect of inflammation on keratocyte phenotype and differentiation.,"Although extensive studies have evaluated the regulation effect of microenvironment on cell phenotype and cell differentiation, further investigations in the field of the cornea are needed to gain sufficient knowledge for possible clinical translation. This study aims to evaluate the regulation effects of substrate stiffness and inflammation on keratocyte phenotype of corneal fibroblasts, as well as the differentiation from stem cells towards keratocytes. Soft and stiff substrates were prepared based on polydimethylsiloxane. HTK and stem cells were cultured on these substrates to evaluate the effects of stiffness. The possible synergistic effects between substrate stiffness and inflammatory factor IL-1βwere examined by qPCR and immunofluorescence staining. In addition, macrophages were cultured on soft and stiff substrates to evaluate the effect of substrate stiffness on the synthesis of inflammatory factors. The conditioned medium of macrophages (Soft-CM and Stiff-CM) was collected to examine the effects on HTK and stem cells. It was found that inflammatory factor IL-1βpromoted keratocyte phenotype and differentiation when cells were cultured on soft substrate (∼130 kPa), which were different from cells cultured on stiff substrate (∼2 × 10(3)kPa) and TCP (∼10(6)kPa). Besides, macrophages cultured on stiff substrates had significantly higher expression ofIL-1βandTnf-αas compared to the cells cultured on soft substrates. And Stiff-CM decreased the expression of keratocyte phenotype markers as compared to Soft-CM. The results of our study indicate a stiffness-dependent dynamic effect of inflammation on keratocyte phenotype and differentiation, which is of significance not only in gaining a deeper knowledge of corneal pathology and repair, but also in being instructive for scaffold design in corneal tissue engineering and ultimate regeneration.",2023,"Biomedical materials (Bristol, England)",10.1088/1748-605X/accda9,B3_stroma,1,Include,,stroma,Medium,"Corrected include: title/abstract indicates corneal tissue engineering, biomaterial/scaffold, engineered construct, decellularized matrix, cell sheet, stem-cell construct, or regeneration/reconstruction relevance."
PUBMED_0655,37068601,The role of KS GAGs in the microstructure of CXL-treated corneal stroma; a transmission electron microscopy study.,"The mechanical and physical properties of the cornea originate from the microstructure and composition of its extracellular matrix. It is known that collagen fibrils, with a relatively uniform diameter, are organized in a pseudo-hexagonal array. It has been suggested that proteoglycans and the interaction of their glycosaminoglycan (GAG) side chains with themselves and collagen fibrils are important for collagen fibril organization inside the cornea. There are several diseases such as keratoconus in which the regular collagen fibrillar packing becomes distorted causing corneal optical and mechanical properties to be compromised. The primary purpose of the present work was to investigate the role of GAGs on the microstructure of corneal extracellular matrix before and after corneal crosslinking (CXL) treatment. For this purpose, keratan sulphates (KS) were removed from corneal samples using the keratanase enzyme and the CXL procedure was used to crosslink the specimens. The transmission electron microscopy was then used to characterize the diameter of collagen fibrils and their interfibrillar spacing. It was found that KS GAG depletion increased the collagen interfibrillar spacing while the CXL treatment significantly decreased the interfibrillar spacing. The enzyme and CXL treatments had an insignificant effect on the diameter of collagen fibrils. The underlying mechanisms responsible for these observations were discussed in terms of the assumption that GAG chains form duplexes that behave as tiny ropes holding collagen fibrils in place.",2023,Experimental eye research,10.1016/j.exer.2023.109476,B3_stroma,1,Uncertain,,stroma,Low,"Corrected uncertain: may support biological, optical, animal-model, or mechanical benchmarking background, but not clearly a tissue-engineered material or construct."
