screening_id,pmid,title,abstract,year,journal,doi,sources,source_count,decision,exclusion_reason,corneal_layer,priority_level,screening_notes
PUBMED_0477,34620226,Long-term survival of cultivated oral mucosal epithelial cells in human cornea: generating cell sheets using an animal product-free culture protocol.,"Previously, we reported a collagenase-based, animal product-free protocol for cultivated oral mucosal epithelial cell sheets for transplantation (COMET). Here, we reported the long-term outcomes of first 2 clinical cases. A 27-year-old man suffered from thermal burn, which resulted in symblepharon of lower fornix OD. COMET was performed, and the cornea remained clear with few peripheral NV and no more symblepharon 34 months postoperatively. Another 42-year-old man suffered from severe alkaline burn OD. He underwent COMET, followed by corneal transplantation half a year later. A biopsy taken two years after COMET showed stratified epithelium positive for keratin 4, 13, and 3 in the suprabasal layer. Staining for p63 and p75(NTR) was both positive in the basal layer. The graft remained clear up to post-OP 4 years. Our study confirmed the long-term survival of the transplanted OMECs, suggesting that collagenase-based spheroidal suspension culture is a promising technique for COMET.Trial registration ClinicalTrials.gov, ClinicalTrials.gov ID: NCT03943797 Registered 9 May 2019-Retrospectively registered, https://clinicaltrials.gov/ct2/show/NCT03943797 .",2021,Stem cell research & therapy,10.1186/s13287-021-02564-7,A3_epithelium_limbus,1,Include,,epithelium_limbus,Medium,"Corrected include: title/abstract indicates corneal tissue engineering, biomaterial/scaffold, engineered construct, decellularized matrix, cell sheet, stem-cell construct, or regeneration/reconstruction relevance."
PUBMED_0478,34636236,Thermo-Gelling Dendronized Chitosans as Biomimetic Scaffolds for Corneal Tissue Engineering.,"Biomimetic scaffolds with transparent, biocompatible, and in situ-forming properties are highly desirable for corneal tissue engineering, which can deeply fill corneal stromal defects with irregular shapes and support tissue regeneration. We here engineer a novel class of corneal scaffolds from oligoethylene glycol (OEG)-based dendronized chitosans (DCs), whose aqueous solutions show intriguing sol-gel transitions triggered by physiological temperature, resulting in highly transparent hydrogels. Gelling points of these hydrogels can be easily tuned, and furthermore, their mechanical strengths can be significantly enhanced when injected into PBS at 37 °C instead of pure water. In vitro tests indicate that these DC hydrogels exhibit excellent biocompatibility and can promote proliferation and migration of keratocyte. When applied in the rabbit eyes with corneal stromal defects, in situ formed DC hydrogels play a positive effect for new tissue regeneration. Overall, this thermo-gelling DCs possess appealing features as corneal tissue substitutes with their excellent biocompatibility and unprecedented thermoresponsiveness.",2021,ACS applied materials & interfaces,10.1021/acsami.1c16087,B3_stroma,1,Include,,stroma,Medium,"Corrected include: title/abstract indicates corneal tissue engineering, biomaterial/scaffold, engineered construct, decellularized matrix, cell sheet, stem-cell construct, or regeneration/reconstruction relevance."
PUBMED_0479,34642840,Understanding the role of corneal biomechanics-associated genetic variants by bioinformatic analyses.,"PURPOSE: To analyze functions of corneal biomechanical properties (CBP)-related variants as corneal resistance factor (CRF) and corneal hysteresis (CH). METHODS: Related single nucleotide polymorphisms (SNPs) and genes were identified from NHGRI-EBI GWAS catalog, GWASdb v2 and possible data in published studies. HaploReg v4.1 was used to find linkage SNPs. Functional annotations were performed by GWAVA, CADD and RegulomeDB. GTEx Portal database was used to find out expression quantitative trait locus (eQTL) association. Enrichr was used to annotate the function of GWAS gene and the associated signal pathway. STING (v11.0) database was utilized for protein interaction and network construction. RESULTS: The integration of 302 CH-associated and 420 CRF-associated lead SNPs has produced 531 CBP-associated lead SNPs. A total of 5,324 proxy variants identified using the HaploReg v4.1 and lead SNPs were functionally annotated. Based on the threshold (CADD ≥ 10, GWAVA ≥ 0.4 and RegulomeDB < rank 3), 23 prioritized putative regulatory SNPs were identified. Eight prioritized eQTL variants (rs75203695, rs34861673, rs846766, rs11024102, rs1377416, rs3829492, rs9934438 and rs197912) were found with strong potential of CBP regulation. It was indicated that CBP-associated genes were significantly enriched in extracellular matrix receptor interaction pathway, closely related to the phenotype of corneal dystrophy and keratoconus. COL1A1, SMAD3, BMP4 and RUNX2 occupied the core position in the co-expression network. CONCLUSIONS: Data integrative analysis can evaluate CBP variations and explore collagen and extracellular matrix pathways in CBP regulation, which is a promising tool to investigate biological process of corneal diseases.",2022,International ophthalmology,10.1007/s10792-021-02081-9,D3_full_thickness_multilayer,1,Uncertain,,full_thickness_multilayer,Low,"Corrected uncertain: may support biological, optical, animal-model, or mechanical benchmarking background, but not clearly a tissue-engineered material or construct."
PUBMED_0480,34647960,Incidence of Incision-Related Descemet Membrane Detachment Using Phacoemulsification With Trapezoid vs Conventional 2.2-mm Clear Corneal Incision: A Randomized Clinical Trial.,"IMPORTANCE: The conventional 2.2-mm clear corneal incision is relatively narrow compared with the sleeves of Phaco handpieces, resulting in friction at the incision site and increased risk of incision-related Descemet membrane detachment (DMD). The modified 2.2-mm incision only enlarged internal width to 3.0 mm, forming a trapezoid incision shape, which may reduce the friction of surgical instruments and decrease the risk of incisional DMD. OBJECTIVE: To compare the incidence of incision-related DMD between eyes undergoing modified vs conventional 2.2-mm incision phacoemulsification for hard nuclear age-related cataract. DESIGN, SETTING, AND PARTICIPANTS: This double-masked, parallel randomized clinical trial was conducted from July 22, 2019, to January 22, 2020, at Zhongshan Ophthalmic Center, Sun Yat-sen University, Guangzhou, China. The study included patients with age-related cataract and nuclear opalescence grade of 4.0 or greater based on the Lens Opacities Classification System III. Patients were enrolled in this study according to the following inclusion criteria: (1) age between 65 to 90 years; (2) pupil size of 6 mm or greater after dilation; (3) Lens Opacities Classification System III nuclear opalescence grade of 4.0 or more; and (4) corneal endothelial cell density greater than 1500 cells/mm2. INTERVENTIONS: Modified (enlarged internal width to 3.0 mm) or conventional 2.2-mm incision phacoemulsification with intraocular lens implantation. MAIN OUTCOMES AND MEASURES: Incidence of incision-related DMD at postoperative day 1. RESULTS: A total of 130 eyes of 130 patients were randomized into the conventional group (n = 65) or the modified group (n = 65). The mean (SD) age of participants was 74.5 (5.9) years and 74.3 (6.0) years in the conventional and modified groups, respectively. A total of 26 participants in the conventional group (40%) and 27 in the modified group (42%) were men. Compared with eyes in the conventional group, the incidence of DMD in eyes in the modified group was significantly lower at postoperative day 1 (difference, 26.15; 95% CI, 9.60-42.71; P = .003). The difference at postoperative day 7 was 16.92 (95% CI, 2.91-30.94; P = .02). The length of DMD (postoperative day 1: difference, 0.188; 95% CI, 0.075-0.301; P = .002) and maximal corneal thickness at incision site (postoperative day 1: difference, 0.032; 95% CI, 0.006-0.057; P = .02; postoperative day 7: difference, 0.019; 95% CI, 0.003-0.035; P = .02) were lower in the modified group, while visual quality parameter modulation transfer function (postoperative day 1: difference, -0.033; 95% CI, -0.064 to -0.001; P = .04) was higher. No difference was observed between the 2 groups in best-corrected visual acuity, central corneal endothelium loss, or surgically induced astigmatism at any follow-up time. There were no intraoperative complications in the 2 groups. CONCLUSIONS AND RELEVANCE: These findings suggest that modified 2.2-mm trapezoid incision phacoemulsification reduces the incidence of DMD for hard nuclear age-related cataract at postoperative day 1 and might be considered in patients at high risk of incision-related DMD, although the clinical relevance cannot be determined with certainty from this trial. TRIAL REGISTRATION: ClinicalTrials.gov identifier: NCT04014699.",2021,JAMA ophthalmology,10.1001/jamaophthalmol.2021.4148,C4_endothelium,1,Exclude,General ophthalmology/no engineering content,endothelium,,"Corrected exclude: routine clinical/surgical keratoplasty, DMEK/DSAEK/DALK, imaging, outcome, or complication paper without clear biomaterial/scaffold/tissue-engineering construct relevance."
PUBMED_0481,34665231,Femtosecond Laser-Assisted Small Incision Allogeneic Endokeratophakia Using a Hyperopic Lenticule in Rabbits.,"PURPOSE: To investigate the morphologic and histopathologic changes in allogeneic endokeratophakia using hyperopic lenticules derived from small-incision lenticule extraction (SMILE). METHODS: Six New Zealand rabbits (12 eyes) were included in this experiment and randomly and evenly divided into donor and recipient groups. The donor group underwent bilateral hyperopic SMILE surgery, and the concave lenticules were implanted into eyes in the recipient group. Corneal topography and anterior segment optical coherence tomography (OCT) examinations were performed at 1 day, 1 week, 1 month, and 5 months after surgery. All eyes were enucleated 5 months after surgery. Hematoxylin and eosin (HE) staining and transmission electron microscopy (TEM) were used to observe the corneal morphology in the recipient group. RESULTS: No complications were observed, and the corneas remained transparent in the follow-up period. There was mild corneal edema within 1 week after surgery. Slit-lamp microscopy and OCT showed that the lenticules were gradually integrated with the surrounding corneal stroma. HE staining showed that the arrangement of corneal collagen was regular. The boundary between the lenticules and surrounding tissue could be identified with HE staining and TEM, and no inflammatory cells were found under TEM. The corneal Km values were significantly lower at 5 months postoperatively compared to preoperatively (P < 0.05). CONCLUSIONS: This pilot study showed that allogeneic hyperopic SMILE lenticule endokeratophakia seems to be safe and feasible. TRANSLATIONAL RELEVANCE: Allogeneic hyperopic SMILE lenticule endokeratophakia may be applicable for the correction of corneal regression, ectasia, ultra-high myopia, or keratoconus.",2021,Translational vision science & technology,10.1167/tvst.10.12.29,B3_stroma,1,Exclude,General ophthalmology/no engineering content,stroma,,"Corrected exclude: routine clinical/surgical keratoplasty, DMEK/DSAEK/DALK, imaging, outcome, or complication paper without clear biomaterial/scaffold/tissue-engineering construct relevance."
PUBMED_0482,34665455,Preparation and In Vitro Characterization of Gelatin Methacrylate for Corneal Tissue Engineering.,"BACKGROUND: Corneal disease is second only to cataract considered as the leading cause of blindness in the world, with high morbidity. Construction of corneal substitutes in vitro by tissue engineering technology to achieve corneal regeneration has become a research hotspot in recent years. We conducted in-depth research on the biocompatibility, physicochemical and mechanical properties of rat bone marrow mesenchymal stem cells (rBM-MSCs)-seeded gelatin methacrylate (GelMA) as a bioengineered cornea. METHODS: Four kinds of GelMA with different concentrations (7, 10, 15 and 30%) were prepared, and their physic-chemical, optical properties, and biocompatibility with rBM-MSCs were characterized. MTT, live/dead staining, cell morphology, immunofluorescence staining and gene expression of keratocyte markers were performed. RESULTS: 7%GelMA hydrogel had higher equilibrium water content and porosity, better optical properties and hydrophilicity. In addition, it is more beneficial to the growth and proliferation of rBM-MSCs. However, the 30%GelMA hydrogel had the best mechanical properties, and could be more conducive to promote the differentiation of rBM-MSCs into keratocyte-like cells. CONCLUSION: As a natural biological scaffold, GelMA hydrogel has good biocompatibility. And it has the ability to promote the differentiation of rBM-MSCs into keratocyte-like cells, which laid a theoretical and experimental foundation for further tissue-engineered corneal stromal transplantation, and provided a new idea for the source of seeded cells in corneal tissue engineering.",2022,Tissue engineering and regenerative medicine,10.1007/s13770-021-00393-6,B3_stroma;D3_full_thickness_multilayer,2,Include,,stroma,High,"Corrected include: title/abstract indicates corneal tissue engineering, biomaterial/scaffold, engineered construct, decellularized matrix, cell sheet, stem-cell construct, or regeneration/reconstruction relevance."
PUBMED_0483,34673229,Development and characterization of a hydrogel-based adhesive patch for sealing open-globe injuries.,"Full-thickness wounds to the eye can lead to serious vision impairment. Current standards of care (from suturing to tissue transplantation) usually require highly skilled surgeons and use of an operating theater. In this study, we report the synthesis, optimization, and in vitro and ex vivo testing of photocrosslinkable hydrogel-based adhesive patches that can easily be applied to globe injuries or corneal incisions. According to the type and concentration of polymers used in the adhesive formulations, we were able to finely tune the physical properties of the bioadhesive including viscosity, elastic modulus, extensibility, ultimate tensile strength, adhesion, transparency, water content, degradation time, and swellability. Our in vitro studies showed no sign of cytotoxicity of the hydrogels. Moreover, the hydrogel patches showed higher adhesion on freshly explanted pig eyeballs compared to a marketed ocular sealant. Finally, ex vivo feasibility studies showed that the hydrogel patches could seal complex open-globe injuries such as large incision, cruciform injury, and injury associated with tissue loss. These results suggest that our photocrosslinkable hydrogel patch could represent a promising solution for the sealing of open-globe injuries or surgical incisions. STATEMENT OF SIGNIFICANCE: Current management of severe ocular injuries require advanced surgical skills and access to an operating theater. To address the need for emergent management of wounds that cannot be handled in the operating room, surgical adhesives have gained popularity, but none of the currently available adhesives have optimal bioavailability, adhesive or mechanical properties. This study describes the development, optimization and testing of a light-sensitive adhesive patch that can easily be applied to the eye. After solidification using visible light, the patch shows no toxicity and is more adherent to the tissue than a marketed sealant. Thus this technology could represent a promising solution to stabilize ocular injuries in emergency settings before definitive surgical repair.",2022,Acta biomaterialia,10.1016/j.actbio.2021.10.021,D3_full_thickness_multilayer,1,Include,,full_thickness_multilayer,Medium,"Corrected include: title/abstract indicates corneal tissue engineering, biomaterial/scaffold, engineered construct, decellularized matrix, cell sheet, stem-cell construct, or regeneration/reconstruction relevance."
PUBMED_0484,34677503,Preliminary Study on Fish Scale Collagen Lamellar Matrix as Artificial Cornea.,"To construct a novel artificial cornea biomaterial, a method to prepare collagen lamellar matrix was developed in this study using grass carp scales as raw materials. The relationship between the structure of fish scale collagen lamellar matrix and the optical and mechanical properties was analyzed, and co-culture of it and rat bone marrow mesenchymal stem cells (BMSCs) was performed to preliminarily analyze the cellular compatibility of fish scale collagen lamellar matrix. The results show that the grass carp scales could be divided into base region, lateral region and parietal region according to the surface morphology. The inorganic calcium in the surface layer could be effectively removed by decalcification, and the decalcification rate could reach 99%. After etching treatment, homogeneous collagen lamellar matrix could be obtained. With the decalcification and etching treatment, the water content of the sample increased gradually, but the cross-linking treatment had no obvious effect on the water content of fish scale collagen lamellar matrix. Fish scale collagen lamellar matrix has good transparency, refractive index, mechanical properties and cellular compatibility, which may represent a prospect for the construction of cornea tissue engineering products.",2021,Membranes,10.3390/membranes11100737,B3_stroma;D3_full_thickness_multilayer,2,Include,,stroma,High,"Corrected include: title/abstract indicates corneal tissue engineering, biomaterial/scaffold, engineered construct, decellularized matrix, cell sheet, stem-cell construct, or regeneration/reconstruction relevance."
PUBMED_0485,34684011,Generation of a Biomimetic Substitute of the Corneal Limbus Using Decellularized Scaffolds.,"Patients with severe limbal damage and limbal stem cell deficiency are a therapeutic challenge. We evaluated four decellularization protocols applied to the full-thickness and half-thickness porcine limbus, and we used two cell types to recellularize the decellularized limbi. The results demonstrated that all protocols achieved efficient decellularization. However, the method that best preserved the transparency and composition of the limbus extracellular matrix was the use of 0.1% SDS applied to the half-thickness limbus. Recellularization with the limbal epithelial cell line SIRC and human adipose-derived mesenchymal stem cells (hADSCs) was able to generate a stratified epithelium able to express the limbal markers p63, pancytokeratin, and crystallin Z from day 7 in the case of SIRC and after 14-21 days of induction when hADSCs were used. Laminin and collagen IV expression was detected at the basal lamina of both cell types at days 14 and 21 of follow-up. Compared with control native limbi, tissues recellularized with SIRC showed adequate picrosirius red and alcian blue staining intensity, whereas limbi containing hADSCs showed normal collagen staining intensity. These preliminary results suggested that the limbal substitutes generated in this work share important similarities with the native limbus and could be potentially useful in the future.",2021,Pharmaceutics,10.3390/pharmaceutics13101718,D3_full_thickness_multilayer,1,Include,,epithelium_limbus,Medium,"Corrected include: title/abstract indicates corneal tissue engineering, biomaterial/scaffold, engineered construct, decellularized matrix, cell sheet, stem-cell construct, or regeneration/reconstruction relevance."
PUBMED_0486,34713598,Viscoelastic properties' characterization of corneal stromal models using non-contact surface acoustic wave optical coherence elastography (SAW-OCE).,"Viscoelastic characterization of the tissue-engineered corneal stromal model is important for our understanding of the cell behaviors in the pathophysiologic altered corneal extracellular matrix (ECM). The effects of the interactions between stromal cells and different ECM characteristics on the viscoelastic properties during an 11-day culture period were explored. Collagen-based hydrogels seeded with keratocytes were used to replicate human corneal stroma. Keratocytes were seeded at 8 × 10(3) cells per hydrogel and with collagen concentrations of 3, 5 and 7 mg/ml. Air-pulse-based surface acoustic wave optical coherence elastography (SAW-OCE) was employed to monitor the changes in the hydrogels' dimensions and viscoelasticity over the culture period. The results showed the elastic modulus increased by 111%, 56% and 6%, and viscosity increased by 357%, 210% and 25% in the 3, 5 and 7 mg/ml hydrogels, respectively. To explain the SAW-OCE results, scanning electron microscope was also performed. The results confirmed the increase in elastic modulus and viscosity of the hydrogels, respectively, arose from increased fiber density and force-dependent unbinding of bonds between collagen fibers. This study reveals the influence of cell-matrix interactions on the viscoelastic properties of corneal stromal models and can provide quantitative guidance for mechanobiological investigations which require collagen ECM with tuneable viscoelastic properties.",2022,Journal of biophotonics,10.1002/jbio.202100253,B3_stroma,1,Include,,stroma,Medium,"Corrected include: title/abstract indicates corneal tissue engineering, biomaterial/scaffold, engineered construct, decellularized matrix, cell sheet, stem-cell construct, or regeneration/reconstruction relevance."
PUBMED_0487,34736886,"Descemet's membrane injury and regeneration, and posterior corneal fibrosis, in rabbits.","The purpose of this investigation was to study Descemet's membrane and corneal endothelial regeneration, myofibroblast generation and disappearance, and TGF beta-1 localization after Descemet's membrane-endothelial excision (Descemetorhexis) in rabbits. Thirty-six rabbits had 8 mm Descemetorhexis and standardized slit lamp photos at 1, 2 and 4 days, 1, 2 and 4 weeks, and 2, 4 and 6 months, as well as multiplex IHC for stromal cell markers keratocan, vimentin, and alpha-smooth muscle actin (SMA); basement membrane (BM) components perlecan, nidogen-1, laminin alpha-5, and collagen type IV; and corneal endothelial marker Na,K-ATPase β1, and TGF beta-1, with ImageJ quantitation. Stromal transparency increased from the periphery beginning at two months after injury and progressed into the central cornea by six months. At six months, central transparency was primarily limited by persistent mid-stromal neovascularization. Stromal myofibroblast zone thickness in the posterior stroma peaked at one month after injury, and then progressively decreased until to six months when few myofibroblasts remained. The regeneration of a laminin alpha-5 and nidogen-1 Descemet's membrane ""railroad track"" structure was accompanied by corneal endothelial closure and stromal cell production of BM components in corneas from four to six months after injury. TGF beta-1 deposition at the posterior corneal surface from the aqueous humor peaked at one day after Descemetorhexis and diminished even before regeneration of the endothelium and Descemet's membrane. This decrease was associated with collagen type IV protein production by corneal fibroblasts, and possibly myofibroblasts, in the posterior stroma. Descemet's membrane and the corneal endothelium regenerated in the rabbit cornea by six months after eight mm Descemetorhexis. Real-time quantitative RT-PCR experiments in vitro with marker-verified rabbit corneal cells found that 5 ng/ml or 10 ng/ml TGF beta-1 upregulated col4a1 or col4a2 mRNA expression after 6 h or 12 h of exposure in corneal fibroblasts, but not in myofibroblasts. Stromal cells produced large amounts of collagen type IV that likely decreased TGF beta-1 penetration into the stroma and facilitated the resolution of myofibroblast-generated fibrosis.",2021,Experimental eye research,10.1016/j.exer.2021.108803,B3_stroma;C4_endothelium,2,Uncertain,,stroma,Low,Corrected uncertain: insufficient title/abstract evidence for confident inclusion or exclusion.
