screening_id,pmid,title,abstract,year,journal,doi,sources,source_count,decision,exclusion_reason,corneal_layer,priority_level,screening_notes
PUBMED_0442,34205905,Can Human Oral Mucosa Stem Cells Differentiate to Corneal Epithelia?,"Human oral mucosa stem cells (hOMSCs) arise from the neural crest, they can self-renew, proliferate, and differentiate to several cell lines and could represent a good source for application in tissue engineering. Because of their anatomical location, hOMSCs are easy to isolate, have multilineage differentiation capacity and express embryonic stem cells markers such as-Sox2, Oct3/4 and Nanog. We have used SHEM (supplemented hormonal epithelial medium) media and cultured hOMSCs over human amniotic membrane and determined the cell's capacity to differentiate to an epithelial-like phenotype and to express corneal specific epithelial markers-CK3, CK12, CK19, Pan-cadherin and E-cadherin. Our results showed that hOMSCs possess the capacity to attach to the amniotic membrane and express CK3, CK19, Pan-Cadherin and E-Cadherin without induction with SHEM media and expressed CK12 or changed the expression pattern of E-Cadherin to a punctual-like feature when treated with SHEM media. The results observed in this study show that hOMSCs possess the potential to differentiate toward epithelial cells. In conclusion, our results revealed that hOMSCs readily express markers for corneal determination and could provide the ophthalmology field with a therapeutic alternative for tissue engineering to achieve corneal replacement when compared with other techniques. Nevertheless, further studies are needed to develop a predictable therapeutic alternative for cornea replacement.",2021,International journal of molecular sciences,10.3390/ijms22115976,A3_epithelium_limbus,1,Include,,epithelium_limbus,Medium,"Corrected include: title/abstract indicates corneal tissue engineering, biomaterial/scaffold, engineered construct, decellularized matrix, cell sheet, stem-cell construct, or regeneration/reconstruction relevance."
PUBMED_0443,34236908,Descemet Membrane Detachment Due to Laser Application in Femtosecond Laser-Assisted Cataract Surgery: Incidence and Risk Factors.,"PURPOSE: To assess the incidence and risk factors of Descemet membrane detachment due to laser application in femtosecond laser-assisted cataract surgery (FLACS). METHODS: In this retrospective case series, all patients who underwent FLACS with the LenSx system (Alcon Laboratories, Inc) were eligible to participate. The medical records were reviewed to collect data regarding potential risk factors related to Descemet membrane detachment, including patients' demographics, laser parameters, and ocular measurements. The eyes were separated into two groups based on the clinical diagnosis of Descemet membrane detachment as the femto-second laser was performing the corneal incisions. RESULTS: Five hundred ten eyes (304 patients) were included. Descemet membrane detachment occurred in 20 (3.9%) eyes of 16 (5.3%) patients. Four (1.3%) patients had a detachment in both eyes. In 16 (3.1%) eyes, the Descemet membrane detachment occurred in the secondary incision site. The eyes that had a detachment had a statistically lower mean endothelial cell density (2,193.40 ± 313.37 versus 2,385.08 ± 357.80 cells/ mm(2); P = .019), and a statistically higher prevalence of corneal guttata (25.0% versus 8.8%; P = .015). None of the other analyzed variables statistically differed between the groups (P > .05). The risk of having Descemet membrane detachment was statistically higher among eyes with guttata (odds ratio = 3.47; P = .015) and in those with an endothelial cell density of less than 2,000 cells/mm(2) (odds ratio = 3.26; P = .014). CONCLUSIONS: The incidence of Descemet membrane detachment due to laser application in FLACS was 3.9%, with the associated risk factors being endothelial cell density of less than 2,000 cells/mm(2) and corneal guttata. [J Refract Surg. 2021;37(7):466-471.].",2021,"Journal of refractive surgery (Thorofare, N.J. : 1995)",10.3928/1081597X-20210406-01,C4_endothelium,1,Exclude,General ophthalmology/no engineering content,endothelium,,"Corrected exclude: routine clinical/surgical keratoplasty, DMEK/DSAEK/DALK, imaging, outcome, or complication paper without clear biomaterial/scaffold/tissue-engineering construct relevance."
PUBMED_0444,34252899,Fabrication and Characterization of Silk Fibroin-Based Nanofibrous Scaffolds Supplemented with Gelatin for Corneal Tissue Engineering.,"Tissue engineering is a promising approach to overcome the severe worldwide shortage of healthy donor corneas. In this work, we have developed a silk-gelatin composite scaffold using electrospinning and permeation techniques to achieve the properties comparable to cornea analog. In particular, we present the fabrication and comparative evaluation of the novel gelatin sheets consisting of silk fibroin nanofibers, which are prepared using silk fibroin (SF) (in formic acid) and SF (in aqueous) electrospun scaffolds, for its suitability as corneal stromal analogs. All the fabricated samples were treated with ethanol vapor (T) to physically crosslink the silk nanofibers. Micro/nano-scale features of the fabricated scaffolds were analyzed using scanning electron microscopy micrographs. Fourier transform infrared spectroscopy revealed characteristic peaks of polymeric functional groups and modifications upon ethanol vapor treatment. Transparency of the scaffolds was determined using UV-visible spectra. Among all the fabricated samples, the gelatin-permeated SF (in formic acid; T) scaffold showed the highest level of transparency, i.e., 77.75 ± 2.3%, which is similar to that of the native cornea (∼70%-90% [variable with age group]) with healthy acute vision. Contact angle of the samples was studied to estimate the hydrophilicity of the scaffolds. All the scaffolds except non-treated SF (in aqueous; NT) were found to be significantly stable up to 14 days when incubated in phosphate buffered saline at 37°C. Treated samples showed significantly better stability, both physically and microscopically, in comparison to nontreated samples. Proliferation and viability assays of rabbit corneal fibroblast cells (SIRC) and mouse fibroblast cells (L929 RFP) when cultured on fabricated scaffolds revealed remarkable cellular compatibility with gelatin-permeated SF (in formic acid; T) scaffolds compared to SF (in aqueous; T). Unlike other reports in the existing literature, this work presents the design and development of a nanofibrous silk-gelatin composite that exhibits acceptable transparency, cellular biocompatibility, as well as improved mechanical stability comparable to that of native cornea. Therefore, we anticipate that the fabricated novel scaffold is likely to be a good candidate for corneal tissue construct. Moreover, among the fabricated scaffolds, the outcomes depict gelatin-permeated SF (in formic acid; T) composite scaffold to be a better candidate as a corneal stromal analog that carries properties of both the silk and gelatin, i.e., optimal transparency, better stability, and enhanced cytocompatibility.",2021,"Cells, tissues, organs",10.1159/000515946,B3_stroma;D3_full_thickness_multilayer,2,Include,,stroma,High,"Corrected include: title/abstract indicates corneal tissue engineering, biomaterial/scaffold, engineered construct, decellularized matrix, cell sheet, stem-cell construct, or regeneration/reconstruction relevance."
PUBMED_0445,34277619,Novel Cell Culture Paradigm Prolongs Mouse Corneal Epithelial Cell Proliferative Activity in vitro and in vivo.,"It has been a long-standing challenge to obtain from cell cultures adequate amounts of mouse corneal epithelial cells (mCEC) to perform transplantation surgery. This limitation is attributable to the passage dependent declines in their proliferative activity. We describe here development of a novel 6C medium that contains six different modulators of different signaling pathways, which control proliferative mCEC activity. Its usage shortens the time and effort required to obtain epithelial sheets for hastening healing of an epithelial wound in an experimental animal model. This serum-free 6C medium contains:Y27632, forskolin, SB431542, DAPT, IWP-2, LDN-193189 and also DermaLife K keratinocyte calcium. Their inclusion inhibits rises in four specific markers of epithelial mesenchymal transdifferentiation:ZEB1/2, Snail, β-catenin and α-SMA. This medium is applied in a feeder-free air-lifted system to obtain sufficient populations of epithelial progenitor cells whose procurement is facilitated due to suppression of progenitor epithelial cell transdifferentiation into epithelial-mesenchymal cells. Diminution of this decline in transdifferentiation was confirmed based on the invariance of P63, K14, Pax6, and K12 gene expression levels. This cell culture technique is expected to facilitate ex vivo characterization of mechanisms underlying cell fate determination. Furthermore, its implementation will improve yields of progenitor mouse corneal epithelial cells, which increases the likelihood of using these cells as a source to generate epithelial sheets for performing transplantation surgery to treat limbal stem cell deficiency in a clinical setting. In addition, the novel insight obtainable from such studies is expected to improve the outcomes of corneal regenerative medicine.",2021,Frontiers in cell and developmental biology,10.3389/fcell.2021.675998,A3_epithelium_limbus,1,Uncertain,,epithelium_limbus,Low,"Corrected uncertain: may support biological, optical, animal-model, or mechanical benchmarking background, but not clearly a tissue-engineered material or construct."
PUBMED_0446,34296350,Descemet's membrane area and posterior corneal power may predict the Descemet membrane folds after deep anterior lamellar keratoplasty in patients with advanced keratoconus.,"AIMS: To investigate possible predictive topographic characteristics for the development of Descemet's membrane (DM) folds after the uneventful deep anterior lamellar keratoplasty (DALK). METHODS: A retrospective study included 56 eyes of 56 consecutive patients who underwent uneventful DALK using the big-bubble technique to treat advanced keratoconus. At baseline and each visit, best-corrected logMAR visual acuity (BCVA), slit-lamp findings, endothelial cell density, topographic parameters were recorded. DM area is calculated using morphogeometric modelling. RESULTS: Twelve (21.4%) of them exhibited DM folds, whereas the remaining 44 (78.6%) did not exhibit any DM folds after the surgery. The mean follow-up time was 36.3 ± 16.7 (range, 12-71) months. The mean posterior corneal power was - 13.8 ± 0.6 D in patients with DM folds, whereas - 13.0 ± 0.8 D in those without DM folds (p = 0.016). The mean DM area was 53.6 ± 2.3 (50.9-57.9) mm(2) in patients with DM folds, whereas 51.6 ± 1.7 (47.1-53.9) mm(2) in those without DM folds (p = 0.001). The ROC curve showed that two best cut-off value for the posterior corneal power and DM area were 13.75 D and 53.8 mm(2), respectively, to predict the occurrence of DM folds. CONCLUSION: DALK surgery seems to cause DM folds in patients with large DM area and high posterior corneal power.",2021,International ophthalmology,10.1007/s10792-021-01974-z,C4_endothelium,1,Exclude,General ophthalmology/no engineering content,endothelium,,"Corrected exclude: routine clinical/surgical keratoplasty, DMEK/DSAEK/DALK, imaging, outcome, or complication paper without clear biomaterial/scaffold/tissue-engineering construct relevance."
PUBMED_0447,34302219,cG-CAOMECS-clinical-grade cultured autologous oral mucosal epithelial cell sheet.,"The present study reports the feasibility and successful production of rabbit cG-CAOMECS, designed to reconstruct corneal epithelium of patients with bilateral limbal stem cell deficiency. To produce a safe, chemically defined and FDA compliant cG-CAOMECS, oral mucosal epithelial cells were isolated from a biopsy of rabbit buccal tissue and seeded on a cGMP-certified cell culture surface coated with GMP-grade extracellular matrix. A newly designed clinical-grade medium (KaFa™ medium) was utilized to carry out cell expansion. Detachment and harvesting of the produced cell sheet was accomplished using collagenase treatment. Live cell imaging and morphological analysis techniques were used to examine cell growth. Cells attached onto the surface and self-assembled into colony-forming units (CFUs). Microscopic examination showed that CFUs formed during the first 5 days, and basal monolayer cell sheet formed in less than 10 days. Cells expanded to form a multilayered epithelial cell sheet that was harvested after 17-19 days in culture. Immunostaining and Western blot analyses showed that deltaNp63 was expressed in the basal cells and K3/K12 was expressed in the apical cells, indicating the presence of corneal epithelial-like cells in the produced cell sheet. Adhesion molecules, E-cadherin, beta-catenin, and Cnx43 were also expressed and exhibited the epithelial integrity of the cell sheet. The expression of integrin-beta1 and beta4 confirmed that the collagenase treatment used for detaching and harvesting the cell sheet did not have adverse effects. Our results showed that the utilization of clinical-grade and FDA-approved reagents successfully supported the production of cG-CAMECS.",2021,Cell and tissue research,10.1007/s00441-021-03507-7,A3_epithelium_limbus,1,Include,,epithelium_limbus,Medium,"Corrected include: title/abstract indicates corneal tissue engineering, biomaterial/scaffold, engineered construct, decellularized matrix, cell sheet, stem-cell construct, or regeneration/reconstruction relevance."
PUBMED_0448,34311490,Descemet Membrane Endothelial Keratoplasty (DMEK) in Previously Vitrectomized Eyes: Complications and Clinical Outcomes.,"PURPOSE: To evaluate the results and complications of Descemet membrane endothelial keratoplasty (DMEK) in previously vitrectomized eyes. DESIGN: Retrospective study of 35 eyes that had undergone DMEK, due to Fuchs endothelial corneal dystrophy (FECD), at our department with a follow-up after 6 months postoperatively. We compared the intraoperative procedure, complications, and results of DMEK between 14 previously vitrectomized pseudophakic eyes (group 1) and a control group of 21 pseudophakic non-vitrectomized eyes (group 2). RESULTS: The unfolding time (in minutes) was significantly longer in group 1 than in group 2 (10.5 ± 6.4 vs. 3.2 ± 1.5, p < 0.01). A single re-bubbling was needed in 8 patients in group 1 (57.1%) and in 3 patients in group 2 (14.2%) (p < 0.01). Repeated re-bubbling (≥ 1 time) was performed in only 5 patients of group 1 (35.7%). There was significant postoperative improvement in best-corrected visual acuity (BCVA, in LogMAR) in both groups (p = 0.04 in group 1 and p < 0.01 in group 2). The central corneal thickness (CCT, in µm) did not differ significantly between the two groups preoperatively (p = 0.4) or postoperatively (p = 0.1). However, the CCT decreased significantly postoperatively in both groups (p < 0.01 in both groups). The postoperative endothelial cell density (ECD in cell/mm²) was significantly lower in group 1 than in group 2 (p = 0.03). CONCLUSION: DMEK in previously vitrectomized eyes presents a surgical challenge, which requires special, and sometimes unpredictable, intraoperative maneuvers, but good functional and morphological results can be achieved. The use of the endothelial Descemet membrane lamellae (EDML) of older donors might be recommended to facilitate the intraoperative unfolding process.",2021,Klinische Monatsblatter fur Augenheilkunde,10.1055/a-1517-4518,C4_endothelium,1,Exclude,General ophthalmology/no engineering content,endothelium,,"Corrected exclude: routine clinical/surgical keratoplasty, DMEK/DSAEK/DALK, imaging, outcome, or complication paper without clear biomaterial/scaffold/tissue-engineering construct relevance."
PUBMED_0449,34327854,Tissue engineering of corneal stroma via melt electrowriting.,"The cornea serves as the main refractive component of the eye with the corneal stroma constituting the thickest component in a stratified layered system of epithelia, stroma, and endothelium. Current treatment options for patients suffering from corneal diseases are limited to transplantation of a human donor cornea (keratoplasty) or to implantation of an artificial cornea (keratoprosthesis). Nevertheless, donor shortage and failure of artificial corneas to integrate with local tissue constitute important problems that have not been yet circumvented. Recent advances in biofabrication have made great progress toward the manufacture of tailored biomaterial templates with the potential of guiding partially or totally the regeneration process of the native cornea. However, the role of the corneal stroma on current tissue engineering strategies is often neglected. Here, we achieved a tissue-engineered corneal stroma substitute culturing primary keratocytes on scaffolds prepared via melt electrowriting (MEW). Scaffolds were designed to contain highly organized micrometric fibers to ensure transparency and encourage primary human keratocytes to self-orchestrate their own extracellular matrix deposition and remodeling. Results demonstrated reliable cell attachment and growth over a period of 5 weeks and confirmed the formation of a dense and highly organized de novo tissue containing collagen I, V, and VI as well as Keratocan, which resembled very closely the native corneal stoma. In summary, MEW brings us closer to the biofabrication of a viable corneal stroma substitute.",2021,Journal of tissue engineering and regenerative medicine,10.1002/term.3235,B3_stroma,1,Include,,stroma,Medium,"Corrected include: title/abstract indicates corneal tissue engineering, biomaterial/scaffold, engineered construct, decellularized matrix, cell sheet, stem-cell construct, or regeneration/reconstruction relevance."
PUBMED_0450,34330126,Bioprinting of dual ECM scaffolds encapsulating limbal stem/progenitor cells in active and quiescent statuses.,"Limbal stem cell deficiency and corneal disorders are among the top global threats for human vision. Emerging therapies that integrate stem cell transplantation with engineered hydrogel scaffolds for biological and mechanical support are becoming a rising trend in the field. However, methods for high-throughput fabrication of hydrogel scaffolds, as well as knowledge of the interaction between limbal stem/progenitor cells (LSCs) and the surrounding extracellular matrix (ECM) are still much needed. Here, we employed digital light processing (DLP)-based bioprinting to fabricate hydrogel scaffolds encapsulating primary LSCs and studied the ECM-dependent LSC phenotypes. The DLP-based bioprinting with gelatin methacrylate (GelMA) or hyaluronic acid glycidyl methacrylate (HAGM) generated microscale hydrogel scaffolds that could support the viability of the encapsulated primary rabbit LSCs (rbLSCs) in culture. Immunocytochemistry and transcriptional analysis showed that the encapsulated rbLSCs remained active in GelMA-based scaffolds while exhibited quiescence in the HAGM-based scaffolds. The primary human LSCs encapsulated within bioprinted scaffolds showed consistent ECM-dependent active/quiescent statuses. Based on these results, we have developed a novel bioprinted dual ECM 'Yin-Yang' model encapsulating LSCs to support both active and quiescent statues. Our findings provide valuable insights towards stem cell therapies and regenerative medicine for corneal reconstruction.",2021,Biofabrication,10.1088/1758-5090/ac1992,A3_epithelium_limbus;D3_full_thickness_multilayer,2,Include,,epithelium_limbus,High,"Corrected include: title/abstract indicates corneal tissue engineering, biomaterial/scaffold, engineered construct, decellularized matrix, cell sheet, stem-cell construct, or regeneration/reconstruction relevance."
PUBMED_0451,34358452,Pluripotent stem cell-derived corneal endothelial cells as an alternative to donor corneal endothelium in keratoplasty.,"Here, we evaluate the efficacy of cryopreserved human embryonic stem cell (hESC)-derived corneal endothelial cells (CECs) to form a functional monolayer of corneal endothelium (CE) in rabbits and monkeys. We injected cryopreserved hESC-derived CECs into the anterior chamber of rabbits and monkeys either immediately after mechanical scraping of the central CE or a few days later when corneal edema developed. All preclinical models developed deturgesced and clear corneas following the injection of cryopreserved hESC-derived CECs and remained comparable to the corneas of the untreated eye. Confocal scanning microscopy confirmed an intact structure of hexagonal/polygonal cells and immunohistochemical analysis illustrated a monolayer expressing barrier and pump function proteins in the regenerated CE. The necropsy examination confirmed no remarkable change in multiple tissues assessed for teratoma formation. In conclusion, our data demonstrate the efficacy of cryopreserved hESC-derived CECs to form a functional CE on the denuded Descemet's membrane.",2021,Stem cell reports,10.1016/j.stemcr.2021.07.008,C4_endothelium,1,Exclude,General ophthalmology/no engineering content,endothelium,,"Corrected exclude: routine clinical/surgical keratoplasty, DMEK/DSAEK/DALK, imaging, outcome, or complication paper without clear biomaterial/scaffold/tissue-engineering construct relevance."
PUBMED_0452,34394861,Structural Changes in Thin Keratoconic Corneas Following Crosslinking with Hypotonic Riboflavin: Findings on In Vivo Confocal Microscopy.,"PURPOSE: To report structural changes observable in in vivo confocal microscopy (IVCM) in keratoconic corneas < 400 μm treated with hypotonic riboflavin and collagen crosslinking (CXL). METHODS: Ten eyes of ten patients with progressive keratoconus and corneal thickness between 350 and 399 μm underwent CXL with hypotonic riboflavin. IVCM was performed preoperatively and at one month, three months, and six months after the procedure. RESULTS: IVCM analysis one month postoperatively showed complete absence of the subepithelial nerve plexus with gradual regeneration over six months in 8 of the 10 eyes, and poor regeneration in the remaining 2 eyes. The anterior stroma showed extracellular lacunae and hyper-reflective cytoplasm in a honeycomb appearance signifying edema at one month which gradually decreased over six months post CXL. Stromal keratocyte apoptosis was evident in the anterior stroma in all cases and extended to the posterior stroma in four eyes with gradual regeneration evident at three and six months. The specular endothelial count decreased by 8% (P = 0.005) post-CXL, but no corneas developed clinical signs of endothelial trauma. CONCLUSION: IVCM analysis of thin corneas after hypotonic CXL showed posterior corneal structural changes. Posterior stromal changes were accompanied by a decrease in the endothelial cell count. This case series was a preliminary feasibility study that might necessitate conducting a well-designed controlled study.",2021,Journal of ophthalmic & vision research,10.18502/jovr.v16i3.9429,B3_stroma,1,Exclude,General ophthalmology/no engineering content,multiple_layers,,"Corrected exclude: routine clinical/surgical keratoplasty, DMEK/DSAEK/DALK, imaging, outcome, or complication paper without clear biomaterial/scaffold/tissue-engineering construct relevance."
