screening_id,pmid,title,abstract,year,journal,doi,sources,source_count,decision,exclusion_reason,corneal_layer,priority_level,screening_notes
PUBMED_0676,37282694,22 Renewal of conjunctival epithelium over amniotic membrane to perform autologous simple conjunctival epithelial transplantation (SCET): in vitro validation and results of clinical application for primary pterygium.,"BACKGROUND: Transplantation of ex vivo cultured conjunctival cell layers, generated on amniotic membrane or other scaffolds, provides a viable option in treating heterogeneous ocular surface conditions. By comparison, cell therapy is costly, labour-intensive and subject to good manufacturing practice requirements and regulatory approval; no conjunctival cell-based therapy is currently available. Several techniques are available after primary pterygium excision to recover the ocular surface anatomy by restoring healthy conjunctival epithelium and preventing recurrence and complications. However, application of conjunctival free autograft or transpositional flap to cover the bared scleral area is limited when the conjunctiva are to be spared for future glaucoma filtering surgery, in patients with large or double-headed pterygia, in recurrent pterygia, or when the harvesting of donor conjunctival is precluded by scarring. AIM: To develop a simple technique to obtain expansion of the conjunctival epithelium when applied in vivo in diseased eyes. METHODS: We evaluated in vitro the best way of gluing conjunctival fragments over the AM, the efficiency of the fragments to generate conjunctival cell outgrowths, the molecular marker expression, and the feasibility of shipping preloaded AM.We performed simple conjunctival epithelial transplantation (SCET) in which we glued an amniotic membrane patch pre-loaded with autologous conjunctival tissue fragments over the scleral defect after pterygium excision and evaluated the recovery of the normal conjunctival epithelium and the disease recurrence up to 12 months after surgery. RESULTS: 65-80% of fragments generated outgrowth 48-72h after gluing, without differences between type of AM preparation and fragment size. Within 6-13 days, a full epithelium covered the surface of the amniotic membrane. Specific marker expression (Muc1, K19, K13, p63, ZO-1) was detected. The shipping test showed after 24h the 31% of the fragments glued over the AM epithelial side, compared to more than 90% of fragments stayed attached in the remaining conditions (stromal side, stromal without spongy layer, epithelial side without epithelium).Surgical excision and SCET for nasal primary pterygium were performed in 6 eyes/patients. No graft detachment and recurrence occurred within 12 months. In vivo confocal microscopy showed progressive expansion of the conjunctival cell population and formation of a clear cornea-conjunctiva transition. CONCLUSIONS: We established the most suitable conditions for a novel strategy based on in vivo expansion of conjunctival cells from conjunctival fragments glued over the AM. The application of SCET seems to be effective and replicable for the renewal of conjunctiva in patients requiring ocular surface reconstruction.",2022,BMJ open ophthalmology,10.1136/bmjophth-2022-EEBA.22,A3_epithelium_limbus,1,Include,,multiple_layers,Medium,"Corrected include: title/abstract indicates corneal tissue engineering, biomaterial/scaffold, engineered construct, decellularized matrix, cell sheet, stem-cell construct, or regeneration/reconstruction relevance."
PUBMED_0677,37282697,24 Effect of graft preparation techniques on clinical outcomes after Descemet membrane endothelial keratoplasty (DMEK).,"PURPOSE: To compare the clinical outcomes after Descemet membrane endothelial keratoplasty (DMEK) for grafts prepared by the manual no-touch peeling technique and grafts prepared by a modified liquid bubble technique. MATERIAL AND METHODS: For this study, 236 DMEK grafts were included that were prepared at Amnitrans EyeBank Rotterdam by experienced eye bank personnel. 132 grafts were prepared by using the 'no-touch' DMEK preparation technique and 104 grafts by using a modified liquid bubble technique. The liquid bubble technique was modified to render it a no-touch technique while maintaining the ability to save the anterior donor button as a potential Deep Anterior lamellar keratoplasty (DALK) or Bowman layer (BL) graft. DMEK surgeries were performed at Melles Cornea Clinic Rotterdam by experienced DMEK surgeons. All patients underwent DMEK for Fuchs endothelial dystrophy. Average patient age was 68 (±10) years and average donor age was 69 (±9) years with no difference between the two groups. Endothelial cell density (ECD) was evaluated after graft preparation by light microscopy in the eye bank and at 6-month postoperatively by specular microscopy. RESULTS: Endothelial cell density (ECD) decreased from 2705 (±146) cells/mm2 (n=132) before to 1570 (±490) cells/mm2 (n=130) at 6 months postoperatively for grafts prepared by the no-touch technique. For grafts prepared by the modifiedliquid bubble technique, ECD decreased from 2627 (±181) cells/mm2 (n=104) before to 1553 (±513) cells/mm2 (n=103) after surgery. Postoperative ECD did not differ for grafts prepared by the two techniques (P=0.79). Central corneal thickness (CCT) decreased from 660 (±124) µm to 513 (±36) µm postoperatively in the no-touch group and from 684 (±116) µm to 515 (±35) µm postoperatively in the modified liquid bubble group, with no postoperative CCT difference between groups (P=0.59). In total 3 eyes underwent re-surgery within the study period (n=2 (1.5%) in the no-touch group, n=1 (1.0%) in the liquid bubble group; P=0.71) and 26 eyes required a re-bubbling procedure for incomplete graft adherence (n=16 (12%) in the no-touch group, n=10 (10%) in the liquid bubble group; P=0.37). CONCLUSION: Clinical outcomes after DMEK are comparable for grafts prepared by either the manual no-touch peeling technique or the modified liquid bubble technique. While both techniques are safe and useful techniques to prepare DMEK grafts, the modified liquid bubble technique offers advantages for corneas with scars.",2022,BMJ open ophthalmology,10.1136/bmjophth-2022-EEBA.24,C4_endothelium,1,Exclude,General ophthalmology/no engineering content,endothelium,,"Corrected exclude: routine clinical/surgical keratoplasty, DMEK/DSAEK/DALK, imaging, outcome, or complication paper without clear biomaterial/scaffold/tissue-engineering construct relevance."
PUBMED_0678,37290822,Visual function after ultrathin Descemet's stripping automated endothelial keratoplasty or Descemet's membrane endothelial keratoplasty combined with cataract surgery: a randomised controlled clinical trial.,"AIMS: To compare best-corrected visual acuity (BCVA), contrast sensitivity and endothelial cell density (ECD) after ultrathin Descemet's stripping automated endothelial keratoplasty (UT-DSAEK) and Descemet's membrane endothelial keratoplasty (DMEK). METHODS: A randomised, single-blinded, single-centre design was used. 72 patients with Fuchs' endothelial dystrophy and cataract were randomised to UT-DSAEK or DMEK combined with phacoemulsification and lens implantation. 27 patients with cataract were included in a control group and treated with phacoemulsification and lens implantation. The primary outcome was BCVA at 12 months. RESULTS: Compared with UT-DSAEK, DMEK resulted in better BCVA with mean differences of 6.1 early treatment diabetic retinopathy study (ETDRS) (p=0.001) after 3 months, 7.4 ETDRS (p<0.001) after 6 months and 5.7 ETDRS (p<0.001) after 12 months. The control group obtained significantly better BCVA with a mean difference of 5.2 ETDRS (p<0.001) compared with DMEK 12 months postoperatively. Compared with UT-DSAEK, contrast sensitivity was significantly better 3 months after DMEK with a mean difference of 0.10 LogCS (p=0.03). However, our study found no effect after 12 months (p=0.08). ECD was significantly lower after UT-DSAEK compared with DMEK with mean differences of 332 cells/mm(2) (p<0.01) after 3 months, 296 cells/mm(2) (p<0.01) after 6 months and 227 cells/mm(2) (p=0.03) after 12 months. CONCLUSIONS: Compared with UT-DSAEK, DMEK resulted in better BCVA 3, 6 and 12 months postoperatively. Twelve months postoperatively, DMEK had a higher ECD than UT-DSAEK; however, no difference in contrast sensitivity was found. TRIAL REGISTRATION NUMBER: NCT04417959.",2024,The British journal of ophthalmology,10.1136/bjo-2023-323304,C4_endothelium,1,Exclude,General ophthalmology/no engineering content,endothelium,,"Corrected exclude: routine clinical/surgical keratoplasty, DMEK/DSAEK/DALK, imaging, outcome, or complication paper without clear biomaterial/scaffold/tissue-engineering construct relevance."
PUBMED_0679,37296649,Corneal Edema in Inducible Slc4a11 Knockout Is Initiated by Mitochondrial Superoxide Induced Src Kinase Activation.,"PURPOSE: Inducible Slc4a11 KO leads to corneal edema by disruption of the pump and barrier functions of the corneal endothelium (CE). The loss of Slc4a11 NH(3)-activated mitochondrial uncoupling leads to mitochondrial membrane potential hyperpolarization-induced oxidative stress. The goal of this study was to investigate the link between oxidative stress and the failure of pump and barrier functions and to test different approaches to revert the process. METHODS: Mice which were homozygous for Slc4a11 Flox and Estrogen receptor -Cre Recombinase fusion protein alleles at 8 weeks of age were fed Tamoxifen (Tm)-enriched chow (0.4 g/Kg) for 2 weeks, and controls were fed normal chow. During the initial 14 days, Slc4a11 expression, corneal thickness (CT), stromal [lactate], Na(+)-K(+) ATPase activity, mitochondrial superoxide levels, expression of lactate transporters, and activity of key kinases were assessed. In addition, barrier function was assessed by fluorescein permeability, ZO-1 tight junction integrity, and cortical cytoskeleton F-actin morphology. RESULTS: Tm induced a rapid decay in Slc4a11 expression that was 84% complete at 7 days and 96% complete at 14 days of treatment. Superoxide levels increased significantly by day 7; CT and fluorescein permeability by day 14. Tight junction ZO-1 distribution and the cortical cytoskeleton were disrupted at day 14, concomitant with decreased expression of Cldn1, yet with increased tyrosine phosphorylation. Stromal lactate increased by 60%, Na(+)-K(+) ATPase activity decreased by 40%, and expression of lactate transporters MCT2 and MCT4 significantly decreased, but MCT1 was unchanged at 14 days. Src kinase was activated, but not Rock, PKCα, JNK, or P38Mapk. Mitochondrial antioxidant Visomitin (SkQ1, mitochondrial targeted antioxidant) and Src kinase inhibitor eCF506 significantly slowed the increase in CT, with concomitant decreased stromal lactate retention, improved barrier function, reduced Src activation and Cldn1 phosphorylation, and rescued MCT2 and MCT4 expression. CONCLUSIONS: Slc4a11 KO-induced CE oxidative stress triggered increased Src kinase activity that resulted in perturbation of the pump components and barrier function of the CE.",2023,Cells,10.3390/cells12111528,C4_endothelium,1,Uncertain,,stroma,Low,Corrected uncertain: insufficient title/abstract evidence for confident inclusion or exclusion.
PUBMED_0680,37335898,Birefringence analysis of collagen supraorganization in cat corneas with tropical keratopathy.,"OBJECTIVE: To evaluate the birefringent properties of the cornea and examine the supraorganizational aspects of collagen fibers in cats with tropical keratopathy. PROCEDURE: In this study, 10-micrometer-thick sections of corneal tissue from cats with tropical keratopathy were examined, both in the opaque and transparent areas of the anterior stroma. Control samples were obtained from healthy cat corneas. Polarized light microscopy was employed to evaluate the birefringent properties using two distinct methods. The first method involved measuring the optical retardation associated with corneal birefringence, while the second method assessed the alignment/waviness of the birefringent collagen fibers. Differences were significant when p < .05. RESULTS: Tropical keratopathy resulted in a significant rise (p < .05) in optical retardation in both opaque and transparent regions of the cat cornea. In the anterior stroma, both the opaque zones and transparent tissue exhibited a higher degree of collagen fiber packing than the control corneas. However, no significant differences (p > .05) in alignment were observed between the transparent tissue of the diseased cornea and the healthy corneas. CONCLUSION: Supraorganizational changes in collagen fiber packing are not restricted to lesion zones in cat corneas affected by tropical keratopathy. Such alterations also occur in the corneal tissue of the anterior stroma adjoining the lesions. Therefore, it is plausible that the transparent tissue of the anterior stroma in corneas affected by the disease may have functional abnormalities, despite its macroscopic healthy appearance. Additional investigations are required to clarify the implications of these potential defects and their conceivable contribution to tropical keratopathy.",2023,Veterinary ophthalmology,10.1111/vop.13124,B3_stroma,1,Uncertain,,stroma,Low,Corrected uncertain: insufficient title/abstract evidence for confident inclusion or exclusion.
PUBMED_0681,37376106,Phosphorylcholine and KR12-Containing Corneal Implants in HSV-1-Infected Rabbit Corneas.,"Severe HSV-1 infection can cause blindness due to tissue damage from severe inflammation. Due to the high risk of graft failure in HSV-1-infected individuals, cornea transplantation to restore vision is often contraindicated. We tested the capacity for cell-free biosynthetic implants made from recombinant human collagen type III and 2-methacryloyloxyethyl phosphorylcholine (RHCIII-MPC) to suppress inflammation and promote tissue regeneration in the damaged corneas. To block viral reactivation, we incorporated silica dioxide nanoparticles releasing KR12, the small bioactive core fragment of LL37, an innate cationic host defense peptide produced by corneal cells. KR12 is more reactive and smaller than LL37, so more KR12 molecules can be incorporated into nanoparticles for delivery. Unlike LL37, which was cytotoxic, KR12 was cell-friendly and showed little cytotoxicity at doses that blocked HSV-1 activity in vitro, instead enabling rapid wound closure in cultures of human epithelial cells. Composite implants released KR12 for up to 3 weeks in vitro. The implant was also tested in vivo on HSV-1-infected rabbit corneas where it was grafted by anterior lamellar keratoplasty. Adding KR12 to RHCIII-MPC did not reduce HSV-1 viral loads or the inflammation resulting in neovascularization. Nevertheless, the composite implants reduced viral spread sufficiently to allow stable corneal epithelium, stroma, and nerve regeneration over a 6-month observation period.",2023,Pharmaceutics,10.3390/pharmaceutics15061658,B3_stroma,1,Exclude,General ophthalmology/no engineering content,multiple_layers,,"Corrected exclude: routine clinical/surgical keratoplasty, DMEK/DSAEK/DALK, imaging, outcome, or complication paper without clear biomaterial/scaffold/tissue-engineering construct relevance."
PUBMED_0682,37386384,The new future perspective in corneal tissue utilisation - methods of preparation and preservation.,"PURPOSE: The goal of our study is to find an optimal approach to the preparation and preservation of corneal stromal tissue. We want to compare different methods of corneal stromal tissue creation and storage to optimize the efficacy of this process under the conditions of an eye bank. After we find the most suitable method to create a safe high quality product, we want to prove the possibility of using a single donor cornea for more than one patient. We would also like to verify the feasibility of making more corneal lenticules after the removal of a corneal endothelium for DMEK transplantation. METHODS: We provided morphological (histology, scanning electron microscope) and microbiological analysis in order to compare different methods of corneal lenticule and corneal stromal lamellae preparation and preservation. We also tested the surgical handling of the tissue to secure a safe manipulation of the tissue for clinical use. We compared two methods of corneal lenticule preparation: microkeratome dissection and femtosecond laser. As methods of preservation, we tested hypothermia, cryopreservation at -80 degrees Celsius in DMSO (dimethyl sulfoxide) and storage at room temperature with glycerol. Some intrastromal lenticules and lamellae in each group were previously irradiated with gamma radiation of 25 kGy (KiloGray). RESULTS: Corneal stromal lamellae prepared with a microkeratome have a smoother cut - side surface compared to lamellae prepared with a femtosecond laser. Femtosecond laser preparation caused more irregularities on the surface and we detected more conglomerates of the fibrils, while lamellae made with microkeratome had more sparse network. Using femtosecond laser, we were able to make more than five lenticules from a single donor cornea. Gamma irradiation led to damage of collagen fibrils in corneal stroma and a loss of their regular arrangement. Corneal tissue stored in glycerol showed collagen fibril aggregates and empty spaces between fibrils caused by dehydration. Cryopreserved tissue without previous gamma irradiation showed the most regular structure of the fibrils comparable to storage in hypothermia. CONCLUSION: Our results suggest that formation of a corneal lenticule lamellae by microkeratome results in smoother corneal lenticules, while being much cheaper than formation by femtosecond laser. Gamma irradiation of 25 kGy caused damage of the collagen fibres as well as their network arrangement, which correlated with loss of transparency and stiffer structure. These changes impair possible surgical utilisation of gamma irradiated corneas. Storage in glycerol at room temperature and cryopreservation had similar outcomes and we believe that both methods are appropriate and safe for further clinical use .",2023,BMC ophthalmology,10.1186/s12886-023-03048-3,B3_stroma,1,Exclude,General ophthalmology/no engineering content,stroma,,"Corrected exclude: routine clinical/surgical keratoplasty, DMEK/DSAEK/DALK, imaging, outcome, or complication paper without clear biomaterial/scaffold/tissue-engineering construct relevance."
PUBMED_0683,37393064,Transforming growth factor beta receptor 2 (Tgfbr2) deficiency in keratocytes results in corneal ectasia.,"PURPOSE: We hypothesized that Transforming growth factor beta receptor 2 (Tgfbr2) deletion in keratocyte (Tgfbr2(kera-cko)), the corneal stroma cell, can result in corneal thinning and generate a potential model for Cornea Ectasia (CE). METHODS: Corneal thickness of Tgfbr2(kera-cko) and Tgfbr2(Ctrl) was examined with Optical Coherence Tomography (OCT) at post-natal (P) days 42 and 70, respectively. Histological H&E staining, transmission electron micrograph (TEM), and immunofluorescence staining (IFS) were harnessed to examine corneal cell morphology, proliferation, differentiation, and collagen fibrils. RESULTS: Slit-Lamp revealed that corneas were transparent in both Tgfbr2(kera-cko) and Tgfbr2(Ctrl), however, Tgfbr2(kera-cko) cornea was 33.5% and 42.9% thinner as compared with those of Tgfbr2(Ctrl) at P42 and P70, respectively. H&E and semithin section staining with toluidine blue-O confirmed that Tgfbr2(kera-cko) cornea has a thinner stroma. In contrast, the epithelium in Tgfbr2(kera-cko) was substantially thicker. The cell proliferation marker Ki67 expression level increased ∼9% in Tgfbr2(kera-cko) corneal epithelium as compared with that in Tgfbr2(Ctrl), however, the Krt14 and Krt12 expression pattern was not obviously changed in Tgfbr2(kera-cko) corneal epithelium. It was noticed that Col1a1 expression was substantially reduced in Tgfbr2(kera-cko) as compared with that in Tgfbr2(Ctrl). TEM showed that keratocytes were unhealthy and stromal collagen fibril density was significantly reduced in Tgfbr2(kera-cko) as compared with that in Tgfbr2(Ctrl) cornea. Moreover, mechanical eye-rubbing on Tgfbr2(kera-cko) resulted in corneal hydrops and edema. CONCLUSION: Tgfbr2 in keratocytes is indispensable for the corneal stroma at postnatal homeostasis. The cornea phenotype manifested in these Tgfbr2(kera-cko) mice resembles corneal ectasia disease in humans.",2023,The ocular surface,10.1016/j.jtos.2023.06.014,B3_stroma,1,Uncertain,,multiple_layers,Low,"Corrected uncertain: may support biological, optical, animal-model, or mechanical benchmarking background, but not clearly a tissue-engineered material or construct."
PUBMED_0684,37401723,Introducing Dynamicity: Engineering Stress Relaxation Into Hydrogels Via Thiol-Ene Modified Alginate for Mechanobiological in vitro Modeling of the Cornea.,"Developing biomaterials for corneal repair and regeneration is crucial for maintaining clear vision. The cornea, a specialized tissue, relies on corneal keratocytes, that respond to their mechanical environment. Altering stiffness affects keratocyte behavior, but static stiffness alone cannot capture the dynamic properties of in vivo tissue. This study proposes that the cornea exhibits time-dependent mechanical properties, similar to other tissues, and aims to replicate these properties in potential therapeutic matrices. First, the cornea's stress relaxation properties are investigated using nanoindentation, revealing 15% relaxation within 10 seconds. Hydrogel dynamicity is then modulated using a specially formulated alginate-PEG and alginate-norbornene mixture. The tuning of the hydrogel's dynamicity is achieved through a photoinitiated norbornene-norbornene dimerization reaction, resulting in relaxation times ranging from 30 seconds to 10 minutes. Human primary corneal keratocytes are cultured on these hydrogels, demonstrating reduced αSMA (alpha smooth muscle actin) expression and increased filopodia formation on slower relaxing hydrogels, resembling their native phenotype. This in vitro model can enable the optimization of stress relaxation for various cell types, including corneal keratocytes, to control tissue formation. Combining stress relaxation optimization with stiffness assessment provides a more accurate tool for studying cell behavior and reduces mechanical mismatch with native tissues in implanted constructs.",2024,Macromolecular bioscience,10.1002/mabi.202300109,B3_stroma;D3_full_thickness_multilayer,2,Include,,stroma,High,"Corrected include: title/abstract indicates corneal tissue engineering, biomaterial/scaffold, engineered construct, decellularized matrix, cell sheet, stem-cell construct, or regeneration/reconstruction relevance."
PUBMED_0685,37435912,"An Injectable, Shape-Retaining Collagen Hydrogel Cross-linked Using Thiol-Maleimide Click Chemistry for Sealing Corneal Perforations.","Injectable hydrogels show great promise in developing novel regenerative medicine solutions and present advantages for minimally invasive applications. Hydrogels based on extracellular matrix components, such as collagen, have the benefits of cell adhesiveness, biocompatibility, and degradability by enzymes. However, to date, reported collagen hydrogels possess severe shortcomings, such as nonbiocompatible cross-linking chemistry, significant swelling, limited range of mechanical properties, or gelation kinetics unsuitable for in vivo injection. To solve these issues, we report the design and characterization of an injectable collagen hydrogel based on covalently modified acetyl thiol collagen cross-linked using thiol-maleimide click chemistry. The hydrogel is injectable for up to 72 h after preparation, shows no noticeable swelling, is transparent, can be molded in situ, and retains its shape in solution for at least one year. Notably, the hydrogel mechanical properties can be fine-tuned by simply adjusting the reactant stoichiometries, which to date was only reported for synthetic polymer hydrogels. The biocompatibility of the hydrogel is demonstrated in vitro using human corneal epithelial cells, which maintain viability and proliferation on the hydrogels for at least seven days. Furthermore, the developed hydrogel showed an adhesion strength on soft tissues similar to fibrin glue. Additionally, the developed hydrogel can be used as a sealant for repairing corneal perforations and can potentially alleviate the off-label use of cyanoacrylate tissue adhesive for repairing corneal perforations. Taken together, these characteristics show the potential of the thiol collagen hydrogel for future use as a prefabricated implant, injectable filler, or as sealant for corneal repair and regeneration.",2023,ACS applied materials & interfaces,10.1021/acsami.3c03963,A3_epithelium_limbus,1,Include,,epithelium_limbus,Medium,"Corrected include: title/abstract indicates corneal tissue engineering, biomaterial/scaffold, engineered construct, decellularized matrix, cell sheet, stem-cell construct, or regeneration/reconstruction relevance."
