screening_id,pmid,title,abstract,year,journal,doi,sources,source_count,decision,exclusion_reason,corneal_layer,priority_level,screening_notes
PUBMED_0419,33918484,Human Cadaveric Donor Cornea Derived Extra Cellular Matrix Microparticles for Minimally Invasive Healing/Regeneration of Corneal Wounds.,"Biological materials derived from extracellular matrix (ECM) proteins have garnered interest as their composition is very similar to that of native tissue. Herein, we report the use of human cornea derived decellularized ECM (dECM) microparticles dispersed in human fibrin sealant as an accessible therapeutic alternative for corneal anterior stromal reconstruction. dECM microparticles had good particle size distribution (≤10 µm) and retained the majority of corneal ECM components found in native tissue. Fibrin-dECM hydrogels exhibited compressive modulus of 70.83 ± 9.17 kPa matching that of native tissue, maximum burst pressure of 34.3 ± 3.7 kPa, and demonstrated a short crosslinking time of ~17 min. The fibrin-dECM hydrogels were found to be biodegradable, cytocompatible, non-mutagenic, non-sensitive, non-irritant, and supported the growth and maintained the phenotype of encapsulated human corneal stem cells (hCSCs) in vitro. In a rabbit model of anterior lamellar keratectomy, fibrin-dECM bio-adhesives promoted corneal re-epithelialization within 14 days, induced stromal tissue repair, and displayed integration with corneal tissues in vivo. Overall, our results suggest that the incorporation of cornea tissue-derived ECM microparticles in fibrin hydrogels is non-toxic, safe, and shows tremendous promise as a minimally invasive therapeutic approach for the treatment of superficial corneal epithelial wounds and anterior stromal injuries.",2021,Biomolecules,10.3390/biom11040532,A3_epithelium_limbus;B3_stroma,2,Include,,multiple_layers,High,"Corrected include: title/abstract indicates corneal tissue engineering, biomaterial/scaffold, engineered construct, decellularized matrix, cell sheet, stem-cell construct, or regeneration/reconstruction relevance."
PUBMED_0420,33937594,Tuning gelatin-based hydrogel towards bioadhesive ocular tissue engineering applications.,"Gelatin based adhesives have been used in the last decades in different biomedical applications due to the excellent biocompatibility, easy processability, transparency, non-toxicity, and reasonable mechanical properties to mimic the extracellular matrix (ECM). Gelatin adhesives can be easily tuned to gain different viscoelastic and mechanical properties that facilitate its ocular application. We herein grafted glycidyl methacrylate on the gelatin backbone with a simple chemical modification of the precursor, utilizing epoxide ring-opening reactions and visible light-crosslinking. This chemical modification allows the obtaining of an elastic protein-based hydrogel (GELGYM) with excellent biomimetic properties, approaching those of the native tissue. GELGYM can be modulated to be stretched up to 4 times its initial length and withstand high tensile stresses up to 1.95 MPa with compressive strains as high as 80% compared to Gelatin-methacryloyl (GeIMA), the most studied derivative of gelatin used as a bioadhesive. GELGYM is also highly biocompatible and supports cellular adhesion, proliferation, and migration in both 2 and 3-dimensional cell-cultures. These characteristics along with its super adhesion to biological tissues such as cornea, aorta, heart, muscle, kidney, liver, and spleen suggest widespread applications of this hydrogel in many biomedical areas such as transplantation, tissue adhesive, wound dressing, bioprinting, and drug and cell delivery.",2021,Bioactive materials,10.1016/j.bioactmat.2021.03.042,D3_full_thickness_multilayer,1,Include,,full_thickness_multilayer,Medium,"Corrected include: title/abstract indicates corneal tissue engineering, biomaterial/scaffold, engineered construct, decellularized matrix, cell sheet, stem-cell construct, or regeneration/reconstruction relevance."
PUBMED_0421,33939123,Potential of a novel scaffold composed of human platelet lysate and fibrin for human corneal endothelial cells.,"Cell-based therapies have been emerged to find innovative solutions for corneal endothelial dysfunction. The aim of this study is to investigate the suitability of a blended scaffold containing human platelet lysate (HPL) and fibrin not only for cultivating human corneal endothelial cells (HCECs) but also for serving as a scaffold for the respected cells. We isolated HCECs from human donors and encapsulated the cells with three concentrations of HPL/Fibrin scaffold, namely HPL/Fibrin 1, HPL/Fibrin 2 and HPL/Fibrin 3, by adding 28.9, 57.8 and 86.7 mg/dl of fibrinogen to HPL to obtain a final percentage of 10, 20 and 30 % of fibrinogen, respectively. SEM imaging and swelling test were done to characterize the scaffolds. Cell viability assay and cell counting were performed on the cells. HCECs were characterized by morphology and immunocytochemistry. SEM imaging on freeze-dried scaffolds showed higher porosity of HPL/Fibrin 1 and HPL/Fibrin 2 than HPL/Fibrin 3, but larger pores were observed only in HPL/Fibrin 1. Cellular attachment and morphology on HPL/Fibrin 1 were appropriate by SEM imaging. A higher swelling rate was observed in HPL/Fibrin 1. After 3 and 5 days, higher numbers of cells were observed specifically in HPL/Fibrin 1. A higher expression of Na+/K+-ATPase, ZO-1 and vimentin proteins was detected in the HPL/Fibrin 1-cultured HCECs as compared with control (no scaffold). HPL/Fibrin can be used as a suitable scaffold for HCECs while preserving the cells viability. Further investigations are necessitated to approve the beneficial effects of the suggested scaffold for delivering and transplantation of cultivated HCECs into the anterior chamber of the eye.",2022,Cell and tissue banking,10.1007/s10561-021-09931-x,C4_endothelium,1,Include,,endothelium,Medium,"Corrected include: title/abstract indicates corneal tissue engineering, biomaterial/scaffold, engineered construct, decellularized matrix, cell sheet, stem-cell construct, or regeneration/reconstruction relevance."
PUBMED_0422,33955160,Characterization of Tunable Poly-ε-Lysine-Based Hydrogels for Corneal Tissue Engineering.,"A family of poly-ε-lysine hydrogels can be synthesized by crosslinking with bis-carboxylic acids using carbodiimide chemistry. In addition to creating hydrogels using a simple cast method, a fragmented method is used to introduce increased porosity within the hydrogel structure. Both methods have created tunable characteristics ranging in their mechanical properties, transparency, and water content, which is of interest to corneal tissue engineering and can be tailored to specific cellular needs and applications. With a worldwide shortage of cornea donor tissue available for transplant and limitations including rejection and potential infection, a synthetic material that can be used as a graft, or a partial thickness corneal replacement, would be an advantageous treatment method. These hydrogels can be tuned to have similar mechanical and transparency properties to the human cornea. They also support the attachment and growth of corneal epithelial cells and the integration of corneal stromal cells.",2021,Macromolecular bioscience,10.1002/mabi.202100036,A3_epithelium_limbus;B3_stroma,2,Include,,multiple_layers,High,"Corrected include: title/abstract indicates corneal tissue engineering, biomaterial/scaffold, engineered construct, decellularized matrix, cell sheet, stem-cell construct, or regeneration/reconstruction relevance."
PUBMED_0423,33974922,Robust and double-layer micro-patterned bioadhesive based on silk nanofibril/GelMA-alginate for stroma tissue engineering.,"We develop a robust micro-patterned double-layer film that can adhere firmly to the tissue and provide a sustained release of ascorbic acid (AA) for corneal regeneration. This double-layer film consists of a AA reservoir sodium alginate (SA) adhesive and an anisotropic layer made of micro-patterned silk nanofibrils (SNF) incorporated gelatin methacrylate (GelMA) (S/G). The S/G layer facilitates the adhesion and orientation of corneal stroma cells, depending on the pattern sizes (50 μm (P1) and 100 (P2) μm). Results reveal that more than 90% and 80% of the cells are located at angles close to the vertical axis (0-20°) in the sample with the smaller and larger pattern size, respectively. The mechanical robustness and 90% light transmission of this hybrid film originate from the micro-patterned S/G layer. However, the micro-pattern size does not show a significant role in the mechanical properties of hybrid films (tensile strength of S/G-SA, S/G-SA(P(1)), and S/G-SA(P(2)) is 3.4 ± 0.1 MPa, 3.6 ± 0.6 MPa and 3.3 ± 0.2 MPa, respectively). In addition, the strong adhesion to the tissue of this double-layer film is related to the alginate layer. AA can release in a controlled manner, which can significantly promote corneal stroma cells' attachment, alignment, and proliferation compared to the control (AA-free micro-patterned film). Our results reveal that this innovative multifunctional S/G-SA + AA film can be a proper candidate for use in stroma tissue engineering of the human cornea.",2021,International journal of biological macromolecules,10.1016/j.ijbiomac.2021.05.048,B3_stroma,1,Include,,stroma,Medium,"Corrected include: title/abstract indicates corneal tissue engineering, biomaterial/scaffold, engineered construct, decellularized matrix, cell sheet, stem-cell construct, or regeneration/reconstruction relevance."
PUBMED_0424,34007152,"The Effect of Sodium Iodide on Stromal Loading, Distribution and Degradation of Riboflavin in a Rabbit Model of Transepithelial Corneal Crosslinking.","PURPOSE: To evaluate effects of sodium iodide (NaI) on riboflavin concentration in corneal stroma before and during ultraviolet A (UVA) light exposure using a novel transepithelial corneal collagen crosslinking (CXL) procedure (EpiSmart CXL system, CXL Ophthalmics, Encinitas CA). METHODS: Riboflavin solutions with NaI (Ribostat, CXL Ophthalmics, Encinitas CA) and without NaI were used for CXL in rabbits using EpiSmart. A pilot study determined sufficient riboflavin loading time. Four rabbits were dosed and monitored. Riboflavin fluorescence intensity was assessed from masked slit-lamp photos. A 12 min loading time was selected. Sixteen additional rabbits received the two formulae in contralateral eyes for CXL. Riboflavin uptake was assessed at 0, 10, 15, 20, 25, and 30 min of UVA exposure using a scale for riboflavin fluorescence previously validated against stromal concentration. Post sacrifice, corneal stromal samples were analyzed for concentrations of riboflavin and riboflavin 5'-phosphate. RESULTS: Eyes dosed with NaI riboflavin had higher riboflavin grades compared to eyes dosed with the NaI-free riboflavin formulation immediately after riboflavin loading and persisting throughout UVA exposure, with significantly higher (P < 0.01 to < 0.05) riboflavin grades from 15 through 25 min of UVA exposure. Riboflavin grades decreased more slowly in eyes dosed with NaI riboflavin through 25 minutes of UVA exposure. Minor conjunctival irritation was noted with or without NaI. CONCLUSION: The addition of NaI to riboflavin solution is associated with increased riboflavin concentration in corneal stroma throughout a clinically relevant time course of UVA exposure. This effect may be a combination of enhanced epithelial penetration and reduced riboflavin photodegradation and should enhance intrastromal crosslinking.",2021,"Clinical ophthalmology (Auckland, N.Z.)",10.2147/OPTH.S300886,B3_stroma,1,Uncertain,,multiple_layers,Low,Corrected uncertain: insufficient title/abstract evidence for confident inclusion or exclusion.
PUBMED_0425,34021240,Collagen analogs with phosphorylcholine are inflammation-suppressing scaffolds for corneal regeneration from alkali burns in mini-pigs.,"The long-term survival of biomaterial implants is often hampered by surgery-induced inflammation that can lead to graft failure. Considering that most corneas receiving grafts are either pathological or inflamed before implantation, the risk of rejection is heightened. Here, we show that bioengineered, fully synthetic, and robust corneal implants can be manufactured from a collagen analog (collagen-like peptide-polyethylene glycol hybrid, CLP-PEG) and inflammation-suppressing polymeric 2-methacryloyloxyethyl phosphorylcholine (MPC) when stabilized with the triazine-based crosslinker 4-(4,6-Dimethoxy-1,3,5-triazin-2-yl)-4-methylmorpholinium chloride. The resulting CLP-PEG-MPC implants led to reduced corneal swelling, haze, and neovascularization in comparison to CLP-PEG only implants when grafted into a mini-pig cornea alkali burn model of inflammation over 12 months. Implants incorporating MPC allowed for faster nerve regeneration and recovery of corneal sensation. CLP-PEG-MPC implants appear to be at a more advanced stage of regeneration than the CLP-PEG only implants, as evidenced by the presence of higher amounts of cornea-specific type V collagen, and a corresponding decrease in the presence of extracellular vesicles and exosomes in the corneal stroma, in keeping with the amounts present in healthy, unoperated corneas.",2021,Communications biology,10.1038/s42003-021-02108-y,B3_stroma,1,Include,,stroma,Medium,"Corrected include: title/abstract indicates corneal tissue engineering, biomaterial/scaffold, engineered construct, decellularized matrix, cell sheet, stem-cell construct, or regeneration/reconstruction relevance."
PUBMED_0426,34033392,Mucous Membrane Graft.,"It is important to understand the anatomy of the conjunctiva when considering the reconstruction and replacement of the conjunctiva. The human conjunctiva is an epithelial layer that is a non-keratinized stratified squamous and stratified columnar epithelium. The conjunctiva has goblet cells. The conjunctiva is a complex structure that contains lymphatic channels, blood vessels, fibrous tissue, melanocytes, T- and B-cell lymphocytes, accessory lacrimal glands, and Langerhans cells. Glands of Krause are found within the deep fibrous layer of the conjunctiva and the goblet cells, which are greatest in the fornices, secrete mucin. The conjunctiva contributes to the protection of the eye with the production of mucus and tears. It provides mechanical protection to the eye and assists in the free movement of the globe and the eyelids. The conjunctiva lines the tarsus (or palpebral conjunctiva), where it lines the eyelid margin of the tarsus and the Tenon's capsule. The flexibility of the forniceal conjunctiva is important in the free movement of the globe and the eyelids. Loss or scarring of the conjunctiva from injury or disease can result in eyelid malposition, restriction of ocular movement with double vision, and dryness. When replacing the injured conjunctiva, materials such as amniotic membrane, hard palate grafts, nasal septal mucosa, autogenous conjunctiva, and tarsus with conjunctiva have been used. Ideally, it is wise to replace like for like. Unfortunately, except for small defects, autogenous conjunctiva is limited by availability. Oral mucosal grafts are used in two forms: 1. Oral mucous membrane grafting (MMG). 2. Minor salivary gland grafting (MSGG) for the treatment of severe dryness. Oral mucosa has multiple advantages: It has similar biological properties to the conjunctiva. The donor site is easily accessible and universally available. Obtaining donor tissue is technically easy. Obtaining tissue is cheap. Repeat harvesting is possible. Complications are few. It is an autograft avoiding the risks of allogeneic grafts. In 1912, Denig first described the use of mucous membrane for lime burns; later, mucous membrane grafts were used by Weeks for the correction of trichiasis and symblepharon. The mucous membrane acts as a scaffold for the proliferation of growing epithelial cells. The membrane does not contain the goblet cells which are present in the conjunctiva. Hence it does not help in treating dry eyes unless transplanted with minor salivary glands. Moreover, in patients with concurrent limbal stem cell deficiency of more than 3-4 clock hours, a limbal stem cell transplant procedure should be performed in the same sitting. The oral mucosal membrane is rich in elastin, making it resistant to shearing and compression, and being highly vascular, and the graft can be easily taken up. It is histo-compatible and has minimal contraction in the transplanted site. Indications for the use of mucous membrane grafts in Ophthalmology include the following: After removal of pterygia. Repair of contracted anophthalmic sockets. Globe surface and fornix reconstruction after tumor resection. Deformities of the eyelids (cicatricial entropion, keratinization of the eyelid margin after chemical burns, or Stevens-Johnson syndrome). Repair of erosions over glaucoma drainage devices. Repair over scleral buckle exposure. Support of keratoprosthesis associated with corneal melt. Formation of the lining during conjunctivodacryocystorhinostomy or dacryocystorhinostomy.",2026,,,A3_epithelium_limbus,1,Include,,epithelium_limbus,Medium,"Corrected include: title/abstract indicates corneal tissue engineering, biomaterial/scaffold, engineered construct, decellularized matrix, cell sheet, stem-cell construct, or regeneration/reconstruction relevance."
PUBMED_0427,34033824,Effect of Six-Month Postoperative Endothelial Cell Density on Graft Survival after Descemet Membrane Endothelial Keratoplasty.,"PURPOSE: To analyze if 6-month endothelial cell density (ECD) affects long-term ECD outcome and graft survival 5 years after Descemet membrane endothelial keratoplasty (DMEK) in eyes with Fuchs endothelial corneal dystrophy (FECD). DESIGN: Retrospective cohort study. PARTICIPANTS: A total of 585 DMEK eyes were included. The study group was divided into 4 groups based on 6-month ECD quartiles: group 1 (n = 146) with 313 to 1245 cells/mm(2), group 2 (n = 148) with 1246 to 1610 cells/mm(2), group 3 (n = 145) with 1611 to 1938 cells/mm(2), and group 4 (n = 146) with 1939 to 2760 cells/mm(2). Group 1 was further split into subgroups 1a (n = 36) with 6-month ECD of ≤828 cells/mm(2), 1b (n = 37) with 829 to 1023 cells/mm(2), 1c (n = 37) with 1024 to 1140 cells/mm(2), and 1d (n = 36) 1141 to 1245 cells/mm(2). METHODS: Descemet membrane endothelial keratoplasty. MAIN OUTCOME MEASURES: Long-term ECD, graft survival, and postoperative complication rates. RESULTS: For group 1, 6-month ECD decreased from 951 (±233) cells/mm(2) (n = 146) to 735 (±216) cells/mm(2) (n = 99) at 5 years postoperatively. Group 1 graft survival probability was 0.95 (95% confidence interval [CI], 0.91-0.99] at 5 years postoperatively, which was lower than for groups 2 to 4 (P = 0.001). Five-year graft survival in subgroup 1a was 0.79 (95% CI, 0.67-0.94), which was lower than in subgroups 1b to 1d (P = 0.001). Preoperative ECD did not influence graft survival (P = 0.400), and higher 6-month ECD values were associated with lower graft failure rates (hazard ratio, 0.994; 95% CI, 0.99-1.00; P = 0.001). CONCLUSIONS: Six-month ECD is associated with DMEK graft survival. High early cell loss after DMEK negatively affects long-term ECD outcome and graft survival. Grafts in the lowest 6-month ECD subgroup (≤828 cells/mm(2)) are at higher risk of failure within 5 years after DMEK. To ensure sufficiently high 6-month ECD, preoperative graft quality assessment should be optimized, and cellular stress induced to the graft should be minimized. Additionally, developing therapeutic options for the treatment of low postoperative ECD could further improve DMEK graft longevity.",2021,Ophthalmology,10.1016/j.ophtha.2021.05.022,C4_endothelium,1,Exclude,General ophthalmology/no engineering content,endothelium,,"Corrected exclude: routine clinical/surgical keratoplasty, DMEK/DSAEK/DALK, imaging, outcome, or complication paper without clear biomaterial/scaffold/tissue-engineering construct relevance."
PUBMED_0428,34036475,Corneal transplant survival rate in glaucoma patients with multiple previous antiglaucoma surgeries.,"BACKGROUND: Glaucoma can cause corneal decompensation and accelerate the failure of the graft. Previous antiglaucoma operations are one of the most important risk factors for endothelial failure. METHODS: In this retrospective study, 40 eyes of 40 glaucoma patients with advanced corneal decompensation after glaucoma surgery were treated with keratoplasty and outcomes were assessed for 24 months. RESULTS: 16, 9 and 15 eyes underwent Descemet Membrane Endothelial Keratoplasty (DMEK), Descemet's Stripping Automated Endothelial Keratoplasty (DSAEK) and penetrating keratoplasty (pKPL), respectively. Visual acuity improved at least 2 lines in 24 of 40 eyes after the three types of keratoplasty. All 40 eyes remained pain free for the follow-up period. The mean intraocular pressure (IOP) difference was not significantly different (p > 0.05) from the preoperative values 12 and 24 months after keratoplasty. The endothelial cell density of the donor cornea decreased from 2485.6 ± 165.18 to 1291.4 ± 467.1 and 1180.4 ± 397.2/mm(2) (p < 0.001) after 12 and 24 months, respectively. Nine eyes (22.5%) had therapy-resistant corneal decompensation in the context of a transplant failure and were treated with a re-keratoplasty (2 re-pKPLs, 3 re-DSAEKs and 3 re-DMEKs). CONCLUSIONS: Eyes with previous glaucoma surgery show satisfying results after keratoplasty, mainly DMEK and pKPL.",2021,International ophthalmology,10.1007/s10792-021-01902-1,C4_endothelium,1,Exclude,General ophthalmology/no engineering content,endothelium,,"Corrected exclude: routine clinical/surgical keratoplasty, DMEK/DSAEK/DALK, imaging, outcome, or complication paper without clear biomaterial/scaffold/tissue-engineering construct relevance."
PUBMED_0429,34049717,Refractive accuracy and visual outcomes after combined descemet membrane endothelial keratoplasty and cataract surgery: A French multicentric study.,"PURPOSE: Descemet membrane endothelial keratoplasty (DMEK) combined with cataract extraction and intraocular lens insertion (new triple procedure) limits postoperative refractive errors. The objective of this study was to assess refractive accuracy after DMEK combined with cataract extraction and intraocular lens implantation. SETTING: Four university hospitals (Rouen, Paris, Reims, Grenoble). DESIGN: This retrospective multicenter study included patients with symptomatic corneal endothelial decompensation and cataract. METHODS: The primary outcome was the difference between the target spherical equivalent and postoperative refraction at months 2 and 6. Secondary outcomes were visual acuity, keratometry, pachymetry and endothelial cell density. RESULTS: A total of 130 eyes of 111 patients (mean age 66.2 years) were included (94% with Fuchs' endothelial dystrophy). For a mean refractive target set at -0.50 (±0.57) D, the mean (95% CI) refractive error was hyperopia of +0.49 (0.314; 0.664) D at 2 months and +0.46 (0.299; 0.619) D at 6 months. Best corrected distance visual acuity was improved in all patients: from 0.49 (±0.3) logMAR to 0.14 (±0.14) logMAR at 2 months and 0.05 (±0.1) logMAR at 6 months. Mean corneal thickness decreased from 621.6 (±37.6) μm to 515.2 (±42.6) μm at 2 months and 539.0 (±39.0) μm at 6 months. CONCLUSIONS: Good refractive accuracy was obtained after the new triple procedure with DMEK. Hyperopic shift is common after triple procedures, and its persistence should be evaluated in future studies in order to anticipate a change in its value to optimize intraocular lens power calculation.",2021,Journal francais d'ophtalmologie,10.1016/j.jfo.2020.06.052,C4_endothelium,1,Exclude,General ophthalmology/no engineering content,endothelium,,"Corrected exclude: routine clinical/surgical keratoplasty, DMEK/DSAEK/DALK, imaging, outcome, or complication paper without clear biomaterial/scaffold/tissue-engineering construct relevance."
