screening_id,pmid,title,abstract,year,journal,doi,sources,source_count,decision,exclusion_reason,corneal_layer,priority_level,screening_notes
PUBMED_0265,32301812,The Influence of Speed During Stripping in Descemet Membrane Endothelial Keratoplasty Tissue Preparation.,"PURPOSE: To evaluate whether the speed of stripping a Descemet membrane endothelial keratoplasty graft influences the graft scroll width. METHODS: Human corneas suitable for research were selected for the study. Pairs of corneas were randomly divided into 2 groups: 1 cornea was stripped with a slow speed (group 1) and the contralateral with a fast speed (group 2). Slow speed was defined as the total time greater than 150 seconds or speed <0.057 mm/s. Fast peeling was defined as less than 75 seconds or speed >0.11 mm/s. The grafts acquired were evaluated by microscopy for the graft scroll width and endothelial cell density change pre- and post-preparation. RESULTS: Twenty corneas of 10 donors were included in the analysis. The mean donor age was 68.6 ± 7.58 years. The mean total time of the tissue preparation in group 1 was 282.7 ± 28 seconds and in group 2 was 126 ± 50 seconds (P-value = 0.00000047). The mean speed of stripping in group 1 was 0.045 ± 0.006 mm/s and in group 2 was 0.266 ± 0.093 mm/s (P-value = 0.000027). The graft width in group 1 was 6.4 ± 0.92 mm and in group 2 was 2.87 ± 0.32 mm (P-value = 0.00000014). The mean endothelial cell loss in group 1 was 389 ± 149 cells/mm and in group 2 was 186 ± 63.44 cells/mm (P-value = 0.00134). CONCLUSION: We found a correlation between the speed of stripping, scroll width, and endothelial cell loss. Slow-peeled Descemet membrane endothelial keratoplasty grafts result in a wider scroll width but were associated with a greater reduction in endothelial cell density.",2020,Cornea,10.1097/ICO.0000000000002338,C4_endothelium,1,,,,,
PUBMED_0266,32301814,Performance of New Hypothermic Corneal Storage Media With an Antimycotic Tablet in Comparison to Traditional Hypothermic Media During Simulated Eye Bank Processing.,"PURPOSE: To compare the performance of Kerasave (AL.CHI.MI.A. S.R.L., Ponte San Nicolò, Italy) containing 2.5 μg/mL of amphotericin B and Optisol-GS (Bausch & Lomb, Bridgewater, NJ) cold corneal storage media on donor corneas during routine eye bank procedures. METHODS: Forty-four paired donor corneas were preserved after swab sample collection and povidone-iodine decontamination. Right and left corneas were immersed in Kerasave and Optisol-GS, respectively, and stored at 4°C before the initial evaluation. Paired corneas were assigned to processing subgroups for penetrating keratoplasty (n = 20), Descemet stripping automated endothelial keratoplasty (n = 14), or Descemet membrane endothelial keratoplasty (n = 10). Endothelial cell density, central corneal thickness, slit-lamp examination, and endothelial cell damage were assessed at different intervals. Sterility testing was performed on media samples. RESULTS: At the initial evaluation, after 25.6 ± 3.2 hours of storage, the mean central corneal thickness of all corneas in Kerasave (n = 22) was greater than those in Optisol-GS (n = 22) (571 ± 12 μm vs. 526 ± 10 μm, respectively; P = 0.006). All other metrics were comparable between Kerasave and Optisol-GS in processing subgroups at all time intervals. Corneal swabs were positive in 90% of corneas before decontamination with povidone-iodine. At the initial evaluation, fungal contamination was detected in 24% and 19% of Kerasave and Optisol-GS, respectively. At the final evaluation, no fungi was detected in Kerasave and 1 Optisol-GS sample was positive (P = 0.999). CONCLUSIONS: Metrics of corneas stored in Kerasave and Optisol-GS were comparable. Kerasave might be considered an antifungal-possessing alternative to Optisol-GS.",2020,Cornea,10.1097/ICO.0000000000002333,C4_endothelium,1,,,,,
PUBMED_0267,32317647,Influence of micropatterned substrates on keratocyte phenotype.,"Substrate topographic patterning is a powerful tool that can be used to manipulate cell shape and orientation. To gain a better understanding of the relationship between surface topography and keratocyte behavior, surface patterns consisting of linear aligned or orthogonally aligned microchannels were used. Photolithography and polymer molding techniques were used to fabricate micropatterns on the surface of polydimethylsiloxane (PDMS). Cells on linear aligned substrates were elongated and aligned in the channel direction, while cells on orthogonal substrates had a more spread morphology. Both linear and orthogonal topographies induced chromatin condensation and resulted in higher expressions of keratocyte specific genes and sulfated glycosaminoglycans (sGAG), compared with non-patterned substrates. However, despite differences in cell morphology and focal adhesions, many genes associated with a native keratocyte phenotype, such as keratocan and ALDH3A1, remain unchanged on the different patterned substrates. This information could be used to optimize substrates for keratocyte culture and to develop scaffolds for corneal regeneration.",2020,Scientific reports,10.1038/s41598-020-62640-5,B3_stroma,1,,,,,
PUBMED_0268,32334721,Corneal extracellular matrix decellularization.,"Decellularized corneal scaffolds have the potential to be used as alternatives to donor corneas during keratoplasty. Here a decellularization technique is described that involves the use of sodium dodecyl sulfate, Triton-X100, DNAse and RNAse to remove cells and cellular constituents. We have previously found that this combination of chemicals and enzymes to be effective at removing cells while retaining extracellular matrix proteins. In addition, different methods for assessing if the decellularization process has been successful are discussed. These include techniques to identify and quantify the presence of cells, DNA and extracellular matrix components as well as methods to examine the collagen fibril organization and scaffold transparency.",2020,Methods in cell biology,10.1016/bs.mcb.2019.10.013,B3_stroma,1,,,,,
PUBMED_0269,32343943,A core-skirt designed artificial cornea with orthogonal microfiber grid scaffold.,"Artificial cornea is an effective treatment option for cases of severe corneal loss. In this study, we prepared a core-skirt designed artificial cornea with orthogonal microfiber grid scaffold. We fabricated PCL orthogonal microfiber grid scaffolds by a direct writing technique, and then combined them with compressed collagen (CC) to obtain a sandwich-like CC/P (where P is used to represent the PCL microfiber grid scaffold). PHEMA hydrogel and the CC/P served as the core and the skirt, respectively, with the P also serving as an intermediate between the two. The physical properties of the artificial cornea, including the morphology, the mechanical properties and the light transmittance, were evaluated. SEM images showed an effective connection and a lack of phase separation at the interface between the core and the skirt, and the skirt formed a highly porous scaffold that promoted tissue biointegration. In addition, we used the skirt structure to construct a corneal tissue model containing two cells types: corneal stromal stem cells (CSSCs) and mouse hippocampal neurons. The results showed that the cells could grow and differentiate well, and the orthogonal microfiber grid scaffold fibers were good guides for the structural growth of CSSCs and neuronal axons.",2020,Experimental eye research,10.1016/j.exer.2020.108037,B3_stroma;D3_full_thickness_multilayer,2,,,,,
PUBMED_0270,32363924,In Vitro Evaluation and Transplantation of Human Corneal Endothelial Cells Cultured on Biocompatible Carriers.,"Corneal transplantation is currently the only effective treatment option for dysfunctional corneal endothelial cells (CEC). In this study, we test in vitro the surgical potential of cultivated human corneal endothelial cells (hCEC) on human anterior lens capsule (HALC), LinkCell™ bioengineered collagen sheets of 20-µm thickness (LK20), and denuded Descemet membrane (dDM) as tissue-engineered grafts for Descemet membrane (DM) endothelial keratoplasty (DMEK) to bypass the problem of donor tissue availability. Primary hCEC cultured on all carriers formed a monolayer of tightly packed cells with a high cell viability rate (96% ± 4%). hCEC on HALC and LK20 showed unremarkable expression of zonula occludens-1 (ZO-1) and Na(+)/K(+)-adenosine triphosphatase (ATPase), while Na(+)/K(+)-ATPase expression of cells seeded on dDM was mainly cytoplasmic. All hCEC-carrier constructs were evaluated by simulating DMEK surgery in vitro using a human donor cornea without DM mounted on an artificial anterior chamber (AC) and a regular DMEK-graft used as a surgical reference model. During in vitro surgery, hCEC-HALC constructs behaved most similarly to a DMEK-graft during implantation and unfolding, showing good adhesion to the bare stroma. On the other hand, hCEC-LK20 and hCEC-dDM constructs required some additional handling because of challenges related to the surgical procedure, although they were both successfully unfolded and implanted in the artificial AC. The hCEC-dDM constructs showed similar graft adherence as hCEC-HALC constructs, while adherence of hCEC-LK20 constructs was less effective. After the in vitro surgery, the estimated area populated by viable cells on the hCEC-HALC and hCEC-LK20 constructs was ∼83% and ∼67%, respectively. Overall, hCEC-HALC constructs behaved most similarly to a DMEK-graft during in vitro DMEK surgery, while graft adhesion and surgical handling, respectively, are parameters still requiring optimization for hCEC-LK20 and hCEC-dDM constructs.",2020,Cell transplantation,10.1177/0963689720923577,C4_endothelium;D3_full_thickness_multilayer,2,,,,,
PUBMED_0271,32364211,Aqueous surface gels as low friction interfaces to mitigate implant-associated inflammation.,"Aqueous surface gels are fragile yet resilient biopolymer-based networks capable of sustaining extremely low friction coefficients despite tribologically-challenging environments. These superficial networks are ubiquitous in natural sliding interfaces and protect mechanosensitive cells from excessive contact pressures and frictional shear stresses from cell-fluid, cell-cell, or cell-solid interactions. Understanding these complex lubrication mechanisms may aid in the development of materials-based strategies for increasing biocompatibility in medical devices and implants. Equally as important is characterizing the interplay between soft and passive yet mobile implant materials and cellular reactions in response to direct contact and frictional shear stresses. Physically interrogating living biological systems without rupturing them in the process is nontrivial. To this end, custom biotribometers have been designed to precisely modulate contact pressures against living human telomerase-immortalized corneal epithelial (hTCEpi) cell layers using soft polyacrylamide membrane probes. Reverse-transcription quantitative polymerase chain-reaction (RT-qPCR) indicated that increased duration and, to a much greater extent, the magnitude of frictional shear stress lead to increased production of pro-inflammatory (IL-1β, IL-6, MMP9) and pro-apoptotic (DDIT3, FAS) genes, which in clinical studies are linked to pathological pain. The hierarchical structure often found in biological systems has also been investigated through the fabrication of high-water content (polyacrylamide) hydrogels through free-radical polymerization inhibition. Nanoindentation experiments and friction coefficient measurements indicate that these ""gradient surface gels"" reduce contact pressures and frictional shear stresses at the surface of the material while still maintaining stiffness within the bulk. Reducing frictional shear stresses through informed materials and surface design may concomitantly increase lubricity and quiet the immune response, and thus provide bio-inspired routes to improve patient outcomes and quality of life.",2020,Journal of materials chemistry. B,10.1039/d0tb00582g,A3_epithelium_limbus,1,,,,,
PUBMED_0272,32367751,A family of fuchs endothelial corneal dystrophy and anterior polar cataract with an analysis of whole exome sequencing.,"PURPOSE: Our aim was to introduce a family affected by this rare phenotype, and perform the whole exome sequencing (WES) to explore the potential candidate genes causing the disorders. METHODS: A five-generation family including five patients affected by FECD with APC, and nine patients suffered from only FECD was recruited from the First Affiliated Hospital of Harbin Medical University. All participants received ophthalmic examinations. Eight family members were selected to perform WES with a bioinformatics analysis and genome-wide linkage analysis. The candidate genes were identified by polymerase chain reaction (PCR) and Sanger sequencing. RESULTS: Patients in this family had FECD as the common feature. The proband (a 65-year-old female) was affected by FECD and APC in both eyes, with epithelial bullae in the left eye. Slit-lamp, specular, and confocal microscope and OCT images showed guttae more serious in the central cornea than the peripheral area, confirming the diagnosis of FECD. In this family, most corneal guttae was bilateral with an almost equal degree of progression in the Descemet membrane, APC was found around the age of 10, perhaps even earlier. According to the analysis of bioinformatics analysis, two candidate genes were found and confirmed by PCR and Sanger sequencing, but could not achieve genotype-phenotype co-segregation in the family. CONCLUSION: We introduced a family of FECD with APC, with no known causative gene found by WES, inferring that there may be a novel gene-locus in the non-coding regions of genome, which needs further study by WGS. The contribution of this study was to exclude the possibility of the rare phenotype pathogenic site in exome and narrow the scope of pathogenic genes.",2020,Ophthalmic genetics,10.1080/13816810.2020.1759109,C4_endothelium,1,,,,,
PUBMED_0273,32368948,Engineering a Corneal Stromal Equivalent Using a Novel Multilayered Fabrication Assembly Technique.,"To overcome the serious shortage of donor corneas for transplantation, alternatives based on tissue engineering need to be developed. Decellularized corneas are one potential alternative, but their densely packed collagen architecture inhibits recellularization in vitro. Therefore, a new rapid method of recellularizing these constructs to ensure high cellularity throughout the collagen scaffold is needed. In this study, we developed a novel method for fabricating corneal constructs by using decellularized porcine corneal sheets assembled using a bottom-up approach by layering multiple sheets between cell-laden collagen I hydrogel. Corneal lenticules were cut from porcine corneas by cryosectioning, then decellularized with detergents and air-dried for storage as sheets. Human corneal stromal cells were encapsulated in collagen I hydrogel and cast between the dried sheets. Constructs were cultured in serum-free medium supplemented with ascorbic acid and insulin for 2 weeks. Epithelial cells were then seeded on the surface and cultured for an additional week. Transparency, cell viability, and phenotype were analyzed by qPCR, histology, and immunofluorescence. Constructs without epithelial cells were sutured onto an ex vivo porcine cornea and cultured for 1 week. Lenticules were successfully decellularized, achieving dsDNA values of 13 ± 1.2 ng/mg dry tissue, and were more resistant to degradation than the collagen I hydrogels. Constructs maintained high cell viability with a keratocyte-like phenotype with upregulation of keratocan, decorin, lumican, collagen I, ALDH3A1, and CD34 and the corneal epithelial cells stratified with a cobblestone morphology. The construct was amenable to surgical handling and no tearing occurred during suturing. After 7 days ex vivo, constructs were covered by a neoepithelium from the host porcine cells and integration into the host stroma was observed. This study describes a novel approach toward fabricating anterior corneal substitutes in a simple and rapid manner, obtaining mature and suturable constructs using only tissue-derived materials.",2020,Tissue engineering. Part A,10.1089/ten.TEA.2020.0019,A3_epithelium_limbus;B3_stroma;D3_full_thickness_multilayer,3,,,,,
PUBMED_0274,32379938,Corneal stromal stem cells restore transparency after N(2) injury in mice.,"Corneal scarring associated with various corneal conditions is a leading cause of blindness worldwide. The present study aimed to test the hypothesis that corneal stromal stem cells have a therapeutic effect and are able to restore the extracellular matrix organization and corneal transparency in vivo. We first developed a mouse model of corneal stromal scar induced by liquid nitrogen (N(2) ) application. We then reversed stromal scarring by injecting mouse or human corneal stromal stem cells in injured cornea. To characterize the mouse model developed in this study and the therapeutic effect of corneal stromal stem cells, we used a combination of in vivo (slit lamp, optical coherence tomography, in vivo confocal microscopy, optical coherence tomography shear wave elastography, and optokinetic tracking response) and ex vivo (full field optical coherence microscopy, flow cytometry, transmission electron microscopy, and histology) techniques. The mouse model obtained features early inflammation, keratocyte apoptosis, keratocyte transformation into myofibroblasts, collagen type III synthesis, impaired stromal ultrastructure, corneal stromal haze formation, increased corneal rigidity, and impaired visual acuity. Injection of stromal stem cells in N(2) -injured cornea resulted in improved corneal transparency associated with corneal stromal stem cell migration and growth in the recipient stroma, absence of inflammatory response, recipient corneal epithelial cell growth, decreased collagen type III stromal content, restored stromal ultrastructure, decreased stromal haze, decreased corneal rigidity, and improved vision. Our study demonstrates the ability of corneal stromal stem cells to promote regeneration of transparent stromal tissue after corneal scarring induced by liquid nitrogen.",2020,Stem cells translational medicine,10.1002/sctm.19-0306,B3_stroma,1,,,,,
PUBMED_0275,32386281,High-throughput 3D bioprinting of corneal stromal equivalents.,"In this study we designed high-throughput 3D bioprinting of corneal equivalents which may address the need for in vitro models. In our digital 3D cornea model, average dimensions of adult cornea were converted to 3D shapes, then to G-code files which were printed by BIOX printer (CELLINK). To maintain the curvature of cornea, a support scaffold was designed using stereolithographic printer. The support scaffold could facilitate the printing of 6-12 corneas at a time thus enabling high-throughput printing. Human corneal keratocytes (HCKs) were incorporated in the optimized bio-ink, and cell-laden corneal stromal equivalents were printed. Printed structures were cross-linked by calcium chloride 100 mM, washed with Hanks' Balanced Salt Solution and incubated at 37°C in fibroblast media. Printed corneas were analyzed for live dead assay, Alamar assay, and expression of fibronectin and actin green markers. Printed corneas were able to maintain their structure, integrity, and clarity. Live dead assay and Alamar assay demonstrated that HCKs maintained high viability (>95%) for 2 weeks. HCKs in the printed corneas showed expression for fibronectin and actin green. In conclusion, high-throughput fabrication of 3D printed corneal stromal equivalents using a combination of stereolithography printing, extrusion based printing, and micro-transfer molding techniques was achieved.",2020,"Journal of biomedical materials research. Part B, Applied biomaterials",10.1002/jbm.b.34628,D3_full_thickness_multilayer,1,,,,,
PUBMED_0276,32386811,Descemet Membrane Endothelial Keratoplasty versus Ultrathin Descemet Stripping Automated Endothelial Keratoplasty: A Multicenter Randomized Controlled Clinical Trial.,"PURPOSE: To compare best spectacle-corrected visual acuity (BSCVA), endothelial cell density (ECD), refractive astigmatism, and complications after Descemet membrane endothelial keratoplasty (DMEK) and ultrathin Descemet stripping automated endothelial keratoplasty (UT-DSAEK). DESIGN: Prospective, multicenter randomized controlled trial. PARTICIPANTS: Fifty-four pseudophakic eyes of 54 patients with corneal endothelial dysfunction resulting from Fuchs endothelial corneal dystrophy were enrolled in 6 corneal centers in The Netherlands. METHODS: Participants were allocated to DMEK (n = 29) or UT-DSAEK (n = 25) using minimization randomization based on preoperative BSCVA, recipient central corneal thickness, gender, age, and institution. Donor corneas were prestripped and precut for DMEK and UT-DSAEK, respectively. Six corneal surgeons participated in this study. MAIN OUTCOME MEASURES: The primary outcome measure was BSCVA at 12 months after surgery. RESULTS: Central graft thickness of UT-DSAEK lamellae measured 101 μm (95% confidence interval [CI], 90-112 μm). Best spectacle-corrected visual acuity did not differ significantly between DMEK and UT-DSAEK groups at 3 months (0.15 logarithm of the minimum angle of resolution [logMAR] [95% CI 0.08-0.22 logMAR] vs. 0.22 logMAR [95% CI 0.16-0.27 logMAR]; P = 0.15), 6 months (0.11 logMAR [95% CI 0.05-0.17 logMAR] vs. 0.16 logMAR [95% CI 0.12-0.21 logMAR]; P = 0.20), and 12 months (0.08 logMAR [95% CI 0.03-0.14 logMAR] vs. 0.15 logMAR [95% CI 0.10-0.19 logMAR]; P = 0.06). Twelve months after surgery, the percentage of eyes reaching 20/25 Snellen BSCVA was higher in DMEK compared with UT-DSAEK (66% vs. 33%; P = 0.02). Endothelial cell density did not differ significantly 12 months after DMEK and UT-DSAEK (1870 cells/mm(2) [95% CI 1670-2069 cells/mm(2)] vs. 1612 cells/mm(2) [95% CI 1326-1898 cells/mm(2)]; P = 0.12). Both techniques induced a mild hyperopic shift (12 months: +0.22 diopter [D; 95% CI -0.23 to 0.68 D] for DMEK vs. +0.58 D [95% CI 0.13-1.03 D] for UT-DSAEK; P = 0.34). CONCLUSIONS: Descemet membrane endothelial keratoplasty and UT-DSAEK did not differ significantly in mean BSCVA, but the percentage of eyes achieving 20/25 Snellen vision was significantly higher with DMEK. Endothelial cell loss did not differ significantly between the treatment groups, and both techniques induced a minimal hyperopic shift.",2020,Ophthalmology,10.1016/j.ophtha.2020.02.029,C4_endothelium,1,,,,,
PUBMED_0277,32391399,Ultrathin Descemet stripping automated endothelial keratoplasty versus Descemet membrane endothelial keratoplasty: a fellow-eye comparison.,"BACKGROUND: To compare the visual outcome and patients' satisfaction after ultrathin Descemet stripping automated endothelial keratoplasty (UT-DSAEK) and Descemet membrane endothelial keratoplasty (DMEK) performed on fellow eyes of the same patients. METHODS: In this retrospective study, the records of 18 pseudophakic patients affected by Fuchs endothelial dystrophy who underwent DMEK in one eye and UT-DSAEK in the fellow eye were reviewed. Best corrected visual acuity (BCVA), corneal pachymetry, keratometry, corneal aberrations, photopic and mesopic contrast sensitivity, and endothelial cell counts measured 12 months after surgery in either eye were analyzed and compared. The results of a satisfaction questionnaire were also reviewed. RESULTS: Twelve months after surgery, BCVA was not significantly different in UT-DSAEK and DMEK eyes (0.10 ± 0.04 and 0.07 ± 0.07 logMAR, respectively); at both 4- and 6 mm optical zones total and posterior corneal higher order aberrations (HOAs), posterior astigmatism and total coma were significantly lower after DMEK; BCVA in both groups was significantly correlated mainly with anterior corneal aberrations; contrast sensitivity was higher after DMEK especially in mesopic conditions and at medium spatial frequencies; the endothelial cell density was similar, although slightly higher in the UT-DSAEK group (p = 0.10). The satisfaction questionnaire showed that although patients were highly satisfied from both procedures, more than half of them preferred DMEK and reported a more comfortable and quicker postoperative recovery. CONCLUSIONS: DMEK and UT-DSAEK showed no evidence of difference in terms of postoperative BCVA, although DMEK had a better performance in terms of contrast sensitivity, posterior corneal aberrations and overall patient satisfaction.",2020,"Eye and vision (London, England)",10.1186/s40662-020-00191-6,C4_endothelium,1,,,,,
