screening_id,pmid,title,abstract,year,journal,doi,sources,source_count,decision,exclusion_reason,corneal_layer,priority_level,screening_notes
PUBMED_0224,31751429,Treatment of corneal endothelial damage in a rabbit model with a bioengineered graft using human decellularized corneal lamina and cultured human corneal endothelium.,"OBJECTIVE: We aimed to investigate the functionality of human decellularized stromal laminas seeded with cultured human corneal endothelial cells as a tissue engineered endothelial graft (TEEK) construct to perform endothelial keratoplasty in an animal model of corneal endothelial damage. METHODS: Engineered corneal endothelial grafts were constructed by seeding cultured human corneal endothelial cell (hCEC) suspensions onto decellularized human corneal stromal laminas with various coatings. The functionality and survival of these grafts with cultured hCECs was examined in a rabbit model of corneal endothelial damage after central descemetorhexis. Rabbits received laminas with and without hCECs (TEEK and control group, respectively). RESULTS: hCEC seeding over fibronectin-coated laminas provided an optimal and consistent endothelial cell count density and polygonal shape on the decellularized laminas, showing active pump fuction. Surgery was performed uneventfully as standard Descemet stripping automated endothelial keratoplasty (DSAEK). Corneal transparency gradually recovered in the TEEK group, whereas haze and edema persisted for up to 4 weeks in the controls. Histologic examination showed endothelial cells of human origin covering the posterior surface of the graft in the TEEK group. CONCLUSIONS: Grafting of decellularized stroma carriers re-surfaced with human corneal endothelial cells ex vivo can be a readily translatable method to improve visual quality in corneal endothelial diseases.",2019,PloS one,10.1371/journal.pone.0225480,B3_stroma;C4_endothelium;D3_full_thickness_multilayer,3,,,,,
PUBMED_0225,31781374,Descemet Membrane Endothelial Keratoplasty for Corneal Decompensation Secondary to Phakic Intraocular Lenses.,"PURPOSE: To describe the surgical technique and clinical outcomes of bilensectomy (pIOL explant and phacoemulsification), followed by DMEK performed for bullous keratopathy secondary to pIOL. METHODS: Seven eyes of seven patients, who developed corneal decompensation after pIOL implantation, underwent bilensectomy followed by DMEK in a two-step procedure. Main outcome measures included uncorrected visual acuity (UCVA) and best-corrected visual acuity (BCVA), refraction, endothelial cell density (ECD) at 1, 3, 6, and 12 months, and intraoperative and postoperative complications. RESULTS: DMEK was performed at a mean time of 9.83 ± 8.23 months after bilensectomy. BCVA (log MAR) improved in all eyes, increasing from 1.11 ± 0.78 preoperatively to 0.54 ± 0.21, 0.28 ± 0.23, 0.21 ± 0.21, and 0.17 ± 0.17 at 1, 3, 6, and 12 months after DMEK. One year after surgery, mean spherical equivalent and cylinder were -0.70 ± 0.92 D and -1.50 ± 0.54 D, respectively. ECD decreased by 62 ± 4%, 69 ± 4%, 74 ± 4%, and 77 ± 3% at 1, 3, 6, and 12 months after DMEK. There was one case of primary graft failure and no other postoperative complications. CONCLUSIONS: The two-step technique bilensectomy followed by DMEK is a feasible technique for the management of bullous keratopathy secondary to pIOL, providing a fast visual recovery with good visual and refractive results.",2019,Journal of ophthalmology,10.1155/2019/2038232,C4_endothelium,1,,,,,
PUBMED_0226,31805594,"[Automated Cell Counting Using ""Deep Learning"" in Donor Corneas from Organ Culture Achieves High Precision and Accuracy].","BACKGROUND: Human corneal grafts from organ culture need to have more than 2000 endothelial cells/mm(2) to be suitable for transplantation. Measurement of the endothelial cell density is complicated by invisible cell borders in phase contrast microscopy, as well as by limited areas for counting due to folds in the Descemet membrane of the swollen corneal grafts. To date, no automated counting method for measuring the endothelial cell density exists. The neuronal network U-Net has already proven itself in automated segmentation of specular microscopy images of human corneal endothelium. The aim of this study was the application of the U-Net in the quality control of human corneal grafts. MATERIAL AND METHODS: Training of the U-Net was performed using 100 manually tagged endothelial cell images of corneal grafts from the Lions eye bank in Baden-Württemberg. Another 100 images were obtained for testing the precision of measurements of the U-Net. These were adjudged manually by a) an experienced investigator and b) a less experienced ophthalmologist. The endothelial cells in identical images were then counted automatically by the trained U-Net. Comparison with the manually counted results was drawn by Pearson correlation. RESULTS: The correlation coefficient between the U-Net and the experienced investigator as gold standard was 0.9. The correlation coefficient between the less experienced ophthalmologist and the gold standard was only 0.81. Both correlations were statistically highly significant (p < 0.0001). DISCUSSION: The strong correlation between the U-Net and the gold standard points out that, given medical approval, effective assistance for eye banks is possible in quality control by automated counting. This could improve objectivity and efficiency of work flow.",2019,Klinische Monatsblatter fur Augenheilkunde,10.1055/a-1023-4339,C4_endothelium,1,,,,,
PUBMED_0227,31811387,Cell Loaded GelMA:HEMA IPN hydrogels for corneal stroma engineering.,"Stroma is the main refractive element of the cornea and damage to it is one of the main causes of blindness. In this study, cell loaded hydrogels of methacrylated gelatin (GelMA) and poly(2-hydroxyethyl methacrylate) (pHEMA) (8:2) interpenetrating network (IPN) hydrogels were prepared as the corneal stroma substitute and tested in situ and in vitro. Compressive modulus of the GelMA hydrogels was significantly enhanced with the addition of pHEMA in the structure (6.53 vs 155.49 kPa, respectively). More than 90% of the stromal keratocytes were viable in the GelMA and GelMA-HEMA hydrogels as calculated by Live-Dead Assay and NIH Image-J program. Cells synthesized representative collagens and proteoglycans in the hydrogels indicating that they preserved their keratocyte functions. Transparency of the cell loaded GelMA-HEMA hydrogels was increased significantly up to 90% at 700 nm during three weeks of incubation and was comparable with the transparency of native cornea. Cell loaded GelMA-HEMA corneal stroma model is novel and reported for the first time in the literature in terms of introduction of cells during the preparation phase of the hydrogels. The appropriate mechanical strength and high transparency of the cell loaded constructs indicates a viable alternative to the current devices used in the treatment of corneal blindness.",2019,Journal of materials science. Materials in medicine,10.1007/s10856-019-6345-4,B3_stroma;D3_full_thickness_multilayer,2,,,,,
PUBMED_0228,31817298,Corneal Epithelial-Stromal Fibroblast Constructs to Study Cell-Cell Communication in Vitro.,"Cell-cell communication plays a fundamental role in mediating corneal wound healing following injury or infection. Depending on the severity of the wound, regeneration of the cornea and the propensity for scar development are influenced by the acute resolution of the pro-fibrotic response mediated by closure of the wound via cellular and tissue contraction. Damage of the corneal epithelium, basement membrane, and anterior stroma following a superficial keratectomy is known to lead to significant provisional matrix deposition, including secretion of fibronectin and thrombospondin-1, as well as development of a corneal scar. In addition, corneal wounding has previously been shown to promote release of extracellular vesicles from the corneal epithelium, which, in addition to soluble factors, may play a role in promoting tissue regeneration. In this study, we report the development and characterization of a co-culture system of human corneal epithelial cells and corneal stromal fibroblasts cultured for 4 weeks to allow extracellular matrix deposition and tissue maturation. The secretion of provisional matrix components, as well as small and large extracellular vesicles, was apparent within the constructs, suggesting cell-cell communication between epithelial and stromal cell populations. Laminin-1β was highly expressed by the corneal epithelial layer with the presence of notable patches of basement membrane identified by transmission electron microscopy. Interestingly, we identified expression of collagen type III, fibronectin, and thrombospondin-1 along the epithelial-stromal interface similar to observations seen in vivo following a keratectomy, as well as expression of the myofibroblast marker, α-smooth muscle actin, within the stroma. Our results suggest that this corneal epithelial-stromal model may be useful in the study of the biochemical phenomena that occur during corneal wound healing.",2019,"Bioengineering (Basel, Switzerland)",10.3390/bioengineering6040110,B3_stroma;D3_full_thickness_multilayer,2,,,,,
PUBMED_0229,31837315,Outcome of Descemet Membrane Endothelial Keratoplasty Using Corneas from Donors ≥80 Years of Age.,"PURPOSE: The purpose of this study was to investigate whether corneas from donors ≥80 years old are suitable for Descemet membrane endothelial keratoplasty (DMEK). DESIGN: Retrospective, comparative, interventional case series. METHODS: Records of 1,765 consecutive DMEKs were reviewed and matched with corresponding donor tissue data. Older donors (≥80 years of age) were compared to younger donors (<80 years). Outcome measurements in DMEK recipients included best spectacle-corrected visual acuity (BSCVA), endothelial cell density (ECD), central corneal thickness (CCT) at 3 and 6 months and at 1, 2, and 3 years' follow-up and re-bubbling rates. RESULTS: Of 1,748 DMEKs, 284 (16.2%) were performed with older donor lamellae (mean donor age, 83.96 ± 3.19 years; range, 80-94 years) and 1,464 (83.7%) with younger donor tissue (mean donor age, 65.27 ± 9.57 years; range, 17-79). BSCVA results were comparable for all postoperative time points. CCT results for younger donors were more favorable in the early postoperative course (P < 0.001 at 6 months; and P < 0.001 at 1 year), whereas mid-term results were comparable in both groups. ECD values were significantly higher in donors <80 years of age preoperatively and during the first 2 postoperative years (P ≤ 0.024). Overall re-bubbling rates were comparable in both groups. CONCLUSIONS: Older donors, ≥80 to 94 years of age, seem to produce comparable mid-term functional results following DMEK surgery compared to younger donors. The use of corneas from donors aged ≥80 for DMEK surgery may therefore be a promising approach to counteract global donor shortage.",2020,American journal of ophthalmology,10.1016/j.ajo.2019.12.001,C4_endothelium,1,,,,,
PUBMED_0230,31851850,Göttingen Minipig is not a Suitable Animal Model for in Vivo Testing of Tissue-Engineered Corneal Endothelial Cell-Carrier Sheets and for Endothelial Keratoplasty.,"AIM: To test the feasibility of implanting human anterior lens capsules (HALCs) with porcine corneal endothelial cells (pCEC) in vivo in Göttingen minipigs and at the same time test the suitability of Göttingen minipig as model for endothelial keratoplasty. MATERIALS AND METHODS: Cell-carrier constructs of decellularized HALC with cultured (pCEC) were created for implementation in vivo. Eight Göttingen minipigs (6 months old) underwent surgery with descemetorhexis or removal of endothelium by scraping and implementation of HALC without (animal 1-4) and with (animal 5-8) pCEC. Follow-up examinations included optical coherence tomography (OCT) imaging (1,2 and 3 months) and slit-lamp examination (<1 week as well as 1,2 and 3 months). RESULTS: Intraoperative challenges included difficulties in maintaining an anterior chamber due to soft tissue and vitreous pressure, development of corneal edema and difficulties removing Descemet's membrane because of strong adhesion to stroma. Therefore, descemetorhexis was replaced by mechanical scraping of the endothelium in animal 4-8. HALCs without pCEC were implanted in animal 1-4. Apposition to the back surface was not achieved in animal 1 and 3 because of corneal edema and poor visibility. Animal 5 was sacrificed because of a lens capsule tear. HALCs with pCEC were implanted in animal 6-8. Slit-lamp examination the first week revealed corneal edema in all animals, although mild in animals 4. One-month examination showed retrocorneal membranes with overlying corneal edema in all animals. Histology showed fibrosis in the AC and on the back surface of the cornea, compatible with the clinical diagnosis of retrocorneal membrane. CONCLUSIONS: In conclusion, the minipig is not suitable for corneal transplantation studies in vivo because of intraoperative challenges and development of retrocorneal membrane postoperatively. For in vivo testing of the surgical handling and the therapeutic potential of tissue-engineered endothelial cell-carrier constructs other animal models are required.",2020,Current eye research,10.1080/02713683.2019.1706747,B3_stroma,1,,,,,
PUBMED_0231,31863726,Effect of Surgical Indication and Preoperative Lens Status on Descemet Membrane Endothelial Keratoplasty Outcomes.,"PURPOSE: To analyze 6-month results of 1000 consecutive Descemet membrane endothelial keratoplasty (DMEK) cases, and to evaluate if outcomes are influenced by surgical indication and preoperative lens status. DESIGN: Retrospective, interventional case series. METHODS: A series of 1000 eyes (738 patients) underwent DMEK mainly for Fuchs endothelial corneal dystrophy (FECD; 85.3%) or bullous keratopathy (BK; 10.5%). Main outcome measures were best-corrected visual acuity (BCVA), endothelial cell density, postoperative complications, and retransplantations. RESULTS: At 6 months after DMEK, there was no difference in BCVA outcome between FECD and BK eyes (P = .170), or between phakic and pseudophakic FECD eyes (P = .066) after correcting for patient age and preoperative BCVA. Endothelial cell loss at 6 months postoperatively was similar for phakic and pseudophakic FECD eyes (39%; P = .852), but higher for BK eyes than for FECD eyes (46% vs 39%, P = .001). Primary and secondary graft failure occurred in 3 (0.3%) and 2 eyes (0.2%), respectively, and 7 eyes developed allograft rejection (0.7%). Eighty-two eyes (8.2%) received rebubbling for graft detachment and retransplantation was performed in 20 eyes (2.0%). Rebubbling was more often required in eyes treated for BK vs FECD eyes (12.4% vs 7.4%, P = .022). CONCLUSION: DMEK consistently provides excellent short-term results, with similar high visual acuity levels for both FECD and BK eyes. As preoperative lens status did not influence DMEK outcomes, for phakic FECD eyes with a still relatively clear crystalline lens, lens preservation may be preferable in a selected group of younger patients, who may still benefit from their residual accommodative capacity.",2020,American journal of ophthalmology,10.1016/j.ajo.2019.12.011,C4_endothelium,1,,,,,
PUBMED_0232,31867140,Confocal and Histological Features After Poly(Ethylene Glycol) Diacrylate Corneal Inlay Implantation.,"PURPOSE: To evaluate the in vivo biocompatibility of photopolymerized poly(ethylene glycol) diacrylate (PEGDA) intrastromal inlays in rabbit corneas. METHODS: Sixty-three eyes of 42 New Zealand rabbits were included. Manual intrastromal pockets were dissected in 42 eyes. PEGDA inlays were obtained using a specifically designed photomask and were inserted in the intrastromal pocket of 21 eyes (inlay group); the remaining 21 right eyes did not receive any implant (pocket-only group). Twenty-one eyes with no intervention were used as controls. In vivo confocal microscopy (IVCM) was performed at every visit. After 2 months, rabbits were sacrificed and corneas removed for histological analysis. RESULTS: Corneas remained clear in all but two animals, and five cases of corneal neovascularization were seen (P = 0.2). Inlays remained stable without evidence of lateral or anterior migration, and no other complications were observed. No changes in anterior and posterior keratocyte density (P = 0.3 and P = 0.1, respectively) or endothelial cell density (P = 0.23) were observed between groups during the study time by IVCM. On pathology samples, thinning of the epithelium over the inlay area and epithelial hyperplasia over the edges were observed. A polygonal empty space with no evidence of PEGDA hydrogel within the midstroma was seen in the inlay group. Keratocytes were normal in shape and number in the vicinity of the PEGDA implant area. CONCLUSIONS: Photopolymerized PEGDA intrastromal inlays have shown relatively good safety and stability in rabbit corneas. Inlays were biostable in the corneal environment and remained transparent during follow up. TRANSLATIONAL RELEVANCE: The investigated PEGDA is promising for the development of biocompatible intrastromal implants.",2019,Translational vision science & technology,10.1167/tvst.8.6.39,B3_stroma;C4_endothelium,2,,,,,
PUBMED_0233,31881719,Stromal Collagen Arrangement Correlates with Stiffness of the Canine Cornea.,"The cornea is the most external layer of the eye and serves two important roles in (1) the refraction of light and (2) protection from the outside environment, both of which are highly dependent on the collagen assembly of the corneal stroma. This study sought to determine the collagen fiber arrangement of the canine corneal stroma and correlate the stromal organization with tissue stiffness in the anterior and posterior cornea. Collagen organization of the canine cornea was visualized through second-harmonic generation (SHG) imaging, and tissue stiffness of the anterior and posterior corneal stroma was determined by atomic force microscopy. Analysis of the canine anterior corneal stroma using SHG imaging documented intertwining of the collagen fibers with a high degree of fiber branching, with a more lamellar and non-branching posterior stroma. The anterior stroma had significantly higher tissue stiffness in both dogs and humans, when compared with the posterior corneal stroma (canine median: 1.3 kPa vs. 0.3 kPa; human median: 14.6 kPa vs. 2.1 kPa, respectively). There was a direct correlation between corneal collagen stromal organization and tissue stiffness in the dog, which was consistent with other mammalian species previously examined and likely reflects the need for maintenance of rigidity and corneal curvature.",2019,"Bioengineering (Basel, Switzerland)",10.3390/bioengineering7010004,B3_stroma,1,,,,,
PUBMED_0234,31884496,Biomechanical Changes after in vivo Enzyme-Induced Corneal Crosslinking in Rabbits.,"INTRODUCTION: Enzyme-induced corneal crosslinking (CXL) may be a promising and effective method to stiffen the cornea. However, there have been no reports on the effect of corneal CXL with enzyme in vivo. OBJECTIVE: To evaluate the biomechanical efficacy after in vivo enzyme-induced corneal CXL in rabbits using noninvasive imaging. METHODS: The eyes of 10 white New Zealand rabbits were unilaterally treated with CXL enzyme (transglutaminases [Tgases]). The contralateral eyes served as negative controls. In every rabbit, a 1 U/mL solution of Tgases was applied to the corneal surface. Corneal dynamic deformation by an air puff was measured using high-speed Scheimpflug imaging on day 14 after the procedure. Biomechanical parameters, central corneal thickness, and intraocular pressure were recorded and assessed. Then, corneal buttons were excised from euthanized animals for hematoxylin and eosin staining to evaluate changes in corneal collagen distribution and cell damage. RESULTS: Some biomechanical parameters showed statistically significant changes after in vivo CXL. The deformation amplitude and maximum corneal velocity during the second applanations were significantly lower than those of the untreated control group. The second applanations were significantly increased compared to the control group. No changes were found in other parameters. The morphology of the corneal stroma was similar in CXL-treated and untreated corneas. No obvious cell apoptosis was observed. CONCLUSIONS: Corneal stiffness increased after in vivo CXL induced by Tgases. This CXL method may be useful for corneal ectasia.",2020,Ophthalmic research,10.1159/000505629,B3_stroma,1,,,,,
PUBMED_0235,31903218,Influence of polydimethylsiloxane substrate stiffness on corneal epithelial cells.,"Many cell types are known to modulate their behaviour in response to changes in material stiffness; however, little is known about how stiffness affects corneal epithelial cells. This study aims to investigate the response of a corneal epithelial cell line to polydimethylsiloxane (PDMS) substrates with a range of Young's moduli from 10 to 1500 kPa. Cellular morphology, proliferation, differentiation and mechanobiology were examined. Cells grown on PDMS adopted the typical cobblestone morphology exhibited by the corneal epithelium. Proliferative markers pERK and Ki67 were higher in cells cultured on stiffer substrates compared with those on softer substrates. Material stiffness was also found to influence the cell phenotype with cells on stiffer substrates having higher cytokeratin 3 gene expression, a mature epithelial marker, while cells on softer substrates expressed more cytokeratin 14, a basal epithelial marker. Cells grown on softer substrates also displayed higher levels of focal adhesions and intermediate filaments compared with cells on stiff substrates. This research will aid in designing novel biomaterials for the culture and transplantation of corneal epithelial cells.",2019,Royal Society open science,10.1098/rsos.191796,A3_epithelium_limbus,1,,,,,
PUBMED_0236,31924032,Characterization of extracellular matrix modified poly(ε-caprolactone) electrospun scaffolds with differing fiber orientations for corneal stroma regeneration.,"Alternatives to donor cornea transplantation based on tissue engineering are desirable to overcome the current severe donor tissue shortage. Many natural polymers have good biological properties but poor mechanical properties and degradation resistance; while synthetic polymers have good mechanical properties but do not contain biochemical molecules normally found in the real tissue. In addition, both fiber orientation and composition play a key role in dictating cell behavior within a scaffold. In this study, the effect on corneal stromal cells of adding decellularized corneal extracellular matrix (ECM) to an electrospun polymer with differing fiber organizations was explored. Electrospun matrices were generated using polycaprolactone (PCL) and PCL combined with ECM and electrospun into random, radial and perpendicularly aligned fiber scaffolds. Human corneal stromal cells were seeded onto these scaffolds and the effect of composition and orientation on the cells phenotype was assessed. Incorporation of ECM into PCL increased hydrophilicity of scaffolds without an adverse effect on Young's modulus. Cells seeded on these matrices adopted different morphologies that followed the orientation of the fibers. Keratocyte markers were increased in all types of scaffolds compared to tissue culture plastic. Scaffolds with radial and perpendicularly aligned fibers promoted enhanced cell migration. Aligned scaffolds with incorporated ECM show promise for their use as cell-free implants that promote endogenous repopulation by neighboring cells.",2020,"Materials science & engineering. C, Materials for biological applications",10.1016/j.msec.2019.110415,B3_stroma,1,,,,,
