screening_id,pmid,title,abstract,year,journal,doi,sources,source_count,decision,exclusion_reason,corneal_layer,priority_level,screening_notes,endothelium_relevance_score,endothelium_relevance_terms,recommended_action,strict_endothelium_decision,strict_endothelium_reason
PUBMED_0103,30319302,Changes in the morphology of corneal endothelial cells in young myopic adults after 6 months of wearing soft contact lenses: a Malaysian perspective.,"PURPOSE: Soft contact lens wear is most frequently associated with morphologic changes in corneal endothelial cells, but the data are scarce in Asians. This study aimed to evaluate changes in corneal endothelial cell morphology after 6 months of wearing soft hydrogel contact lenses (SH) in young myopic adults living in Kuala Lumpur. PATIENTS AND METHODS: Forty-eight subjects were included in the study, 24 were fitted with SH contact lenses (A) and the rest were prescribed with glasses (B). Refraction was conducted subjectively and standard contact lens fitting protocol was followed. Corneal endothelial cell morphology (endothelial cell density, ECD; coefficient of variation, COV; cells' hexagonality, HEX; and central corneal thickness, CCT) was evaluated using specular microscope. Data were collected at baseline and after 6 months of lens wear. RESULTS: Mean age of all subjects was 21.23±1.30 years. All results are shown at baseline and 6 months, respectively. Mean refraction for A was -2.16±0.97 diopter sphere (DS) and -2.05±1.03 DS (P=0.49); for B was -2.72±1.51 DS and -2.73±1.51 DS (P=0.58). Mean ECD (cell/mm(2)) for A: 3104.19±237.30 and 3107.23±237.51 (P=0.07); for B: 3011.56±227.95 and 2983.83±244.55 (P=0.33). COV (%) for A: 46.52±8.63 and 48.53±10.65 (P=0.06); for B: 46.93±9.31 and 46.14±10.65 (P=0.88). HEX (%) for A: 46.21±10.12 and 45.15±10.01 (P=0.08); for B: 46.21±10.12 and 45.15±10.01 (P=0.12). CCT (µm) for A: 520.33±0.04 and 525.70±0.05 (P=0.41); for B: 532.00±0.04 µm and 530.00±0.05 µm (P=0.40). CONCLUSION: This study found no significant change in corneal endothelial cell morphology after 6 months of wearing SH contact lenses. This is probably due to better oxygen permeability of the contact lens material, good compliance, and short wearing period.",2018,Clinical optometry,10.2147/OPTO.S172272,C4_endothelium,1,Include,,endothelium,Medium,"Corrected include: title/abstract indicates corneal tissue engineering, biomaterial/scaffold, engineered construct, decellularized matrix, cell sheet, stem-cell construct, or regeneration/reconstruction relevance.",2,corneal endothelial cell; endothelial cells; hexagonal; cell density; corneal thickness,Manual check,Exclude/background,Soft contact lens morphology study; not tissue engineering biomaterial evidence.
PUBMED_0165,31174988,Native means of graft stabilization: Host descemetic scaffolding and wound scaffolding to decrease the risk for graft detachment in DMEK and PDEK.,"The main postoperative complication of Descemet membrane endothelial keratoplasty and pre-Descemet endothelial keratoplasty (PDEK) is graft detachment. We report a technique in which the host Descemet membrane or the incision is used for graft scaffolding. The descemetorhexis is created 0.5 mm smaller than the graft from between 1 quadrant to 360 degrees, preferably in two opposite quadrants. Using the Jacob technique of pressurized air infusion (air pump-assisted PDEK), the host Descemet membrane is gently teased from under the graft with a reverse Sinskey hook and allowed to overlap the graft from the posterior aspect in a scaffolding manner. Wound scaffolding within the incision is attained by pulling any overlapping part of the graft into the inner part of the corneal incision instead of allowing it to lie posterior to the inferior lip. Both these scaffolding maneuvers give an extra degree of scaffolding or support that provides graft stability and thereby decreases the risk for graft detachment.",2019,Journal of cataract and refractive surgery,10.1016/j.jcrs.2019.03.015,C4_endothelium,1,Include,,endothelium,Medium,"Corrected include: title/abstract indicates corneal tissue engineering, biomaterial/scaffold, engineered construct, decellularized matrix, cell sheet, stem-cell construct, or regeneration/reconstruction relevance.",2,scaffold; membrane; descemet; pump,Manual check,Add to endothelial core,Clear endothelial tissue-engineering biomaterial/carrier/scaffold signal with functional or translational relevance.
PUBMED_0245,32015414,Optimisation of Storage and Transportation Conditions of Cultured Corneal Endothelial Cells for Cell Replacement Therapy.,"As the cornea is one of the most transplanted tissues in the body it has placed a burden on the provision of corneas from cadaveric donors. Corneal endothelial dysfunction is the leading indication for cornea transplant. Therefore, tissue engineering is emerging as an alternative approach to overcome the global shortage of transplant-grade corneas. The propagation and expansion of corneal endothelial cells has been widely reported. However, one obstacle to overcome is the transport and storage of corneal endothelial cells. In this study we investigated whether tissue engineered corneal endothelial cells can be preserved in hypothermic conditions. Human corneal endothelial cells (HCEnCs) were exposed to various temperatures (4 °C, 23 °C, and 37 °C) in both adherent and suspension storage models. Optimal storage media and storage duration was tested along with post-storage viability. Following storage and subsequent recovery at 37 °C, cell phenotype was assessed by immunofluorescence, gene and protein expression, and proliferative capacity analysis. Functionality was also assessed within a rabbit model of bullous keratopathy. Our data support our hypothesis that functional HCEnCs can be preserved in hypothermic conditions.",2020,Scientific reports,10.1038/s41598-020-58700-5,C4_endothelium,1,Include,,endothelium,Medium,"Corrected include: title/abstract indicates corneal tissue engineering, biomaterial/scaffold, engineered construct, decellularized matrix, cell sheet, stem-cell construct, or regeneration/reconstruction relevance.",2,corneal endothelial cell; endothelial cells; rabbit,Manual check,Exclude/background,Insufficient scaffold/carrier/endothelial tissue-engineering benchmarking signal.
PUBMED_0303,32603022,Designer Descemet Membranes Containing PDLLA and Functionalized Gelatins as Corneal Endothelial Scaffold.,"Corneal blindness is the fourth leading cause of visual impairment. Of specific interest is blindness due to a dysfunctional corneal endothelium which can only be treated by transplanting healthy tissue from a deceased donor. Unfortunately, corneal supply does not meet the demand with only one donor for every 70 patients. Therefore, there is a huge interest in tissue engineering of grafts consisting of an ultra-thin scaffold seeded with cultured endothelial cells. The present research describes the fabrication of such artificial Descemet membranes based on the combination of a biodegradable amorphous polyester (poly (d,l-lactic acid)) and crosslinkable gelatins. Four different crosslinkable gelatin derivatives are compared in terms of processing, membrane quality, and function, as well as biological performance in the presence of corneal endothelial cells. The membranes are fabricated through multi-step spincoating, including a sacrificial layer to allow for straightforward membrane detachment after production. As a consequence, ultrathin (<1 µm), highly transparent (>90%), semi-permeable membranes could be obtained with high biological potential. The membranes supported the characteristic morphology and correct phenotype of corneal endothelial cells while exhibiting similar proliferation rates as the positive control. As a consequence, the proposed membranes prove to be a promising synthetic alternative to donor tissue.",2020,Advanced healthcare materials,10.1002/adhm.202000760,C4_endothelium,1,Include,,endothelium,Medium,"Corrected include: title/abstract indicates corneal tissue engineering, biomaterial/scaffold, engineered construct, decellularized matrix, cell sheet, stem-cell construct, or regeneration/reconstruction relevance.",2,scaffold; membrane; descemet; corneal endothelial cell; endothelial cells,Manual check,Manual check,"Likely relevant, but title/abstract signal is not strong enough for automatic core addition."
PUBMED_0724,37951740,Association of ocular surface and meibomian gland alterations with silicone hydrogel contact lens wear.,"PURPOSE: To evaluate silicone hydrogel contact lens (SH-CL) effects on the meibomian glands, corneal structure, and ocular surface parameters. METHODS: Fifty SH-CL wearers for at least 6 months, and 50 sex and age-matched control subjects were recruited for this cross-sectional study. Visual display terminal (VDT) work and CL wear duration were questioned, ocular surface and tear functions were evaluated using OSDI questionnaire, tear break-up time (TBUT), corneal fluorescein staining, and Schirmer test. Corneal sensitivity was measured with Cochet-Bonnet aesthesiometry. Meibography and in vivo confocal microscopy (IVCM) were performed to evaluate meibomian glands and corneal structure. Intergroup comparisons were made using the Chi-square test, Wilcoxon test, or Kruskal-Wallis test. RESULTS: In the CL group, TBUT was shorter (P = 0.01), corneal fluorescein staining (P = 0.04), OSDI scores (P < 0.001), and meiboscores (P < 0.001) were higher than the control group. The biomicroscopic evaluation revealed meibomian gland dysfunction (MGD) in 34 % of the CL group and 20 % of the control group, which was not statistically significant (P > 0.05). IVCM showed that endothelial cell density was lower (P = 0.01) and polymegethism was higher (P < 0.001) in the CL group. Subbasal nerve density and corneal sensitivity measurements were similar in the two groups (P > 0.05). The longer VDT work duration was associated with increased CFS in the CL group (P = 0.05). CONCLUSION: The results showed that SH-CL wear increased dry eye symptoms and ocular discomfort, especially in longer VDT work duration. Meibography revealed significantly worse results in SH-CL wearers. SH-CL-related ocular discomfort seems to be more associated with MGD rather than neurosensorial alterations.",2024,Contact lens & anterior eye : the journal of the British Contact Lens Association,10.1016/j.clae.2023.102093,C4_endothelium,1,Include,,endothelium,Medium,"Corrected include: title/abstract indicates corneal tissue engineering, biomaterial/scaffold, engineered construct, decellularized matrix, cell sheet, stem-cell construct, or regeneration/reconstruction relevance.",2,cell density; in vivo,Manual check,Exclude/background,Contact lens wear/ocular surface study; not corneal tissue engineering.
PUBMED_0899,40038090,Safety and biocompatibility of a novel biodegradable aflibercept-drug delivery system in rhesus macaques.,"A clinical need exists for more effective intravitreal (IVT) drug delivery systems (DDS). This study tested the hypothesis that a novel biodegradable, injectable microsphere-hydrogel drug delivery system loaded with aflibercept (aflibercept-DDS) would exhibit long-term safety and biocompatibility in a non-human primate (NHP) model. We generated aflibercept-loaded poly (lactic-co-glycolic acid) microparticles with a modified double emulsion technique then embedded them into a biodegradable, thermo-responsive poly (ethylene glycol)-co-(L-lactic-acid) diacrylate/N-isopropylacrylamide hydrogel. Aflibercept-DDS (50 µL, 15 µg) was injected into the right eye of 23 healthy rhesus macaques. A complete ophthalmic examination, intraocular pressure (IOP), corneal pachymetry, specular microscopy, A-scan biometry, streak retinoscopy, spectral-domain optical coherence tomography (SD-OCT), fluorescein angiography (FA), and electroretinography (ERG) were performed monthly. Globes from 7 NHPs were histologically examined. Aflibercept-DDS was visualized in the vitreous up to 9 months post-IVT injection, slightly impeding fundoscopy in 4 of 23 eyes; no other consistent abnormalities were appreciated during ophthalmic examination. The IOP and total retinal thickness remained normal in all animals over all timepoints. Central corneal thickness, endothelial cell density, axial globe length, and refractive error did not significantly differ from baseline. Scotopic mixed rod-cone implicit times and amplitudes along with photopic cone response implicit times and amplitudes did not significantly differ from control values. No retinal or choroidal vascular abnormalities were detected with FA and normal retinal architecture was preserved using SD-OCT. Intravitreal injection of a biodegradable aflibercept-DDS was safe and well tolerated in NHPs up to 24 months.",2025,Drug delivery,10.1080/10717544.2025.2460671,C4_endothelium,1,Include,,endothelium,Medium,"Corrected include: title/abstract indicates corneal tissue engineering, biomaterial/scaffold, engineered construct, decellularized matrix, cell sheet, stem-cell construct, or regeneration/reconstruction relevance.",2,cell density; corneal thickness; primate; clinical,Manual check,Exclude/background,Drug-delivery safety study; not corneal endothelial tissue-engineering scaffold evidence.
PUBMED_0927,40383650,Effect of soft contact lens wear on corneal endothelial cell characteristics.,"PURPOSE: To evaluate the impact of soft contact lens (SCL) wear on corneal endothelial morphology, particularly endothelial cell density (ECD), coefficient of variation (COV), and hexagonality (HEX), comparing SCL wearers with non-wearers in a young adult population in Iraq. METHODS: A cross-sectional study was conducted involving 394 participants, aged 18-30 years, comprising 207 SCL wearers and 187 non-wearers. Corneal endothelial characteristics were assessed using non-contact specular microscopy to measure ECD, COV, and HEX. The spherical equivalent (SE) was measured using an autorefractometer. Statistical analyses were performed using one-way and two-way ANOVA tests to compare between groups. RESULTS: A total of 394 subjects participated in the study, including 207 CL wearers (108 silicone hydrogel and 99 traditional hydrogel) and 187 non-CL wearers (control group), with 149 males and 245 females. The mean age was 23.90 ± 3.07 years, and the mean spherical equivalent (SE) was -3.07 ± 1.36 diopters. The duration of CL wear ranged from 2 to 12 years, with an average of 6.37 ± 3.25 years. Participants were divided into two groups: Group 1 (2-6 years) and Group 2 (7-12 years). Statistical analysis revealed significant changes in endothelial cell density (ECD), coefficient of variation (COV), and hexagonality (HEX) in CL wearers (p < 0.001), with more pronounced alterations in Group 2, particularly among traditional hydrogel lens wearers. CONCLUSION: Prolonged soft contact lens wear is associated with significant changes in corneal endothelial morphology, including decreased ECD, increased COV, and reduced HEX, which worsen with extended use. These findings underscore the importance of monitoring corneal health in long-term SCL users and suggest the need for regular ophthalmic evaluations to mitigate potential risks.",2025,Contact lens & anterior eye : the journal of the British Contact Lens Association,10.1016/j.clae.2025.102441,C4_endothelium,1,Include,,endothelium,Medium,"Corrected include: title/abstract indicates corneal tissue engineering, biomaterial/scaffold, engineered construct, decellularized matrix, cell sheet, stem-cell construct, or regeneration/reconstruction relevance.",2,corneal endothelial cell; hexagonal; cell density,Manual check,Exclude/background,Soft contact lens endothelial-characteristics study; not tissue engineering.
PUBMED_0054,29680447,Cultivation of corneal endothelial cells from sheep.,"Research is currently under way to produce tissue engineered corneal endothelium transplants for therapeutic use in humans. This work requires the use of model animals, both for the supply of corneal endothelial cells (CECs) for experimentation, and to serve as recipients for test transplants. A variety of species can be used, however, a number of important advantages can be gained by using sheep as transplant recipients. The purpose of the present study was therefore to develop a method for culturing sheep CECs that would be suitable for the eventual construction of corneal endothelium grafts destined for sheep subjects. A method was established for culturing sheep CECs and these were compared to cultured human CECs. Results showed that cultured sheep and human CECs had similar growth characteristics when expanded from corneal endothelium explants on gelatin-coated plates, and achieved similar cell densities after several weeks. Furthermore, the markers zonula occludens-1, N-cadherin and sodium potassium ATPase could be immunodetected in similar staining patterns at cell boundaries of cultured CECs from both species. This work represents the first detailed study of sheep CEC cultures, and is the first demonstration of their similarities to human CEC cultures. Our results indicate that sheep CECs would be an appropriate substitute for human CECs when developing methods to produce tissue engineered corneal endothelium transplants.",2018,Experimental eye research,10.1016/j.exer.2018.04.011,C4_endothelium,1,Include,,endothelium,Medium,"Corrected include: title/abstract indicates corneal tissue engineering, biomaterial/scaffold, engineered construct, decellularized matrix, cell sheet, or regeneration/reconstruction relevance.",1,corneal endothelial cell; endothelial cells; expanded,Do not add yet,Exclude/background,Basic cultivation of sheep endothelial cells; weak scaffold/biomaterial benchmarking signal.
