screening_id,pmid,title,abstract,year,journal,doi,sources,source_count,decision,exclusion_reason,corneal_layer,priority_level,screening_notes,epithelium_limbus_relevance_score,epithelium_limbus_relevance_terms,recommended_action,strict_epithelium_limbus_decision,strict_epithelium_limbus_reason,top_tier_score,top_tier_reason,top_tier_decision
PUBMED_0202,31545477,Culture and characterization of human dental pulp‑derived stem cells as limbal stem cells for corneal damage repair.,"Limbal stem cell deficiency (LSCD) is one of the leading causes of corneal damage. Injury or inflammation in the cornea causes LSCD, which may be unilateral or bilateral depending upon the cause. Limbal epithelial cell implants successfully improve vision in patients with chemical injury‑induced LSCD. Transplantation of cultured epithelial stem cells has become a treatment of choice for numerous patients with LSCD. Bilateral LSCD is frequently observed in the general population, where no residual stem cells are available for ex vivo culture. Allografts are associated with a high risk of rejection, neoplasia, and disease transmission. In this respect, allogenic cell populations from other regions in the patient may substitute for allogenic material. In the present study, dental pulp stem cells were cultured in limbal stem cell media and these cells were characterized against limbal stem cells, revealing the significance of using dental pulp stem cell treatment in bilateral LSCD. The morphology and culture pattern of both limbal and dental pulp stem cells grown in limbal stem‑specific media were similar. Polymerase chain reaction analysis revealed that stem cell markers were highly expressed in limbal stem cells compared to in dental pulp stem cells, regardless of the medium and scaffold in which they were grown. Although dental pulp stem cell molecular expression is quite low at the transcript level, the functional protein level according to immunocytochemistry and western blot analyses demonstrated that stem cells and corneal differentiation molecule levels were quite high, indicating their potential as limbal stem cells in the respective microenvironment.",2019,Molecular medicine reports,10.3892/mmr.2019.10691,A3_epithelium_limbus,1,Include,,epithelium_limbus,Medium,"Corrected include: title/abstract indicates corneal tissue engineering, biomaterial/scaffold, engineered construct, decellularized matrix, cell sheet, stem-cell construct, or regeneration/reconstruction relevance.",3,scaffold; limbal; limbal stem; lsc; rat; ex vivo; transplantation,Add to core candidate,Add to epithelium/limbus core,Clear epithelial/limbal tissue-engineering scaffold/carrier/cell-sheet signal with reconstruction or regeneration relevance.,7,strong reconstruction/regeneration relevance; scaffold/carrier/material present; translational or in vivo evidence,Top-tier core addition
PUBMED_0302,32599277,Long-term outcomes of cultivated cell sheet transplantation for treating total limbal stem cell deficiency.,"PURPOSE: This study was conducted to determine the long-term outcomes of cultivated cell sheet transplantation (CCST), and to clarify risk factors that affected the outcomes. METHODS: We retrospectively analyzed the medical charts and photographs of 246 consecutive surgeries (162 eyes from 139 patients) that used CCST for treating total limbal stem cell deficiency. Deficiency types included Stevens-Johnson syndrome (SJS) or toxic epidermal necrolysis (SJS/TEN; n = 80), ocular surface burns (Burn; n = 75), ocular cicatricial pemphigoid (OCP) or pseudo-OCP (n = 58), and others (n = 33). The methods of CCST included 103 cultivated limbal epithelial transplantations (28 autologous, 62 allogeneic, and 13 living-related relatives), and 143 cultivated oral mucosal epithelial transplantations. We analyzed the rate of successful ocular surface reconstruction, clear corneas, and best-corrected visual acuity equal to or better than 20/200. RESULTS: With a mean observation period of 357 weeks, successful ocular surface reconstruction and clear corneas at last visit were achieved in 65.1% of the patients. Corrected visual acuity equal to or better than 20/200 was achieved in 19.0% of the patients. Eyes with SJS/TEN exhibited worse outcomes compared with the Burn group. Postoperative complications included corneal ulcerations or perforations (18.3%), glaucoma (13.8%), and infections (8.5%). Multivariate analyses using the logistic mixed-effects model indicated that the presence of preoperative corneal epithelial defects was a significant risk factor for postoperative failure. CONCLUSIONS: In this series, the success rate of CCST after a mean observation period of 357 weeks was 65.1%, and preoperative epithelial defect was the most relevant risk factor.",2020,The ocular surface,10.1016/j.jtos.2020.06.005,A3_epithelium_limbus,1,Include,,epithelium_limbus,Medium,"Corrected include: title/abstract indicates corneal tissue engineering, biomaterial/scaffold, engineered construct, decellularized matrix, cell sheet, stem-cell construct, or regeneration/reconstruction relevance.",3,sheet; construct; corneal epithelial; limbal; limbal stem; rat; transplantation,Add to core candidate,Add to epithelium/limbus core,Clear epithelial/limbal tissue-engineering scaffold/carrier/cell-sheet signal with reconstruction or regeneration relevance.,7,strong reconstruction/regeneration relevance; cell-sheet/cultivated epithelial construct present; translational or in vivo evidence,Top-tier core addition
PUBMED_0477,34620226,Long-term survival of cultivated oral mucosal epithelial cells in human cornea: generating cell sheets using an animal product-free culture protocol.,"Previously, we reported a collagenase-based, animal product-free protocol for cultivated oral mucosal epithelial cell sheets for transplantation (COMET). Here, we reported the long-term outcomes of first 2 clinical cases. A 27-year-old man suffered from thermal burn, which resulted in symblepharon of lower fornix OD. COMET was performed, and the cornea remained clear with few peripheral NV and no more symblepharon 34 months postoperatively. Another 42-year-old man suffered from severe alkaline burn OD. He underwent COMET, followed by corneal transplantation half a year later. A biopsy taken two years after COMET showed stratified epithelium positive for keratin 4, 13, and 3 in the suprabasal layer. Staining for p63 and p75(NTR) was both positive in the basal layer. The graft remained clear up to post-OP 4 years. Our study confirmed the long-term survival of the transplanted OMECs, suggesting that collagenase-based spheroidal suspension culture is a promising technique for COMET.Trial registration ClinicalTrials.gov, ClinicalTrials.gov ID: NCT03943797 Registered 9 May 2019-Retrospectively registered, https://clinicaltrials.gov/ct2/show/NCT03943797 .",2021,Stem cell research & therapy,10.1186/s13287-021-02564-7,A3_epithelium_limbus,1,Include,,epithelium_limbus,Medium,"Corrected include: title/abstract indicates corneal tissue engineering, biomaterial/scaffold, engineered construct, decellularized matrix, cell sheet, stem-cell construct, or regeneration/reconstruction relevance.",4,sheet; collagen; epithelial cell; p63; rat; transplantation; clinical,Add to core candidate,Add to epithelium/limbus core,Clear epithelial/limbal tissue-engineering scaffold/carrier/cell-sheet signal with reconstruction or regeneration relevance.,7,scaffold/carrier/material present; cell-sheet/cultivated epithelial construct present; translational or in vivo evidence; extractable benchmark markers likely,Top-tier core addition
PUBMED_0571,35894700,Biofunctional peptide-click PEG-based hydrogels as 3D cell scaffolds for corneal epithelial regeneration.,"Poly(ethylene glycol) (PEG)-based hydrogels as highly promising 3D cell scaffolds have been widely implemented in the field of tissue regrowth and regeneration, yet the functionalized PEG hydrogel providing dynamic, cell-instructive microenvironments is inherently difficult to obtain. Here, we have exploited the specificity of click reaction to develop a set of hydrogels based on 4-arm PEG tetraazide (4-arm-PEG-N(3)) and di-propargylated peptides (GRGDG and GRDGG) with tunable physicochemical properties applicable for 3D cell scaffolds. The azide groups of PEG were reacted with the alkynyl groups of peptides, catalyzed by copper to form triazole rings, thus generating a cross-linked hydrogel. The gelation time and mechanical strength of the hydrogels varied according to the PEG/peptide feed ratio. The resulting hydrogel exhibited a typical porous microstructure and suitable swelling behavior. The in vitro cytotoxicity test indicated that the resulting hydrogels did not cause apparent cytotoxicity against human corneal epithelial cells (HCECs). After co-incubation with HCECs, the density of RGD as well as peptide sequence in the hydrogels remarkably affected the cell attachment, spreadability, and proliferation. Additionally, the proposed hydrogel showed high ocular biocompatibility after being embedded subconjunctivally into rabbit eyes. Overall, these findings highlighted that the biofunctional hydrogels formed by PEG and RGD motifs via a controllable click reaction might be promising 3D cell scaffolds for corneal epithelial regeneration.",2022,Journal of materials chemistry. B,10.1039/d2tb00983h,A3_epithelium_limbus,1,Include,,epithelium_limbus,Medium,"Corrected include: title/abstract indicates corneal tissue engineering, biomaterial/scaffold, engineered construct, decellularized matrix, cell sheet, stem-cell construct, or regeneration/reconstruction relevance.",3,scaffold; hydrogel; corneal epithelial; epithelial cell; epithelial regeneration; rabbit; rat,Add to core candidate,Add to epithelium/limbus core,Clear epithelial/limbal tissue-engineering scaffold/carrier/cell-sheet signal with reconstruction or regeneration relevance.,7,strong reconstruction/regeneration relevance; scaffold/carrier/material present; translational or in vivo evidence,Top-tier core addition
PUBMED_0630,36736434,Clinical Trial of Autologous Cultivated Limbal Epithelial Cell Sheet Transplantation for Patients with Limbal Stem Cell Deficiency.,"PURPOSE: To confirm the efficacy and safety of Good Manufacturing Practice (GMP)-compliant autologous cultivated limbal epithelial cell sheets in government-controlled clinical trials that adhered to Good Clinical Practice stipulations for patients with unilateral limbal stem cell deficiency (LSCD). DESIGN: A prospective, multicenter, open-label, uncontrolled, single-arm clinical trial. PARTICIPANTS: Ten consecutive eyes of 10 patients with unilateral LSCD were followed for 2 years after surgery. Preoperative LSCD stage was IIB in 4 eyes and III in 6 eyes. METHODS: A limbal tissue biopsy was obtained from the healthy eye, after which limbal stem cells were dissociated and cultivated on temperature-responsive culture surfaces. All cell sheets were fabricated in a GMP-grade facility under established standard operating procedures. Cell sheets were evaluated using defined shipment criteria before transplantation, and only those that met the criteria were used. The cell sheet was transplanted onto each of the patients' diseased eye after removing the conjunctival scar tissue that covered the corneal surface. The severity of LSCD was determined according to a staging method agreed on by global consensus, with eyes evaluated as being in stages IA-C representing successful corneal epithelial reconstruction. Diagnosis and staging of LSCD were determined by the trial's Eligibility Judgment Committee and Effect Assessment Committee using slit-lamp photographs including fluorescein staining. Both committees comprised 2 or 3 third-party cornea specialists, who were provided with information anonymously and randomly. MAIN OUTCOME MEASURE: Corneal epithelial reconstruction rate was the primary end point. RESULTS: Corneal epithelial reconstruction was successful in 6 of 10 eyes (60%) 1 year postoperatively and was significantly higher than the 15% clinically significant efficacy rate achieved by allogeneic limbal transplantation. The reconstruction rate was 70% of eyes 2 years postoperatively. Additionally, improvements in visual acuity were noted in 50% and 60% of eyes at 1 and 2 years, respectively. No clinically significant transplantation-related adverse events were observed. CONCLUSIONS: The efficacy and safety of cultivated limbal epithelial cell sheet transplantation were thus confirmed, and the cell sheet, named ""Nepic,"" is now approved as a cellular and tissue-based product in Japan. FINANCIAL DISCLOSURE(S): Proprietary or commercial disclosure may be found after the references. FINANCIAL DISCLOSURE(S): Proprietary or commercial disclosure may be found after the references.",2023,Ophthalmology,10.1016/j.ophtha.2023.01.016,A3_epithelium_limbus,1,Include,,epithelium_limbus,Medium,"Corrected include: title/abstract indicates corneal tissue engineering, biomaterial/scaffold, engineered construct, decellularized matrix, cell sheet, stem-cell construct, or regeneration/reconstruction relevance.",3,sheet; construct; corneal epithelial; limbal; limbal stem; rat; transplantation; clinical,Add to core candidate,Add to epithelium/limbus core,Clear epithelial/limbal tissue-engineering scaffold/carrier/cell-sheet signal with reconstruction or regeneration relevance.,7,strong reconstruction/regeneration relevance; cell-sheet/cultivated epithelial construct present; translational or in vivo evidence,Top-tier core addition
PUBMED_0671,37273984,Personalized 3D-printed amniotic fornical ring for ocular surface reconstruction.,"In the present work, we used three-dimensional (3D) printing technology to make a polylactic acid (PLA) amniotic fornical ring (AFR) for ocular surface reconstruction. This work is a retrospective and interventional case series of patients with ocular surface diseases who underwent either personalized 3D-printed AFR-assisted amniotic membrane transplantation (AMT) or sutured AMT (SAMT). Patient epidemiology, treatment, operative duration, epithelial healing time, retention time, vision changes, morbidity, and costs were analyzed. Thirty-one patients (40 eyes) and 19 patients (22 eyes) were enrolled in the 3D-printed AFR group and the SAMT group, respectively. The clinical indications of AFR and SAMT were similar, such as corneal and/or conjunctival epithelial defects due to chemical burns, thermal burns, Stevens-Johnson syndrome (SJS), or toxic epidermal necrolysis (TEN). The mean dissolution time was 15 ± 11 days in the AFR group, compared with 14 ± 7 days in the SAMT group. The percentage of healed corneal area was 90.91% (66.10%-100.00%) for AFR and 93.67% (60.23%-100.00%) for SAMT. The median time for corneal epithelial healing was 14 (7-75) days in the AFR group and 30 (14-55) days in the suture AMT group. There were no significant differences in the initial visual acuity, final visual acuity, or improvement in visual acuity between the two groups. The operation duration in the AFR group was significantly shorter than that in the SAMT group. Regarding the cost analysis, the average cost per eye in the AFR group was significantly lower than that in the SAMT group. Furthermore, 3D-printed and sterile AFR showed no obvious side effects on the eyes. Our results suggested that 3D-printed PLA scaffolds could be used as an AFR device for ocular surface disease. In addition, personalized 3D-printed AFR is superior to conventional AMT in operation duration and cost effectiveness, thereby reducing the financial burden on our health care system.",2023,International journal of bioprinting,10.18063/ijb.713,A3_epithelium_limbus,1,Include,,epithelium_limbus,Medium,"Corrected include: title/abstract indicates corneal tissue engineering, biomaterial/scaffold, engineered construct, decellularized matrix, cell sheet, stem-cell construct, or regeneration/reconstruction relevance.",3,scaffold; membrane; construct; corneal epithelial; ocular surface; rat; transplantation; clinical,Add to core candidate,Add to epithelium/limbus core,Clear epithelial/limbal tissue-engineering scaffold/carrier/cell-sheet signal with reconstruction or regeneration relevance.,7,strong reconstruction/regeneration relevance; scaffold/carrier/material present; translational or in vivo evidence,Top-tier core addition
PUBMED_0694,37486330,Plasma fibrin membranes loaded with bone marrow mesenchymal stem cells and corneal epithelial cells promote corneal injury healing via attenuating inflammation and fibrosis after corneal burns.,"The shortage of corneal donors has prompted the development of tissue-engineered corneal grafts as an alternative solution. Currently, amniotic membranes with good biocompatibility are widely used as scaffolds for loading stem cells in the treatment of corneal injury. However, this approach has its limitations. In this study, BMSCs were induced to differentiate into corneal epithelial cells via direct contact co-culture, and platelet-poor plasma was used to prepare fibrin gels, which were compressed to remove excess liquid and then lyophilized to obtain plasma fibrin membranes (PFMs). A tissue-engineered corneal implant with PFMs as a scaffold loaded with BMSCs and corneal epithelial cells was designed and obtained. Scanning electron microscopy showed that PFMs have a uniformly distributed microporous surface that facilitates cell attachment and nutrient transport. The rheological results showed that the freeze-dried and rehydrated PFMs were more rigid than fresh membranes, which makes it easier to use them for transplantation after cell loading. The experimental results of a rat alkali burn cornea injury model showed that PFMs effectively reduced the inflammatory reaction, inhibited fibrosis, and accelerated the healing of corneal wounds. It was also found that some of the BMSCs were successfully implanted into the corneal injury site in rats and differentiated into corneal epithelial cells. These results demonstrate the potential of tissue-engineered corneal implants using BMSCs and corneal epithelial cells and PFMs as scaffolds as a new treatment option for corneal injury.",2023,Biomaterials science,10.1039/d3bm00713h,A3_epithelium_limbus,1,Include,,epithelium_limbus,Medium,"Corrected include: title/abstract indicates corneal tissue engineering, biomaterial/scaffold, engineered construct, decellularized matrix, cell sheet, stem-cell construct, or regeneration/reconstruction relevance.",3,scaffold; membrane; amniotic membrane; corneal epithelial; epithelial cell; rat; transplantation,Add to core candidate,Add to epithelium/limbus core,Clear epithelial/limbal tissue-engineering scaffold/carrier/cell-sheet signal with reconstruction or regeneration relevance.,7,strong reconstruction/regeneration relevance; scaffold/carrier/material present; translational or in vivo evidence,Top-tier core addition
PUBMED_0832,39425087,Comparative evaluation of autologous tissue-engineered ocular and oral mucosal tissue grafts- a prospective randomized controlled trial.,"BACKGROUND: Bilateral ocular surface disease resulting from Stevens Johnson Syndrome (SJS) and chemical injuries are visually debilitating and difficult to treat. Ocular surface reconstruction by various means has been reported with variable results. This study addresses an unmet need for a prospective clinical trial comparing the outcomes of transplanting autologous oral and conjunctival epithelial cell constructs on human amniotic membrane by ex vivo tissue engineering. METHODS: A prospective, randomized controlled clinical trial was prospectively applied for registration, with the clinical trial registry of India (CTRI), with the approval of the Institute Ethics Committee number IEC/NP-99/11.04.2014 and CTRI No. REF/2018/10/021791, the study also registered with the WHO-recognized trial registry, International Standard Randomised Controlled Trial Number (ISRCTN) registration reference number 45780. The study was conducted to compare clinical outcomes of two different tissue-engineered cell grafts, Cultivated Oral Mucosal Epithelial Transplantation (COMET) and Conjunctival Cultivated Epithelial Transplantation (CCET) for ocular surface reconstruction in patients with bilateral ocular surface disease due to Stevens-Johnson Syndrome or chemical injuries. Fifty patients were enrolled and randomized to either the COMET or CCET group. A uniform pre-op and post-op protocol using standard medications was followed for all patients Parameters assessed at baseline, day 1, 1 week, 2 weeks, 1 month, 2 months, 3 months and 6 months postoperatively included patient comfort, best corrected visual acuity (BCVA), ocular surface status and corneal clarity. The efficacy was measured in terms of improvement of vision, reduction in vascularization, symblepharon and corneal clarity. RESULTS: In the study, 50 patients (50 eyes; mean ages of 29 ± 15.86 years and 26.36 ± 10.85 years, respectively; range, 12-65 years) were enrolled, with 25 patients each in the COMET and CCET groups. Out of them, 36% were female and 64% were male; the causes were Steven Johnson syndrome (48), and chemical injury (2). Mean pre-operative BCVA was log MAR 1.73 ± 0.57 for COMET and 1.99 ± 0.33 for the CCET group. Pre-operatively all 50 enrolled patients had opaque corneas pre-operatively, symblepharon that extended to the cornea categorised as grade 3 and corneal vascularization that went beyond the pupil's boundary into the central zone encluaching on the visual axis. The minimal follow-up time was six months. Following surgery postoperatively, the BCVA considerably improved in the COMET group by 1.51 ± 0.58 compared to the CCET group by 1.91 ± 0.33 at 3 months. BCVA at 6 months was 1.73 ± 0.56 in the COMET group and 1.99 ± 0.31 in the CCET group, which is not statistically significant and comparable to the BCVA before surgery. The corneal clarity was significantly improved in COMET group 25 eye (100%) at 2 month, 3month and 19 eye (76%), 6eye (24%) at 6 months when compared to CCET group 15 eye improved (60%), 9 eyes (36%) not improved and one eye with opaque cornea (4%) at 2 months. 22 eye (88%) had not improved, 2 eye (8%) opaque cornea and 1 eye (4%) improved at 3 months. At 6 months 21 eye (84%) were not improved, 4 eye (16%) eye became opaqued at 6 months. Compared to preoperative conditions, both groups had improved corneal clarity significantly (p > 0.005). Of the 50 patients with grade 3 symblepharon extended to the cornea, were completely resolved 19 (76%) in COMET group when compared to CCET group 22 eye (88%) not improved. Similarly, 19 eye (76%) had a improvement in corneal vascularization when compared to the CCET group not improved 25 eye (100%) at 6months. No adverse event was observed in any of either group during the follow up periods. CONCLUSION: Both cell types are effective to restore the ocular surface integrity in bilateral ocular surface disease. Whereas COMET is safe and efficacious in terms of improvement of clinical parameters including, BCVA, corneal clarity, reduction in vascularization and preventing the recurrence of symblepharon postoperatively 3months and 6 months. In addition, the CCET group maintained the stability of the ocular surface and had improvement in corneal clarity and a decrease in vascularization at 3 months compared to their pre-operative characteristics.",2024,BMC biotechnology,10.1186/s12896-024-00876-z,A3_epithelium_limbus,1,Include,,epithelium_limbus,Medium,"Corrected include: title/abstract indicates corneal tissue engineering, biomaterial/scaffold, engineered construct, decellularized matrix, cell sheet, stem-cell construct, or regeneration/reconstruction relevance.",3,membrane; construct; amniotic membrane; ocular surface; epithelial cell; rat; ex vivo; transplantation,Add to core candidate,Add to epithelium/limbus core,Clear epithelial/limbal tissue-engineering scaffold/carrier/cell-sheet signal with reconstruction or regeneration relevance.,7,strong reconstruction/regeneration relevance; scaffold/carrier/material present; translational or in vivo evidence,Top-tier core addition
PUBMED_0833,39429339,Surgical Technique for Oral Mucosa Harvesting in Autologous Cultivated Oral Mucosal Epithelial Cell Transplantation for Ocular Surface Disorders.,"Ex vivo cultivated oral mucosal epithelial cell transplantation (COMET) was first introduced in Japan in June 2021. This technique is used to treat limbal stem cell deficiency (LSCD). This article provides a detailed description of one of the most critical steps in COMET, which is the harvesting of oral mucosa, along with accompanying videos. The samples harvested using this method were successfully cultured into cell sheets, which were then used in surgical procedures without complications.",2024,Cureus,10.7759/cureus.69648,A3_epithelium_limbus,1,Include,,epithelium_limbus,Medium,"Corrected include: title/abstract indicates corneal tissue engineering, biomaterial/scaffold, engineered construct, decellularized matrix, cell sheet, stem-cell construct, or regeneration/reconstruction relevance.",3,sheet; limbal; limbal stem; lsc; ex vivo; transplantation,Add to core candidate,Add to epithelium/limbus core,Clear epithelial/limbal tissue-engineering scaffold/carrier/cell-sheet signal with reconstruction or regeneration relevance.,7,strong reconstruction/regeneration relevance; cell-sheet/cultivated epithelial construct present; translational or in vivo evidence,Top-tier core addition
