screening_id,pmid,title,abstract,year,journal,doi,sources,source_count,decision,exclusion_reason,corneal_layer,priority_level,screening_notes,epithelium_limbus_relevance_score,epithelium_limbus_relevance_terms,recommended_action,strict_epithelium_limbus_decision,strict_epithelium_limbus_reason,top_tier_score,top_tier_reason,top_tier_decision
PUBMED_0632,36772078,Detection of Limbal Stem Cells Adhered to Melt Electrospun Silk Fibroin and Gelatin-Modified Polylactic Acid Scaffolds.,"Limbal stem cells (LSCs) are of paramount importance in corneal epithelial tissue repair. The cornea becomes opaque in case of limbal stem cell deficiency (LSCD), which may cause serious damage to the ocular visual function. There are many techniques to restore damaged epithelium, one of which is the transplantation of healthy cultured LSCs, usually onto a human amniotic membrane or onto bio-based engineered scaffolds in recent years. In this study, melt electrospun polylactic acid (PLA) was modified by silk fibroin or gelatin and further cultured with LSCs originating from three different donors. In terms of physicochemical properties, both modifications slightly increased PLA scaffold porosity (with a significantly larger pore area for the PLA/gelatin) and improved the scaffolds' swelling percentage, as well as their biodegradation rate. In terms of the scaffold application function, the aim was to detect/visualize whether LSCs adhered to the scaffolds and to further determine cell viability (total number), as well as to observe p63 and CK3 expressions in the LSCs. LSCs were attached to the surface of microfibers, showing flattened conformations or 3D spheres in the formation of colonies or agglomerations, respectively. All scaffolds showed the ability to bind the cells onto the surface of individual microfibers (PLA and PLA/gelatin), or in between the microfibers (PLA/silk fibroin), with the latter showing the most intense red fluorescence of the stained cells. All scaffolds proved to be biocompatible, while the PLA/silk fibroin scaffolds showed the highest 98% viability of 2.9 × 10(6) LSCs, with more than 98% of p63 and less than 20% of CK3 expressions in the LSCs, thus confirming the support of their growth, proliferation and corneal epithelial differentiation. The results show the potential of these bio-engineered scaffolds to be used as an alternative clinical approach.",2023,Polymers,10.3390/polym15030777,A3_epithelium_limbus,1,Include,,epithelium_limbus,Medium,"Corrected include: title/abstract indicates corneal tissue engineering, biomaterial/scaffold, engineered construct, decellularized matrix, cell sheet, stem-cell construct, or regeneration/reconstruction relevance.",4,scaffold; membrane; amniotic membrane; corneal epithelial; limbal; limbal stem; p63; k3; cell viability; rat; transplantation; clinical,Add to core candidate,Add to epithelium/limbus core,Clear epithelial/limbal tissue-engineering scaffold/carrier/cell-sheet signal with reconstruction or regeneration relevance.,8,strong reconstruction/regeneration relevance; scaffold/carrier/material present; translational or in vivo evidence; extractable benchmark markers likely,Top-tier core addition
PUBMED_0819,39298836,Phytic acid-loaded polyvinyl alcohol hydrogel promotes wound healing of injured corneal epithelium through inhibiting ferroptosis.,"As the important barrier of intraocular tissue, cornea is easy to suffer various kinds of injuries. Among them, acute alkali burn is a thorny ophthalmic emergency event, which can lead to corneal persistent epithelial defects, ulcers, and even perforation. Ferroptosis, a mode of regulatory cell death, has been found to play a key role in the process of corneal alkali burn, of which lipid peroxidation and intracellular iron levels are considered to be the possible therapeutic targets. To seek new effective treatments, the study herein focused on the occurrence of oxidative stress and ferroptosis in corneal alkali burn, exploring the role of phytic acid (PA), a natural small molecule with both antioxidant and iron chelating capacity, in the repair of corneal epithelial injury. The in vivo therapeutic results showed that PA eyedrops treatment promoted the recovery of corneal morphology and function, and in vitro experiments proved that PA prompted the repair of oxidative stress induced-corneal epithelial injury through ferroptosis inhibition. In addition, better drug treatment effect could be achieved through hydrogel delivery and sustained release, and our in vivo experiments showed the superior therapeutic effects of PA delivered by PVA hydrogels with larger molecular weights on corneal injury. In summary, this study demonstrated the excellent effect of natural small molecule PA with antioxidant and high efficiency chelating ferrous ions on ferroptosis inhibition, and showed the outstanding application prospect of PVA/PA hydrogels in the treatment of corneal epithelial injury.",2024,Redox biology,10.1016/j.redox.2024.103354,A3_epithelium_limbus,1,Include,,epithelium_limbus,Medium,"Corrected include: title/abstract indicates corneal tissue engineering, biomaterial/scaffold, engineered construct, decellularized matrix, cell sheet, stem-cell construct, or regeneration/reconstruction relevance.",4,hydrogel; corneal epithelial; corneal epithelium; wound healing; barrier; rat; in vivo,Add to core candidate,Add to epithelium/limbus core,Clear epithelial/limbal tissue-engineering scaffold/carrier/cell-sheet signal with reconstruction or regeneration relevance.,8,strong reconstruction/regeneration relevance; scaffold/carrier/material present; translational or in vivo evidence; extractable benchmark markers likely,Top-tier core addition
PUBMED_0908,40168696,Decellularized human amniotic member hydrogel promotes limbal stem cells proliferation.,"Allogeneic cultured limbal epithelial stem cell transplantation has shown variable clinical success in treating limbal stem cell deficiency, low success cases are likely due to insufficient stem cell quantity or functional impairment. In this study, we engineered a decellularized amniotic membrane hydrogel (dAM-gel) using a freeze-thaw protocol designed to retain extracellular matrix integrity. Post-processing, collagen content decreased modestly from 313.50 ± 27.89 μg/mg to 284.8 ± 14.82 μg/mg (P = 0.08), while glycosaminoglycan levels shifted from 7.20 ± 1.66 μg/mg to 6.28 ± 0.55 μg/mg (P = 0.27). Crucially, the protocol achieved near-complete DNA removal (7.41 ± 0.78 μg/mg vs. 0.14 ± 0.06 μg/mg) (P < 0.0001), ensuring minimal immunogenicity. Although the dAM-gel demonstrates limited gelation capacity at lower concentrations, it achieves robust gelation at 14 mg/ml, completing the process within 28.26 ± 1.21 minutes. Furthermore, dAM-gel facilitates the migration and proliferation of limbal stem cells, particularly p63 + cells, which are known to correlate with the success of clinical treatments. A plausible explanation for this phenomenon is that dAM-gel contains a high concentration of agrin, which facilitates the proliferation of limbal stem cells while preserving their stemness via the Yap1-cyclin D1 signaling pathway. In conclusion, dAM-gel derived from amniotic membrane presents therapeutic promise for treating limbal stem cell deficiency by enhancing the proliferation of limbal stem cells while maintaining their stem cell phenotype.",2025,"Colloids and surfaces. B, Biointerfaces",10.1016/j.colsurfb.2025.114656,A3_epithelium_limbus,1,Include,,epithelium_limbus,Medium,"Corrected include: title/abstract indicates corneal tissue engineering, biomaterial/scaffold, engineered construct, decellularized matrix, cell sheet, stem-cell construct, or regeneration/reconstruction relevance.",4,membrane; hydrogel; amniotic membrane; limbal; limbal stem; p63; migration; rat; transplantation; clinical,Add to core candidate,Add to epithelium/limbus core,Clear epithelial/limbal tissue-engineering scaffold/carrier/cell-sheet signal with reconstruction or regeneration relevance.,8,strong reconstruction/regeneration relevance; scaffold/carrier/material present; translational or in vivo evidence; extractable benchmark markers likely,Top-tier core addition
PUBMED_0933,40444446,Chirality Regulates Stem Cell Fate and Promotes Corneal Epithelial Regeneration via Manipulating Notch Pathway.,"The differentiation and stemness maintenance of stem cells are the core topics in cell biology and regenerative medicine, involving cell fate determination, developmental regulation and tissue regeneration. Chirality is an essential factor influencing multiple biological processes, including protein interactions, stem cell development and disease pathogenesis. However, its roles in regulating stem cells fate, especially limbal epithelial stem cells (LESCs), remain elusive. Herein, it is first discovered that right-handed chiral hydrogel (DH) enhanced LESCs proliferation, migration, and differentiation into corneal epithelial cells, while left-handed chiral hydrogel (LH) can partially preserve LESCs stemness. Further in vivo experiments demonstrated that 3D DH effectively accelerated corneal wound healing process, inhibited both inflammation and vascularization in a partial limbal stem cell deficiency model. Mechanistically, DH activates Notch signaling by increasing its stereo-affinity to Notch1, facilitating Notch intracellular domain release and HES1 transcription, thereby directing LESCs fate. Collectively, this work highlights the novel role of chirality in LESCs fate determination and confirms DH as a drug-free, effective approach for corneal epithelial regeneration, offering a new direction for regenerative medicine and tissue engineering.",2025,"Advanced science (Weinheim, Baden-Wurttemberg, Germany)",10.1002/advs.202504732,A3_epithelium_limbus,1,Include,,epithelium_limbus,Medium,"Corrected include: title/abstract indicates corneal tissue engineering, biomaterial/scaffold, engineered construct, decellularized matrix, cell sheet, stem-cell construct, or regeneration/reconstruction relevance.",4,hydrogel; corneal epithelial; limbal; limbal stem; wound healing; migration; rat; in vivo,Add to core candidate,Add to epithelium/limbus core,Clear epithelial/limbal tissue-engineering scaffold/carrier/cell-sheet signal with reconstruction or regeneration relevance.,8,strong reconstruction/regeneration relevance; scaffold/carrier/material present; translational or in vivo evidence; extractable benchmark markers likely,Top-tier core addition
PUBMED_0937,40451552,"Topical delivery of cultivated limbal stem cells via porous photocurable hydrogel: A noninvasive, convenient, and efficient stem cells delivery strategy for limbal stem cell deficiency.","Topical administration of stem cells is one of the simplest approaches to stem cell-based therapy for limbal stem cell deficiency (LSCD). Without timely supplementation of deficient stem cells, LSCD may worsen, carrying a high risk of blindness in severe cases. However, challenges such as stem cell loss, poor cell attachment, short retention time, and phenotypic transformation of stem cells limit the efficiency of direct stem cell delivery. To address these problems, this study conducted in vitro and in vivo screenings of photocurable hydrogels and identified a porous Gelatin Methacryloyl (PG) hydrogel with larger pore sizes prepared by phase separation technology that satisfies four critical conditions: (i) encapsulating stem cells before delivery, (ii) maintaining the viability and self-renewal of stem cells via activation of the non-canonical Wnt signaling pathway, (iii) adhering uniformly to the ocular surface, and (iv) supporting stem cell proliferation, migration, and adhesion to the target interfaces. In a rabbit model of LSCD, the PG hydrogel loaded with cultivated limbal stem cells was applied to the ocular surface in combination with corneal bandage lenses, enabling a sutureless, non-invasive, convenient, and efficient stem cell delivery system. This innovative delivery strategy not only greatly simplified the existing process of limbal stem cell transplantation and significantly reduced surgery time, but also successfully overcame the challenges associated with direct stem cell eye drops. Most importantly, it promoted corneal injury repair, achieving avascular and scar-free corneal regeneration.",2025,Journal of controlled release : official journal of the Controlled Release Society,10.1016/j.jconrel.2025.113900,A3_epithelium_limbus,1,Include,,epithelium_limbus,Medium,"Corrected include: title/abstract indicates corneal tissue engineering, biomaterial/scaffold, engineered construct, decellularized matrix, cell sheet, stem-cell construct, or regeneration/reconstruction relevance.",4,hydrogel; limbal; limbal stem; lsc; migration; rabbit; rat; in vivo,Add to core candidate,Add to epithelium/limbus core,Clear epithelial/limbal tissue-engineering scaffold/carrier/cell-sheet signal with reconstruction or regeneration relevance.,8,strong reconstruction/regeneration relevance; scaffold/carrier/material present; translational or in vivo evidence; extractable benchmark markers likely,Top-tier core addition
PUBMED_0982,40995315,Development of a high-resolution three-dimensional optical coherence tomography for characterization of epithelial cell products for corneal cell therapy.,"PURPOSE: This study aimed to develop a high-resolution full-field optical coherence tomography (HR-FFOCT) system for automated three-dimensional (3D) imaging of cultivated epithelial cell sheets and biopsied tissue used in corneal regenerative therapy. MATERIALS AND METHODS: A commercial HR-FFOCT system (ApolloVue® S100, AMO, Taiwan), originally for dermatological imaging, was re-engineered for <2 μm resolution imaging of rabbit limbal and oral mucosal tissues for limbal stem cell deficiency treatment. Modifications included a piezoelectric transducer for precise Z-stack acquisition, customized LED illumination for registration, and a specialized platform for culture dishes. The system enabled en face and cross-sectional imaging with 3D reconstruction. Rabbit-derived products for cultivated limbal epithelial transplantation (CLET) and cultivated oral mucosal epithelial transplantation (COMET) were imaged before cultivation. Morphology, stratification, and protein expression were analyzed and validated with immunocytochemistry (ICC). RESULTS: The optimized system produced high-resolution en face and Z-stack images with accurate alignment, capturing stratified epithelial layers in CLET and oral mucosal tissue. Reconstructed 3D images revealed structural detail consistent with ICC-verified expression of junctional proteins, including occludin and actin. Both two-dimensional and 3D visualization of biopsied oral mucosal tissue was achieved. The system enabled noninvasive monitoring of epithelial sheet architecture and thickness without sectioning. CONCLUSION: The reconstructed HR-FFOCT system provides a noninvasive, real-time imaging platform for assessing epithelial cell sheets and biopsied tissue in corneal regenerative therapy. It offers potential for standardizing quality evaluation of cell-based products before transplantation and advancing translational applications in regenerative medicine.",2025,Taiwan journal of ophthalmology,10.4103/tjo.TJO-D-25-00087,A3_epithelium_limbus,1,Include,,epithelium_limbus,Medium,"Corrected include: title/abstract indicates corneal tissue engineering, biomaterial/scaffold, engineered construct, decellularized matrix, cell sheet, stem-cell construct, or regeneration/reconstruction relevance.",4,sheet; construct; limbal; limbal stem; epithelial cell; stratification; rabbit; rat; transplantation,Add to core candidate,Add to epithelium/limbus core,Clear epithelial/limbal tissue-engineering scaffold/carrier/cell-sheet signal with reconstruction or regeneration relevance.,8,strong reconstruction/regeneration relevance; cell-sheet/cultivated epithelial construct present; translational or in vivo evidence; extractable benchmark markers likely,Top-tier core addition
PUBMED_1029,41503585,Impact of Smoking on the Efficacy of Human Autologous Oral Mucosal Epithelial Cell Sheet Transplantation for Treating Limbal Stem Cell Deficiency.,"Limbal stem cell deficiency (LSCD) results from the loss or dysfunction of limbal stem cells, posing a significant challenge due to limited treatment options. Autologous oral mucosal epithelial cell (OMEC) sheet transplantation is an innovative therapy, but its effectiveness in smokers remains unclear. This study aims to investigate the impact of smoking on the efficacy of autologous OMEC sheet transplantation for LSCD and explores how acrolein, a major cigarette smoke component, affects the biological properties of these cells. This retrospective cohort study included 13 LSCD patients (13 eyes), divided into never smokers (seven eyes) and smokers (six eyes), all of whom received autologous OMEC sheet transplantation. The study compared colony-forming abilities and sheet thickness between the groups, assessed corneal epithelial repair postoperatively, and conducted in vitro experiments treating human OMECs (hOMECs) with acrolein. Evaluations focused on colony-forming ability, stem cell marker protein P63 expression, and the secretion of repair factors (transforming growth factor-beta [TGF-β], basic fibroblast growth factor [bFGF], and hepatocyte growth factor [HGF]) as well as the wound healing potential in human corneal epithelial cells. Postoperative results showed significant improvements in corneal epithelial defects, neovascularization, and best visual acuity in never smokers. However, adhesions recurred in both groups, with earlier recurrence in smokers. In vitro, acrolein significantly inhibited the proliferation of OMECs, reduced P63 expression, and decreased the secretion of TGF-β and HGF, though bFGF levels remained unchanged, impairing wound healing in scratched corneal epithelial cells. Smoking adversely affects the efficacy of autologous OMEC transplantation for LSCD, with acrolein as a potential key factor. Future research should focus on understanding the mechanisms by which smoking impacts OMECs and developing improved therapeutic strategies for smokers with LSCD. Trial Registration: ClinicalTrials.gov identifier: NCT03015779.",2026,Stem cells international,10.1155/sci/3769266,A3_epithelium_limbus,1,Include,,epithelium_limbus,Medium,"Corrected include: title/abstract indicates corneal tissue engineering, biomaterial/scaffold, engineered construct, decellularized matrix, cell sheet, stem-cell construct, or regeneration/reconstruction relevance.",4,sheet; corneal epithelial; limbal; limbal stem; wound healing; p63; rat; transplantation; clinical,Add to core candidate,Add to epithelium/limbus core,Clear epithelial/limbal tissue-engineering scaffold/carrier/cell-sheet signal with reconstruction or regeneration relevance.,8,strong reconstruction/regeneration relevance; cell-sheet/cultivated epithelial construct present; translational or in vivo evidence; extractable benchmark markers likely,Top-tier core addition
PUBMED_1071,42032346,Surface modified electrospun scaffold supports iPSC-derived limbal stem cell function.,"This study focuses on the development of an electrospun Poly Lactide-co-Glycolic Acid (PLGA) scaffold for ocular surface regeneration, specifically for the treatment of Limbal Stem Cell Deficiency (LSCD). The scaffold is designed to support the attachment, proliferation, and maintenance of induced pluripotent stem cell-derived limbal stem cells (iPSC-LSCs). To address the hydrophobic nature of PLGA and enhance biocompatibility, the scaffold surface was functionalized with extracellular matrix proteins, specifically Collagen IV and Laminin-521, through atmospheric plasma treatment. Micro-perforations were introduced using laser cutting to improve transparency and membrane permeability. Results indicate that Laminin-521 is essential for iPSC-LSC attachment and survival, with enhanced expression of LSC stemness markers and corneal epithelial differentiation markers observed on the functionalized scaffold. These findings suggest that this scaffold can serve as a viable platform for iPSC-LSC transplantation. Future work will focus on refining scaffold design parameters and conducting in vivo studies to assess therapeutic efficacy.",2026,npj biomedical innovations,10.1038/s44385-026-00066-w,A3_epithelium_limbus,1,Include,,epithelium_limbus,Medium,"Corrected include: title/abstract indicates corneal tissue engineering, biomaterial/scaffold, engineered construct, decellularized matrix, cell sheet, stem-cell construct, or regeneration/reconstruction relevance.",4,scaffold; membrane; collagen; corneal epithelial; limbal; limbal stem; transparency; rat; in vivo; transplantation,Add to core candidate,Add to epithelium/limbus core,Clear epithelial/limbal tissue-engineering scaffold/carrier/cell-sheet signal with reconstruction or regeneration relevance.,8,strong reconstruction/regeneration relevance; scaffold/carrier/material present; translational or in vivo evidence; extractable benchmark markers likely,Top-tier core addition
PUBMED_0131,30716697,Poly-l/dl-lactic acid films functionalized with collagen IV as carrier substrata for corneal epithelial stem cells.,"Limbal epithelial stem cells (LESCs) are responsible for the renewal of corneal epithelium. Cultivated limbal epithelial transplantation is the current treatment of choice for restoring the loss or dysfunction of LESCs. To perform this procedure, a substratum is necessary for in vitro culturing of limbal epithelial cells and their subsequent transplantation onto the ocular surface. In this work, we evaluated poly-L/DL-lactic acid 70:30 (PLA) films functionalized with type IV collagen (col IV) as potential in vitro carrier substrata for LESCs. We first demonstrated that PLA-col IV films were biocompatible and suitable for the proliferation of human corneal epithelial cells. Subsequently, limbal epithelial cell suspensions, isolated from human limbal rings, were cultivated using culture medium that did not contain animal components. The cells adhered significantly faster to PLA-col IV films than to tissue culture plastic (TCP). The mRNA expression levels for the LESC specific markers, K15, P63α and ABCG2 were similar or greater (significantly in the case of K15) in limbal epithelial cells cultured on PLA-col IV films than limbal epithelial cells cultured on TCP. The percentage of cells expressing the corneal (K3, K12) and the LESC (P63α, ABCG2) specific markers was similar for both substrata. These results suggest that the PLA-col IV films promoted LESC attachment and helped to maintain their undifferentiated stem cell phenotype. Consequently, these substrata offer an alternative for the transplantation of limbal cells onto the ocular surface.",2019,"Colloids and surfaces. B, Biointerfaces",10.1016/j.colsurfb.2019.01.054,A3_epithelium_limbus,1,Include,,epithelium_limbus,Medium,"Corrected include: title/abstract indicates corneal tissue engineering, biomaterial/scaffold, engineered construct, decellularized matrix, cell sheet, stem-cell construct, or regeneration/reconstruction relevance.",4,carrier; film; collagen; corneal epithelial; corneal epithelium; limbal; p63; k3; k12; rat; transplantation,Add to core candidate,Add to epithelium/limbus core,Clear epithelial/limbal tissue-engineering scaffold/carrier/cell-sheet signal with reconstruction or regeneration relevance.,7,scaffold/carrier/material present; cell-sheet/cultivated epithelial construct present; translational or in vivo evidence; extractable benchmark markers likely,Top-tier core addition
