screening_id,pmid,title,abstract,year,journal,doi,sources,source_count,decision,exclusion_reason,corneal_layer,priority_level,screening_notes,endothelium_relevance_score,endothelium_relevance_terms,recommended_action,strict_endothelium_decision,strict_endothelium_reason
PUBMED_0171,31258659,Ex vivo construction of rabbit corneal endothelial cell sheets on a porcine descemet membrane graft.,"The aim of the present study was to investigate the feasibility of a new graft construction method using rabbit corneal endothelial cells (RCECs) and a porcine descemet membrane (DM) carrier. RCECs were isolated and the experimental group was treated with Y-27632, whereas the control group were cultured in medium without Y-27632. RCEC morphology was observed using an inverted microscope, and cell proliferation and apoptosis were detected by flow cytometry. To confirm the presence of RCECs, reverse transcription-quantitative PCR was used to detect gene expression levels of Na+-K+-ATPase, aquaporin 1, collagen α(2) (IV), collagen α(1) (VIII) and keratin-12. Histocompatibility testing was used to detect porcine DM antigenicity. A DM-RCEC graft was constructed, and morphology was observed using alizarin red-trypan blue and haematoxylin and eosin staining. Cell membrane potential was measured to evaluate the physical function of the DM-RCEC graft. Complex graft tension was measured using a modified tension detector and compared with fresh porcine DM-endothelium complex. In vitro-cultured RCECs formed a monolayer with a polygon morphology and cobblestone-like arrangement. In vitro-cultured RCECs exhibited typical RCEC characteristics before and after transplantation. The proliferation rates of the experimental and control groups were 62.68 and 34.50%, respectively (P<0.05); the apoptosis rates of the experimental and control groups were 8.99 and 35.68%, respectively (P<0.05). There was no antigenicity observed with the porcine DM. The action potential amplitude of the experimental and control groups was over -80 mV, reflecting normal RCEC physiological function. The tension measurements of the experimental and control groups were 20.0248±1.048 and 20.5013±0.657 g, respectively (P>0.05). Taken together, the results of the present study demonstrated that Y-27632 enhanced RCEC proliferation. In addition, the findings revealed the successful ex vivo construction of a RCEC sheet on a porcine DM graft.",2019,Experimental and therapeutic medicine,10.3892/etm.2019.7573,C4_endothelium,1,Include,,endothelium,Medium,"Corrected include: title/abstract indicates corneal tissue engineering, biomaterial/scaffold, engineered construct, decellularized matrix, cell sheet, stem-cell construct, or regeneration/reconstruction relevance.",3,carrier; membrane; sheet; corneal endothelial cell; endothelial cells; monolayer; rabbit; transplantation,Add to core candidate,Add to endothelial core,Clear endothelial tissue-engineering biomaterial/carrier/scaffold signal with functional or translational relevance.
PUBMED_0349,33072921,Experimental design of a culture approach for corneal endothelial cells of New Zealand white rabbit.,"The harvesting of corneal endothelial cells (CEC) has received special attention due to its potential as a therapy for corneal blindness. The main challenges are related to the culture media formulation, cellular density at the primary isolation, and the number of passages in which CEC can retain their functional characteristics. To alternate different media formulations to harvest CEC has an impact on the cellular yield and morphology. Therefore, we analyzed four different sequences of growth factor-supplemented Stimulatory (S) and non-supplemented Quiescent (Q) media, upon passages to find the optimal S-Q culture sequence. We assessed cell yield, morphology, procollagen I production, Na(+)/K(+)-ATPase function, and the expression of ZO-1 and Na(+)/K(+)-ATPase. Our results show SQSQ and SQQQ sequences with a balance between an improved cell yield and hexagonal morphology rate. CEC cultured in the SQQQ sequence produced procollagen I, showed Na(+)/K(+)-ATPase function, and expression of ZO-1 and Na(+)/K(+)-ATPase. Our study sets a culture approach to guarantee CEC expansion, as well as functionality for their potential use in tissue engineering and in vivo analyses. Thus, the alternation of S and Q media improves CEC culture. SQQQ sequence demonstrated CEC proliferation and lower the cost implied in SQSQ sequences. We discarded the use of pituitary extract and ROCK inhibitors as essential for CEC proliferation.",2020,Heliyon,10.1016/j.heliyon.2020.e05178,C4_endothelium,1,Include,,endothelium,Medium,"Corrected include: title/abstract indicates corneal tissue engineering, biomaterial/scaffold, engineered construct, decellularized matrix, cell sheet, stem-cell construct, or regeneration/reconstruction relevance.",3,corneal endothelial cell; endothelial cells; na(+)/k(+)-atpase; zo-1; hexagonal; rabbit; in vivo,Add to core candidate,Exclude/background,Culture approach only; weak biomaterial/scaffold benchmarking signal.
PUBMED_0362,33259606,Collagen Remodeling Plays a Pivotal Role in Endothelial Corneal Dystrophies.,"PURPOSE: To elucidate the collagen structure in the Descemet membrane (DM) of the human cornea and to characterize its rearrangement in patients with endothelial corneal dystrophies. METHODS: Corneas from nine human donors and dystrophic DMs removed from 16 affected eyes of 13 patients by endothelial keratoplasty (DMEK) were investigated using a correlative RT-qPCR and label-free two-channel multiphoton microscopy (MPM) setup. Although collagen formation was visualized by second harmonic generation, the cellular structure was determined by autofluorescence. RESULTS: The DM of the human donor cornea was characterized by a consistent pattern of fine hexagonal collagen structures that form a supportive scaffold for the endothelial cells. Accordingly, network-forming collagens (8A1 and 8A2) but less fibrillar collagens (only 1A2) were expressed. DMEK resulted in significant (P < 0.0001) improvement of best-corrected visual acuity. In the removed dystrophic DMs, MPM analyses revealed collagen rearrangement in addition to loss of endothelial cells and the development of guttae. MPM analyses of the whole patient's DM demonstrated this collagen remodeling in its entirety and facilitated correlation to Scheimpflug corneal tomography. In most DMs a unique honeycomb collagen network was identified, with distinct bundles surrounding the guttae and correlating with expression of fibrillar collagens (1A1). Conversely, some DMs showed either reduced collagen on MPM and RT-qPCR analysis or diffuse thickening and storage of extracellular matrix. CONCLUSIONS: The collagen structure of the DM and its adaptive remodeling in endothelial corneal dystrophies has been characterized for the first time here and will facilitate individual therapeutic approaches.",2020,Investigative ophthalmology & visual science,10.1167/iovs.61.14.1,C4_endothelium,1,Include,,endothelium,Medium,"Corrected include: title/abstract indicates corneal tissue engineering, biomaterial/scaffold, engineered construct, decellularized matrix, cell sheet, stem-cell construct, or regeneration/reconstruction relevance.",3,scaffold; membrane; descemet; endothelial cells; hexagonal,Add to core candidate,Exclude/background,Disease/mechanistic collagen-remodeling paper; not a primary biomaterial engineering study.
PUBMED_0537,35358736,Construction of tissue-engineered human corneal endothelium for corneal endothelial regeneration using a crosslinked amniotic membrane scaffold.,"Descemet's membrane endothelial keratoplasty (DMEK) may provide fast visual rehabilitation in the therapy of corneal endothelial disorders. However, due to shortage of donated corneas, how to construct a corneal endothelial substitute with powerful functions that can be used for DMEK is still unsolved. Herein, we introduced the method of corneal crosslinking (CXL) and conjugated the components of native Descemet's membrane (DM) to improve the mechanical properties and the biocompatibility of denuded amniotic membrane (dAM), further assessed their effects on cell adhesion, proliferation, YAP translocation, and metabolic activity in human corneal endothelial (HCE) cells. Using modified crosslinked dAM (mcdAM) and non-transfected HCE cells, we constructed a tissue-engineered HCE (TE-HCE) and evaluated its functions in cat and monkey models as well. Our results showed that the mechanical properties of mcdAM were improved effectively by CXL, and the adhesion, proliferation, and YAP translocation of HCE cells were dose-dependently improved after ECM modification. The combination of 0.01 mg/mL laminin with 0.1 mg/mL fibronectin showed the highest efficacy. Then, the TE-HCE was constructed in vitro, with a high density of 3612 ± 243 cells/mm(2). Results of DMEK in animal models showed that corneal transparency was maintained, accompanied with normal morphology and histological structure of the regenerated corneal endothelium. Therefore, CXL combined with DM-mimic-coating methods could effectively improve the mechanical properties of dAM and enhance the biocompatibility with HCE cells. The constructed TE-HCE had normal histological structure and functioned well in animal models via DMEK, which could be used as a promising powerful equivalent of HCE. STATEMENT OF SIGNIFICANCE: Using high-quality corneal endothelium and an appropriate endothelial keratoplasty is the most effective way for the treatment of corneal endotheliopathy. Descemet's membrane endothelial keratoplasty (DMEK) which can provide better visual acuity, lower immunological rejection rates, and improved graft survival is an ideal surgery at present. However, due to the shortage of donated corneas, it is urgent to find an equivalent substitute of corneal endothelial donor which is suitable for the DMEK surgery to solve the problem of corneal endothelial regeneration. Herein, we introduced the clinical cornea-crosslinking and Descemet's membrane-mimic-coating methods to build the modified crosslinked denuded amniotic membrane scaffold and further constructed a high-quality corneal endothelial functional substitute that can be used in DMEK surgery.",2022,Acta biomaterialia,10.1016/j.actbio.2022.03.039,D3_full_thickness_multilayer,1,Include,,endothelium,Medium,"Corrected include: title/abstract indicates corneal tissue engineering, biomaterial/scaffold, engineered construct, decellularized matrix, cell sheet, stem-cell construct, or regeneration/reconstruction relevance.",3,scaffold; membrane; descemet; transparency; monkey; clinical; surgery,Add to core candidate,Add to endothelial core,Clear endothelial tissue-engineering biomaterial/carrier/scaffold signal with functional or translational relevance.
PUBMED_0649,37023465,In Vitro Profiling of the Extracellular Matrix and Integrins Expressed by Human Corneal Endothelial Cells Cultured on Silk Fibroin-Based Matrices.,"Developing a scaffold for culturing human corneal endothelial (HCE) cells is crucial as an alternative cell therapeutic approach to bridge the growing gap between the demand and availability of healthy donor corneas for transplantation. Silk films are promising substrates for the culture of these cells; however, their tensile strength is several-fold greater than the native basement membrane which can possibly influence the dynamics of cell-matrix interaction and the extracellular matrix (ECM) secreted by the cells in long-term culture. In our current study, we assessed the secretion of ECM and the expression of integrins by the HCE cells on Philosamia ricini (PR) and Antheraea assamensis (AA) silk films and fibronectin-collagen (FNC)-coated plastic dishes to understand the cell-ECM interaction in long-term culture. The expression of ECM proteins (collagens 1, 4, 8, and 12, laminin, and fibronectin) on silk was comparable to that on the native tissue. The thicknesses of collagen 8 and laminin at 30 days on both PR (4.78 ± 0.55 and 5.53 ± 0.51 μm, respectively) and AA (4.66 ± 0.72 and 5.71 ± 0.61 μm, respectively) were comparable with those of the native tissue (4.4 ± 0.63 and 5.28 ± 0.72 μm, respectively). The integrin expression by the cells on the silk films was also comparable to that on the native tissue, except for α3 whose fluorescence intensity was significantly higher on PR (p ≤ 0.01) and AA (p ≤ 0.001), compared to that on the native tissue. This study shows that the higher tensile strength of the silk films does not alter the ECM secretion or cell phenotype in long-term culture, confirming the suitability of using this material for engineering the HCE cells for transplantation.",2023,ACS biomaterials science & engineering,10.1021/acsbiomaterials.2c01566,C4_endothelium,1,Include,,endothelium,Medium,"Corrected include: title/abstract indicates corneal tissue engineering, biomaterial/scaffold, engineered construct, decellularized matrix, cell sheet, stem-cell construct, or regeneration/reconstruction relevance.",3,scaffold; substrate; membrane; corneal endothelial cell; endothelial cells; transplantation,Add to core candidate,Add to endothelial core,Clear endothelial tissue-engineering biomaterial/carrier/scaffold signal with functional or translational relevance.
PUBMED_0739,38247948,U-Net Convolutional Neural Network for Real-Time Prediction of the Number of Cultured Corneal Endothelial Cells for Cellular Therapy.,"Corneal endothelial decompensation is treated by the corneal transplantation of donor corneas, but donor shortages and other problems associated with corneal transplantation have prompted investigations into tissue engineering therapies. For clinical use, cells used in tissue engineering must undergo strict quality control to ensure their safety and efficacy. In addition, efficient cell manufacturing processes are needed to make cell therapy a sustainable standard procedure with an acceptable economic burden. In this study, we obtained 3098 phase contrast images of cultured human corneal endothelial cells (HCECs). We labeled the images using semi-supervised learning and then trained a model that predicted the cell centers with a precision of 95.1%, a recall of 92.3%, and an F-value of 93.4%. The cell density calculated by the model showed a very strong correlation with the ground truth (Pearson's correlation coefficient = 0.97, p value = 8.10 × 10(-52)). The total cell numbers calculated by our model based on phase contrast images were close to the numbers calculated using a hemocytometer through passages 1 to 4. Our findings confirm the feasibility of using artificial intelligence-assisted quality control assessments in the field of regenerative medicine.",2024,"Bioengineering (Basel, Switzerland)",10.3390/bioengineering11010071,C4_endothelium,1,Include,,endothelium,Medium,"Corrected include: title/abstract indicates corneal tissue engineering, biomaterial/scaffold, engineered construct, decellularized matrix, cell sheet, stem-cell construct, or regeneration/reconstruction relevance.",3,corneal endothelial cell; hcec; endothelial cells; cell density; transplantation; clinical,Add to core candidate,Exclude/background,Software/cell counting method for cellular therapy; not a biomaterial benchmarking study.
PUBMED_0827,39386038,The time dependent influence of curvature and topography of biomaterials in the behavior of corneal endothelial cells.,"Among the different layers of the cornea, the corneal endothelium, which is composed of corneal endothelial cells (CEC), plays a key role in the maintenance of cornea transparency. Based on the donor shortages and the limitations associated with transplantation, in this work we have developed collagen hydrogels with different patterned structures on the surface to provide topographies in ranges similar to the natural environment that CEC sense. This aimed at stimulating cells to maintain a typical CEC phenotype and provide alternatives to corneal transplantation. In this sense, we have elaborated curved collagen hydrogels (concave and convex) with three different topographies (50, 200 and 300 µm grooves), with the help of 3D printed mold and replicating the mold with the collagen hydrogel, onto which CEC were cultured in order to analyze its behavior. Flat hydrogels were used as controls. Cell morphology, cell circularity and gene expression of ATP1A1 and ZO-1 genes were analyzed after 3 and 6 days. Results showed an effect of the curvature and the topography compared to flat collagen hydrogels, showing higher expression of ZO-1 and ATP1A1 in curved non-patterned hydrogels at day 3. The patterned hydrogels did not have such a significant effect on gene expression compared to flat hydrogels, showing stronger effect of the curvature compared to the topography. The effect was opposite at day 6, showing higher gene expression at days 6 on the patterned hydrogels, especially for the ZO-1 gene. The gene expression results were in accordance with the cell morphology observed at the different time points, showing circularities closer to hexagon like morphology at shorter time points. Overall, this platform can serve as a system to culture cell under proper environment to further be able to transplant a CEC monolayer or to allow transplantation of thin collagen layers with cultured CEC.",2024,Frontiers in bioengineering and biotechnology,10.3389/fbioe.2024.1454675,C4_endothelium,1,Include,,endothelium,Medium,"Corrected include: title/abstract indicates corneal tissue engineering, biomaterial/scaffold, engineered construct, decellularized matrix, cell sheet, stem-cell construct, or regeneration/reconstruction relevance.",3,corneal endothelial cell; endothelial cells; monolayer; zo-1; transparency; transplantation,Add to core candidate,Add to endothelial core,Clear endothelial tissue-engineering biomaterial/carrier/scaffold signal with functional or translational relevance.
PUBMED_1014,41356124,ECM stiffness governs endothelial barrier integrity through YAP-mediated stabilization of ZO-1.,"The integrity of intercellular junctions is essential for maintaining tissue barriers and preventing pathological fluid leakage. While reduced extracellular matrix (ECM) stiffness has emerged as a biomechanical trigger for barrier dysfunction, the underlying mechanotransduction mechanisms remain poorly understood. In this study, employing tunable polyacrylamide hydrogels to model physiological and pathological ECM stiffness, we demonstrate that matrix softening occurs earlier than morphological changes in corneal endothelial cells (CEnCs) and triggers junctional disassembly by impairing the membrane localization and stability of the tight junction protein ZO-1. Mechanistically, we uncover a novel non-canonical role for YAP in binding and stabilizing ZO-1, thereby shielding it from ubiquitin-proteasome degradation. Furthermore, we elucidate a synergistic interplay between FAK and Hippo signaling pathways, which converges on YAP to modulate junctional integrity in response to ECM stiffness. Computational modeling further elucidates the spatiotemporal dynamics of stress propagation during ECM softening, providing a biomechanical framework for intercellular gap formation and cell detachment. Collectively, these results establish matrix stiffness as a pivotal modulator of cell-cell junctions, yielding fresh perspectives for harnessing engineered biomaterials in the fabrication of robust tissue barriers.",2026,Bioactive materials,10.1016/j.bioactmat.2025.10.029,C4_endothelium,1,Include,,endothelium,Medium,"Corrected include: title/abstract indicates corneal tissue engineering, biomaterial/scaffold, engineered construct, decellularized matrix, cell sheet, stem-cell construct, or regeneration/reconstruction relevance.",3,membrane; corneal endothelial cell; endothelial cells; zo-1; barrier,Add to core candidate,Exclude/background,Mechanistic ECM stiffness/barrier paper; not clearly a corneal biomaterial scaffold/implant study.
PUBMED_0057,29698634,Function-Related Protein Expression in Fuchs Endothelial Corneal Dystrophy Cells and Tissue Models.,"Fuchs endothelial corneal dystrophy (FECD) is a corneal pathology that affects the endothelial cell's ability to maintain deturgescence, resulting in a progressive loss of corneal transparency. In this study, we investigated the expression of function-related proteins in corneal endothelial cells using FECD or healthy corneal endothelial cells, either in a cell culture two-dimensional model or in an engineered corneal endothelium three-dimensional tissue model. No statistically significant difference in gene regulation was observed for the function-related families ATP1, SLC4, SLC16, AQP, TJP, and CDH between the FECD and the healthy cell models. Similarly, no difference in barrier integrity (transendothelial electrical resistance measurements and permeability assays) was observed in vitro between FECD and healthy cultured cells. Protein expression of the key function-related families was decreased for Na(+)/K(+)-ATPase α1 subunit, monocarboxylate transporters 1 and 4 in native ex vivo end-stage FECD specimens, whereas it returned to levels comparable to that of healthy tissues in the engineered FECD model. These results indicate that cell expansion and tissue engineering culture conditions can generate a corneal endothelium from pathologic FECD cells, with levels of function-related proteins similar to that of healthy tissues. Overall, these results explain why it is possible to reform a functional endothelium using corneal endothelial cells isolated from nonfunctional FECD pathologic specimens.",2018,The American journal of pathology,10.1016/j.ajpath.2018.03.014,C4_endothelium,1,Include,,endothelium,Medium,"Corrected include: title/abstract indicates corneal tissue engineering, biomaterial/scaffold, engineered construct, decellularized matrix, cell sheet, or regeneration/reconstruction relevance.",2,corneal endothelial cell; endothelial cells; cell culture; na(+)/k(+)-atpase; barrier; transparency,Manual check,Exclude/background,Insufficient scaffold/carrier/endothelial tissue-engineering benchmarking signal.
PUBMED_0094,30234679,Development of Cell Analysis Software to Evaluate Fibroblastic Changes in Cultivated Corneal Endothelial Cells for Quality Control.,"PURPOSE: To develop software to evaluate the fibroblastic morphological changes in cultured human corneal endothelial cells (HCECs) as a quality control measure for use in tissue engineering therapy. METHODS: Software was designed to recognize cell borders, to approximate cell shape as an ellipse, and to calculate the aspect ratio of the ellipse as an indicator of severity of the fibroblastic morphological change. Using the designed software, 60 phase contrast images of polygonal HCECs and 60 phase contrast images of fibroblastic HCECs were analyzed. The correlations of the aspect ratio and other parameters (cell density, percentage of cells surrounded by 6 cells, and coefficient of variation) were evaluated. RESULTS: Cell shapes were recognized based on phase contrast images and were approximated as ellipses by software. The average aspect ratio was significantly higher (34.9% ± 6.1%) in fibroblastic HCECs than in polygonal HCECs (24.4% ± 2.3%) (P < 0.01). The aspect ratio showed a correlation with cell density, with the percentage of cells surrounded by 6 neighboring cells, and with the coefficient of variation (Pearson correlation coefficients, -0.84, -0.38, and 0.66, respectively). CONCLUSIONS: We propose that fibroblastic alteration of HCECs can be evaluated by the cell morphology based on the aspect ratio. Software developed in this study, which can analyze the frequency and severity of fibroblastic alteration, will be useful for nondestructive assessment of cells destined for use in cell-based therapy for corneal endothelial decompensation.",2018,Cornea,10.1097/ICO.0000000000001757,C4_endothelium,1,Include,,endothelium,Medium,"Corrected include: title/abstract indicates corneal tissue engineering, biomaterial/scaffold, engineered construct, decellularized matrix, cell sheet, or regeneration/reconstruction relevance.",2,corneal endothelial cell; hcec; endothelial cells; cell density,Manual check,Exclude/background,Insufficient scaffold/carrier/endothelial tissue-engineering benchmarking signal.
