screening_id,pmid,year,journal,doi,_layer,biomaterial_category,specific_materials,fabrication_method,cell_type_used,cell_source,optical_transparency_reported,mechanical_testing_reported,biological_testing_reported,in_vitro_model,ex_vivo_model,animal_model,clinical_evidence,translational_readiness_level,benchmarking_relevance,main_outcomes,main_limitations,evidence_verification_level
PUBMED_0152,30995622,2019,Biofabrication,10.1088/1758-5090/ab1a8b,stroma,"decellularized extracellular matrix (dECM) bioink, 3D-printed",corneal stroma-derived decellularized extracellular matrix (dECM) bioink,"3D cell printing technique inducing controlled shear stress (via variable printing nozzle size) on a corneal stroma-derived dECM bioink to drive shear-induced alignment of collagen fibrils, recapitulating the native lattice microarchitecture of corneal stroma","not specified by type in the abstract summary (bioink is cell-laden per 3D 'cell printing' terminology, but specific cell type/source not given in abstract text retrieved)",not specified in abstract,yes,partial,yes,yes,no,yes,no,"preclinical (animal model, 4-week follow-up)",high,"A 3D-cell-printing technique using shear stress (via printing nozzle size) on corneal stroma-derived dECM bioink produced a transparent, highly matured corneal stroma analog with native-like aligned, lattice-patterned collagen fibrils and high cellular alignment; after 4 weeks in vivo, the printed construct remodeled into a collagen fibril lattice pattern resembling native human cornea, demonstrating feasibility of engineering structurally and optically native-mimetic corneal stroma tissue via bioprinting.",Animal species and specific cell type/source used for the in vivo 4-week evaluation and bioink not specified in the retrieved abstract text; no quantitative transparency (transmittance) or tensile mechanical values reported; long-term (beyond 4 weeks) durability and functional integration not addressed in abstract.,abstract_only
PUBMED_0273,32368948,2020,Tissue engineering. Part A,10.1089/ten.TEA.2020.0019,stroma,"decellularized xenogeneic (porcine) sheet / hydrogel composite, bottom-up multilayer assembly","decellularized porcine corneal sheets (cryosectioned lenticules, detergent-decellularized, air-dried) layered with cell-laden collagen type I hydrogel between sheets; human corneal stromal cells encapsulated in the collagen I hydrogel; human corneal epithelial cells seeded on the surface of a subset of constructs","corneal lenticules cut from porcine corneas by cryosectioning, then decellularized using detergents and air-dried for storage as thin sheets; human corneal stromal cells encapsulated in collagen I hydrogel and cast between multiple stacked decellularized porcine sheets using a novel bottom-up layering assembly technique to achieve high, uniform cellularity throughout the construct; constructs cultured 2 weeks in serum-free medium with ascorbic acid and insulin; epithelial cells then seeded on the surface and cultured an additional week; constructs without epithelial cells sutured onto an ex vivo porcine cornea and cultured 1 week to test surgical integration",human corneal stromal cells (encapsulated in hydrogel) and human corneal epithelial cells (surface-seeded on a subset of constructs),"human (corneal stromal and epithelial cells); porcine (decellularized sheet material, acellular)",yes,partial,yes,yes,yes,no,no,early preclinical (in vitro / ex vivo),high,"A novel bottom-up multilayer assembly technique -- alternating decellularized porcine corneal sheets with cell-laden collagen I hydrogel -- achieved rapid, uniform recellularization (dsDNA reduced to 13 ng/mg dry tissue) with a keratocyte-like phenotype (upregulated keratocan, decorin, lumican, collagen I, ALDH3A1, CD34) and stratified corneal epithelium; the resulting corneal stromal equivalent was surgically suturable without tearing, integrated with host tissue and was covered by host-derived neoepithelium after 1 week ex vivo on porcine corneas, demonstrating feasibility of a simple, rapid, tissue-derived-only approach to anterior corneal substitute fabrication.","Ex vivo porcine cornea integration testing only, no live animal or human clinical evaluation; xenogeneic (porcine) sheet component carries immunogenicity considerations; no quantitative transmittance or tensile mechanical values given in the retrieved abstract despite characterization being described; short (1-week) ex vivo integration follow-up.",abstract_only
PUBMED_0344,33028837,2020,Scientific reports,10.1038/s41598-020-72978-5,stroma,chemically crosslinked natural-polymer in situ-forming hydrogel,collagen type I hydrogel crosslinked in situ via multi-functional polyethylene glycol (PEG)-N-hydroxysuccinimide (NHS) chemistry,"collagen type I mixed with multi-arm PEG-NHS crosslinker; hydrogel forms under ambient conditions within minutes upon mixing, without external catalyst, light, or heat trigger; transparency, degradability, and stiffness tuned by varying number of PEG arms and PEG concentration; applied directly in situ over stromal keratectomy wounds in vivo without sutures",corneal epithelial cells and corneal stromal cells (in vitro migration/proliferation assays); host-derived cells only in vivo (no exogenous cell seeding for in vivo arm),"not fully specified in abstract (species of in vitro epithelial/stromal cells not given); in vivo arm uses host rabbit-derived repopulation, no exogenous cells implanted",yes,yes,yes,yes,no,yes,no,"preclinical (animal model, rabbit)",high,"A suture-free, in situ-forming PEG-NHS-crosslinked collagen hydrogel formed rapidly (minutes) under ambient conditions without external trigger, with tunable transparency, stiffness, and degradability via PEG arm number/concentration; it supported corneal epithelial and stromal cell migration/proliferation in vitro, and when applied without sutures over rabbit stromal keratectomy wounds in vivo, supported multi-layered surface epithelialization -- positioning it as a sutureless, trigger-free corneal stromal defect repair matrix.","No quantitative transmittance, modulus, or degradation-rate values given in the retrieved abstract despite qualitative tunability claims; in vivo follow-up duration and sample size not specified; no assessment of long-term integration, scarring/haze, or biomechanical suture-retention strength; species/source of in vitro epithelial and stromal cells not specified.",abstract_only
PUBMED_0346,33037282,2020,Scientific reports,10.1038/s41598-020-73730-9,stroma,porous natural-polymer (collagen-based) hydrogel implant,porous collagen-based hydrogel designed to replace a substantial portion of damaged/diseased corneal stroma; drug-loaded variant incorporating a neuroregenerative drug for sustained local release,collagen-based hydrogel engineered for porosity to permit host cell migration/population while maintaining transparency and thickness; implanted using a novel hybrid surgical technique inspired by LASIK refractive surgery (flap-based implantation) rather than conventional lamellar keratoplasty; drug-loaded variant prepared and tested for in vitro sustained-release kinetics as proof-of-concept,not applicable / acellular implant (repopulation relies on host-derived stromal cells migrating into the porous matrix in vivo); no exogenous cells seeded prior to implantation,"not applicable / host-derived (in vivo repopulation by host stromal cells, nerves, and epithelium)",yes,partial,yes,yes,no,yes,no,preclinical (in vivo model with 6-month follow-up) with an in vitro drug-delivery proof-of-concept,high,"A porous collagen-based hydrogel, combined with a novel LASIK-inspired hybrid surgical implantation technique, maintained transparency and thickness six months after implantation in an in vivo model of human corneal surgery, supported host stromal cell repopulation and regeneration of host epithelium and corneal nerves, and as a drug-loaded variant achieved sustained slow-release delivery of a neuroregenerative agent in vitro -- together demonstrating translational potential for stromal tissue replacement and regeneration with an integrated local drug-delivery function.","No quantitative transmittance, modulus, or drug-release-kinetics values given in the retrieved abstract despite qualitative maintenance/sustained-release claims; specific in vivo model species/system for the '6-month' human corneal surgery model not fully detailed in the abstract (described as 'an in vivo model of human corneal surgery'); the neuroregenerative drug is not named; drug-loaded hydrogel tested only in vitro as proof-of-principle, not yet validated in vivo.",abstract_only
PUBMED_0388,33545838,2021,"Materials science & engineering. C, Materials for biological applications",10.1016/j.msec.2020.111673,stroma,"decellularized allogeneic (human donor, surgical-waste-derived) corneal matrix scaffold",allogeneic cornea-derived matrix (ACM) fabricated from human corneal tissue discarded during allogeneic corneal transplantation surgery (donor-tissue surgical waste reuse),discarded human corneal tissue from allogeneic transplantation surgery processed into ACM scaffolds; collagen and glycosaminoglycan (GAG) levels preserved during fabrication while DNA content significantly decreased; scanning electron microscopy used to characterize fiber-like surface structures and multiple interlaced lamellae in cross-section; recellularized in vitro with corneal epithelial cells and corneal stromal cells; ACM then implanted into rabbit corneal stromal pockets in vivo,corneal epithelial cells (for surface stratification) and corneal stromal cells (keratocyte-lineage) seeded on the ACM in vitro,"human (donor-tissue-derived ACM scaffold; corneal epithelial and stromal cells seeded, species/origin of the seeded cells not further specified beyond 'corneal' in the retrieved abstract)",yes,partial,yes,yes,no,yes,no,"preclinical (animal model, rabbit)",medium,"An allogeneic cornea-derived matrix (ACM) fabricated from human corneal tissue discarded during transplantation surgery preserved collagen/GAG content and favorable optical/structural properties while significantly reducing DNA; in vitro, it supported formation of a continuous multi-stratified corneal epithelium (CK3/12+, Connexin43+, p63alpha+) and keratocyte marker expression (KERA+, integrin beta1+) in seeded stromal cells; implanted into rabbit corneal stromal pockets in vivo, the ACM-bearing corneas remained transparent throughout follow-up -- demonstrating feasibility of reusing surgical-waste donor corneal tissue as a bioengineered stromal implant material.",No quantitative optical transmittance or tensile mechanical values given in the retrieved abstract despite favorable-property claims; in vivo follow-up duration not specified numerically; relies on availability of discarded donor corneal tissue from allogeneic transplant surgeries (a supply-limited byproduct source); rabbit (not primate/human) in vivo model; no functional/visual-acuity outcome measures reported.,abstract_only
PUBMED_0398,33659091,2021,Biomedical optics express,10.1364/BOE.404096,stroma,collagen-based hydrogel corneal stroma equivalent,"collagen hydrogel (3.0 mg/mL collagen concentration) incorporating human corneal keratocytes, used as a 3D in vitro corneal stroma wound-healing model",human corneal keratocytes seeded at 5x10^5 cells/mL into collagen hydrogels (3.0 mg/mL collagen) to form a 3D corneal stroma-equivalent construct; a controlled traumatic wound (500 micron) introduced into a subset of constructs; mechanical properties of both unwounded and wounded constructs monitored longitudinally using a vibrational optical coherence elastography (OCE) system during continuous culture,human corneal keratocytes,human (corneal keratocytes),unclear / not reported in abstract,yes,partial,yes,no,no,no,early preclinical (in vitro),high,"A collagen hydrogel/keratocyte corneal stroma wound-healing model, monitored by vibrational OCE, showed a >3-fold increase in elastic modulus (2.95 to 11.0 kPa) and substantial thinning (1.034 to 0.464 mm) over 15 days in unwounded constructs, and a >4-fold modulus increase (1.488 to 6.639 kPa) in wound neo-tissue over 13 days -- demonstrating that OCE can quantitatively track the biomechanical maturation/remodeling of engineered corneal stroma tissue during wound healing in vitro.","In vitro only, no ex vivo, animal, or clinical evaluation; single collagen concentration and cell-seeding density tested; optical transparency of the construct not reported despite its relevance to functional corneal-substitute performance.",abstract_only
PUBMED_0430,34061862,2021,PloS one,10.1371/journal.pone.0245406,stroma,"decellularized xenogeneic (porcine) corneal scaffold, acellular vs. keratocyte-recellularized comparison","decellularized porcine corneal lenticules (250 micron thick), tested as acellular scaffolds versus scaffolds recellularized with human corneal stromal cells (keratocytes)","porcine corneal scaffolds decellularized to retain low residual DNA (14.89 +/- 5.56 ng/mg); in vitro cytotoxicity confirmed absent; scaffolds recellularized with human corneal stromal cells and cultured 14 days in serum-supplemented media, followed by a further 14 days in either serum-free or serum-supplemented media, to compare keratocyte phenotype induction; 250 micron thick decellularized lenticules (acellular vs. serum-free-cultured recellularized) implanted via rabbit anterior lamellar keratoplasty and followed for 3 months; post-mortem histology performed",human corneal stromal cells (keratocytes),"human (corneal stromal cells/keratocytes), seeded onto porcine decellularized scaffold (xenogeneic scaffold + human cell recellularization combination)",yes,partial,yes,yes,no,yes,no,"preclinical (animal model, rabbit) -- with a negative/cautionary translational finding regarding recellularization benefit",high,"Decellularized porcine corneal scaffolds (14.89 ng/mg residual DNA, non-cytotoxic) recellularized with human keratocytes under serum-free culture conditions achieved a native dendritic keratocyte phenotype with significantly upregulated keratocan, decorin, lumican, and CD34 expression versus serum-supplemented culture; however, in a 3-month rabbit anterior lamellar keratoplasty model, transparency was NOT restored in either acellular or keratocyte-recellularized implant groups, with both showing similar fibrotic 'regenerating zone' histology under the epithelium -- indicating that prior long-term keratocyte recellularization provided little in vivo benefit over acellular scaffolds alone, and that acellular controls should be used in future scaffold development to isolate whether cellularization is actually necessary.","Explicitly negative/null in vivo result: transparency not restored by 3 months in either group, limiting immediate clinical relevance of this particular implantation approach; xenogeneic (porcine) scaffold material carries immunogenicity considerations; rabbit (not primate/human) in vivo model; no numeric tensile/mechanical values given in the retrieved abstract; only a single recellularized lenticule showed reduced ALDH1A1 signal (small in vivo sample size implied); authors themselves note the study argues for including acellular controls going forward, indicating some uncertainty in interpreting cellularization's true effect.",abstract_only
PUBMED_0596,36239965,2022,Translational vision science & technology,10.1167/tvst.11.10.22,stroma,chemically crosslinked natural-polymer semi-interpenetrating network (semi-IPN) in situ-forming hydrogel,"collagen type I crosslinked with bifunctional polyethylene glycol (PEG) via N-hydroxysuccinimide (NHS) ester chemistry, formed in the presence of linear (non-crosslinked) hyaluronic acid (HA) to create a semi-interpenetrating polymer network (SIPN)","collagen type I crosslinked with bifunctional PEG-NHS in the presence of linear HA to form an in situ-gelling SIPN without external energy source (no light/heat trigger); gelation time and mechanical, optical, swelling, and degradation properties characterized; cytocompatibility with human corneal epithelial cells and corneal stromal stem cells (CSSCs) assessed in vitro, including spatial distribution of encapsulated CSSCs within the SIPN; in vivo wound healing evaluated by multimodal imaging in a rabbit anterior lamellar keratectomy injury model, followed by immunohistochemistry",human corneal epithelial cells and corneal stromal stem cells (CSSCs),human (corneal epithelial cells and corneal stromal stem cells),yes,yes,yes,yes,no,yes,no,"preclinical (animal model, rabbit)",high,"A collagen-hyaluronate semi-interpenetrating network (SIPN) hydrogel, formed in situ without an external energy source via PEG-NHS crosslinking of collagen in the presence of linear HA, achieved mechanical and optical properties similar to native cornea, was biocompatible with human corneal epithelial cells and enhanced corneal stromal stem cell (CSSC) viability/spatial distribution versus plain collagen gel, and in a 7-day rabbit anterior lamellar keratectomy model significantly reduced stromal defect size and promoted multilayered epithelial regeneration compared with controls -- positioning the SIPN as a promising alternative to keratoplasty and a tunable platform for corneal tissue engineering and cell delivery.","Short (7-day) in vivo follow-up, insufficient to establish long-term transparency, integration, or scarring outcomes; no quantitative transmittance, modulus, gelation-time, or defect-size-reduction numeric values given in the retrieved abstract despite significant-effect claims; rabbit (not primate/human) in vivo model; CSSC source/isolation details not specified in the retrieved abstract.",abstract_only
PUBMED_0601,36356877,2022,International journal of biological macromolecules,10.1016/j.ijbiomac.2022.11.021,stroma,natural-synthetic composite (semi-interpenetrating network) hydrogel,"silk fibroin (SF) / polyacrylamide (PA) semi-interpenetrating network hydrogels, fabricated at different SF:PA ratios","three-dimensional hydrogels fabricated via free-radical polymerization at different silk fibroin (SF) to polyacrylamide (PA) ratios, forming semi-interpenetrating network structures; characterized by scanning electron microscopy (pore structure), Fourier transform infrared spectroscopy (beta-sheet content), and rheology/handling (gelation kinetics); seeded with human corneal stromal cells for biological evaluation",human corneal stromal cells (keratocytes),human (corneal stromal cells),unclear / not reported in abstract,partial,yes,yes,no,no,no,early preclinical (in vitro),medium,"Silk fibroin/polyacrylamide semi-interpenetrating network hydrogels achieved rapid gelation (~3 min), high porosity (84%) with interconnected 25-66 micron pores, and -- when SF was incorporated -- enhanced human corneal stromal cell proliferation, GAG deposition, and keratocyte-gene expression versus PA alone, with no cytotoxicity, supporting their potential as an in-situ-gelling scaffold for corneal stromal tissue regeneration.","In vitro only, no ex vivo, animal, or clinical evaluation; no quantitative tensile strength/modulus or optical transmittance values reported; described by the authors themselves as an 'initial step' toward clinically applicable ocular implants.",abstract_only
PUBMED_0626,36729619,2023,Macromolecular bioscience,10.1002/mabi.202200422,stroma,cellularized 3D-bioprinted hydrogel tissue equivalent,3D-bioprinted hydrogel constructs loaded with mesenchymal stromal cells (MSCs),cellularized tissue equivalents produced by 3D bioprinting of a bioink loaded with mesenchymal stromal cells; constructs implanted intrastromally into ex vivo organ-cultured porcine corneas using femtosecond-laser-assisted intrastromal keratoplasty (creating a precise stromal pocket for implantation),mesenchymal stromal cells (MSCs),not specified by species/tissue origin in abstract,unclear / not reported in abstract,unclear / not reported in abstract,yes,no,yes,no,no,early preclinical (ex vivo organ-culture model),medium,"Femtosecond-laser-assisted intrastromal implantation of MSC-loaded 3D-bioprinted hydrogel constructs into ex vivo organ-cultured porcine corneas produced intact constructs with early cell survival, de novo ECM synthesis, and cell migration, but by day 14 the constructs contained few or no viable cells -- indicating that while the fabrication/implantation method is feasible, long-term cell survival within the implanted construct remains a key unresolved challenge, with bioink composition and cellularization identified as critical variables for future optimization.",Ex vivo organ-culture model only (no live animal or human clinical evaluation); poor cell survival by day 14 is a significant unresolved limitation; MSC source (species/tissue) not specified in abstract; no quantitative optical or mechanical data reported.,abstract_only
PUBMED_0688,37456580,2023,Bioactive materials,10.1016/j.bioactmat.2023.05.008,stroma,chemically crosslinked bioactive protein-PEG in situ-forming injectable hydrogel,PEG-Lysozyme hydrogel formed via in situ amidation reaction between 4-arm PEG-N-hydroxysuccinimide (PEG-NHS) and lysozyme,"4-arm-PEG-NHS reacted with lysozyme through an in situ amidation reaction, producing a sol-gel phase transition upon mixing/injection without external trigger; physicochemical properties (including modulus and tissue adhesion) tuned via the PEG:lysozyme component ratio to mimic native corneal modulus and withstand elevated intraocular pressure; evaluated in vitro with human corneal epithelial cells (HCECs) and in vivo via rabbit lamellar keratoplasty, with a newly established animal 'forging behavior' test used to assess functional visual restoration","human corneal epithelial cells (HCECs, in vitro growth/migration assay)","human corneal epithelial cells (in vitro only; no exogenous cell seeding in the in vivo arm, which relies on host tissue integration)",unclear / not reported in abstract,yes,yes,yes,no,yes,no,"preclinical (animal model, rabbit)",high,"A suture-free, injectable PEG-Lysozyme hydrogel, formed via in situ amidation between 4-arm-PEG-NHS and lysozyme, achieved a corneal-mimetic modulus and sufficient tissue adhesion to withstand elevated intraocular pressure, supported HCEC growth/migration in vitro via lysozyme bioactivity, and in a rabbit lamellar keratoplasty model formed a shape-adaptive, sutureless implant that promoted epithelialization, restored stromal integrity and normal corneal topology, and produced rapid functional visual restoration as measured by a novel animal forging-behavior test.","No quantitative modulus, adhesion-strength, or optical transmittance values given in the retrieved abstract despite tunability/adhesion claims; follow-up duration and sample size for the rabbit lamellar keratoplasty study not specified; the forging-behavior functional-vision test is a novel, non-standard assay whose validation against conventional visual-acuity measures is not described in the abstract.",abstract_only
PUBMED_0690,37476050,2023,Bioengineering & translational medicine,10.1002/btm2.10531,stroma,"decellularized xenogeneic, non-mammalian (marine) natural scaffold intended as a corneal stroma substitute","decellularized squid mantle scaffold (DSMS), decellularized using 0.5% sodium dodecyl sulfate (SDS) solution and optically cleared using the CUBIC (clear, unobstructed brain imaging cocktails) method","squid mantle chemically decellularized with 0.5% SDS solution; CUBIC tissue-clearing method applied to render the scaffold optically transparent; decellularization efficiency, essential amino acid composition, and fiber alignment characterized; in vitro cytotoxicity assessed via human corneal epithelial cell exposure to the DSMS soaking solution; in vivo biocompatibility and degradation assessed via rat intramuscular implantation; in vivo corneal integration assessed via a rabbit inter-corneal (stromal) implantation model","human corneal epithelial cells (used only for in vitro soaking-solution cytotoxicity testing; the implanted scaffold itself is acellular, with no exogenous cell seeding)","not applicable for the implanted scaffold (acellular); human corneal epithelial cells (line or primary, not further specified) used only for the in vitro cytotoxicity assay",yes,unclear / not reported in abstract,yes,yes,no,yes,no,"preclinical (animal model, rat and rabbit)",high,"A novel decellularized squid mantle scaffold (DSMS), rendered optically transparent via the CUBIC clearing method and retaining native fiber alignment and a favorable essential amino acid profile, was non-cytotoxic in vitro, fully biodegradable and biocompatible in a rat intramuscular model, and -- most notably -- promoted corneal stromal regeneration without evident rejection when implanted inter-corneally in a rabbit model, positioning marine-derived (squid mantle) decellularized tissue as a promising, low-cost, donor-independent alternative corneal stromal substitute.","No numeric optical transmittance or mechanical (modulus/tensile/suture-retention) values are reported despite qualitative claims of transparency and structural fiber integrity; rabbit (not human) model only, with no clinical evidence; exact in vivo follow-up duration and sample sizes not specified numerically in the retrieved abstract; long-term (beyond the study period) integration and immune response not assessed.",abstract_only
